Question Name,Question,Option A,Option B,Option C,Option D,Answer,Explanation
Question 669,6.  Who developed the normalization process:,a) E.F. codd,b) F.F. codd,c) E.E. codd,d) None of the mentioned,a,Explanation: Normalization helps in improving the quality of the data.
Question 670,7.  E.F.Codd developed the normalization process in the which early:,a) 1969,b) 1970,c) 1971,d) 1972,b,Explanation: Normalization helps in improving the quality of the data.
Question 671,8.  Which is a bottom-up approach to database design that design by examining the relationship between attributes:,a) Functional dependency,b) Database modeling,c) Normalization,d) Decomposition,c,Explanation: Normalization helps in improving the quality of the data.
Question 672,9.  Which is the process of breaking a relation into multiple relations:,a) Functional dependency,b) Database modeling,c) Normalization,d) Decomposition,d,Explanation: SQL-99 is the most recent version of standard SQL prescribed by the ANSI.
Question 673,"10.  Which formal method that locates and analyses relation schemas on the basis of their primary, candidate keys, and the FD’s that are present among the attributes of these schemas:",a) Functional dependency,b) Database modeling,c) Normalization,d) Decomposition,c,Explanation: Normalization helps in improving the quality of the data.
Question 674,1.  Which is refers to a stalemate situation due to which no further progress is possible as computer await response of each other:,a) Concurrency,b) Deadlock,c) Backup,d) Recovery,b,Explanation: Deadlock will stop further processing.
Question 675,2. Which is a duplicate copy of a file program that is stored on a different storage media than the original location:,a) Concurrency,b) Deadlock,c) Backup,d) Recovery,c,Explanation: Backup is required to take all the data.
Question 676,3. Which is duplication of computer operations and routine backups to combat any unforeseen problems:,a) Concurrency,b) Deadlock,c) Backup,d) Recovery,d,Explanation: Recovery means to take the backup data while there is a crash.
Question 677,4. Optimization that is basically related to the rewriter module is termed as__________,a) Semantic query optimization,b) Global query optimization,c) All of the Mentioned,d) None of the Mentioned,a,Explanation: SQL-99 is the most recent version of standard SQL prescribed by the ANSI.
Question 678,5. Optimization basically related to the Rewrite module is termed as_______,a) Semantic query optimization,b) Global query optimization,c) All of the Mentioned,d) None of the Mentioned,a,Explanation: SQL-99 is the most recent version of standard SQL prescribed by the ANSI.
Question 679,6. Database security helps organizations to protect data from _____,a) Internal users,b) External users,c) Non-external users,d) Non internal users,b,Explanation: External users are the people who do not involve in the processing of the database.
Question 680,7. Copying files to secondary or specific devices is known as ______,a) Retrieve,b) Backup,c) Recovery,d) Deadlock,b,Explanation: Backup is required to take all the data.
Question 681,8.  How many types of recovery control techniques:,a) 2,b) 3,c) 4,d) 5,a,Explanation: Recovery means to take the backup data while there is a crash.
Question 682,9. Which are types of recovery control techniques:,a) Deferred update,b) Immediate update,c) All of the Mentioned,d) None of the Mentioned,c,Explanation: Recovery means to take the backup data while there is a crash.
Question 683,10. Which server can joins the indexes when only multiple indexes combined can cover the query:,a) SQL,b) DBMS,c) RDBMS,d) All of the mentioned,a,Explanation: Indexing reduces the difficulty in searching the data.
Question 684,1. In concurrency control policy the the lock is obtained on,a) Entire database,b) A particular transaction alone,c) All the new elements,d) All of the mentioned,a,Explanation: It is to avoid deadlock.
Question 685,"2. A concurrency-control policy such as this one leads to ______ performance, since it forces transactions to wait for preceding transactions to finish before they can start.",a) Good,b) Average,c) Poor,d) Unstable,c,Explanation: It provides a poor degree of concurrency.
Question 686,3. __________ are used to ensure that transactions access each data item in order of the transactions’ ____ if their accesses conflict.,a) Zone,b) Relay,c) Line,d) Timestamps,d,"Explanation: When this is not possible, offending transactions are aborted and restarted with a new timestamp."
Question 687,5. In which scenario would you use the ROLLUP operator for expression or columns within a GROUP BY clause?,a) To find the groups forming the subtotal in a row,b) To create group-wise grand totals for the groups specified within a GROUP BY clause,"c) To create a grouping for expressions or columns specified within a GROUP BY clause in one direction, from right to left for calculating the subtotals","d) To create a grouping for expressions or columns specified within a GROUP BY clause in all possible directions, which is cross-tabular report for calculating the subtotals",c,Explanation: View is the temporary space created for the database.
Question 688,7. Which statement is true regarding external tables?,a) The default REJECT LIMIT for external tables is UNLIMITED,b) The data and metadata for an external table are stored outside the database,c) ORACLE_LOADER and ORACLE_DATAPUMP have exactly the same functionality when used with an external table,d) The CREATE TABLE AS SELECT statement can be used to unload data into regular table in the database from an external table,d,Explanation: This will replicate the table as in the select statement.
Question 689,8. A non-correlated subquery can be defined as ______,"a) A set of sequential queries, all of which must always return a single value","b) A set of sequential queries, all of which must return values from the same table",c) A SELECT statement that can be embedded in a clause of another SELECT statement only,d) A set of one or more sequential queries in which generally the result of the inner query is used as the search value in the outer query,d,Explanation: This will replicate the table as in the select statement.
Question 690,1. Which of the following is not a property of transactions?,a) Atomicity,b) Concurrency,c) Isolation,d) Durability,d,Explanation: ACID properties are the properties of transactions.
Question 691,2. SNAPSHOT is used for (DBA),a) Synonym,b) Tablespace,c) System server,d) Dynamic data replication,d,Explanation: Snapshot gets the instance of the database at that time.
Question 692,3. Isolation of the transactions is ensured by,a) Transaction management,b) Application programmer,c) Concurrency control,d) Recovery management,c,Explanation: ACID properties are the properties of transactions.
Question 693,4. Constraint checking can be disabled in existing _______________ and _____________ constraints so that any data you modify or add to the table is not checked against the constraint.,"a) CHECK, FOREIGN KEY","b) DELETE, FOREIGN KEY","c) CHECK, PRIMARY KEY","d) PRIMARY KEY, FOREIGN KEY",a,Explanation: Check and foreign constraints are used to constraint the table data. 
Question 694,5. Problems occurs if we don’t implement proper locking strategy,a) Dirty reads,b) Phantom reads,c) Lost updates,d) Unrepeatable reads,d,"Explanation: In a concurrent execution of these transactions, it is intuitively clear that they conflict, but this is a conflict not captured by our simple model. This situation is referred to as the phantom phenomenon, because a conflict may exist on “phantom” data. "
Question 695,6. Which of the following fixed database roles can add or remove user IDs?,a) db_accessadmin,b) db_securityadmin,c) db_setupadmin,d) db_sysadmin,a,Explanation: The database can be accessed by assigning the roles. 
Question 696,7. By default sql server has ___________ isolation level,a) READ COMMITTED,b) READ UNCOMMITTED,c) SERIALIZABLE,d) REPEATABLE READ,a,Explanation: Read committed is used to commit the default read operation. 
Question 697,8. Which of the following statements is/are not true for SQL profiler?,a) Enables you to monitor events,b) Check if rows are being inserted properly,c) Check the performance of a stored procedure,d) ALL of the mentioned,c,Explanation: Read committed is used to commit the default read operation. 
Question 698,9. Which of the following is the original purpose of SQL?,a) To specify the syntax and semantics of SQL data definition language,b) To specify the syntax and semantics of SQL manipulation language,c) To define the data structures,d) All of the mentioned,d,Explanation: Read committed is used to commit the default read operation. 
Question 699,10. SQL can be used to:,a) Create database structures only,b) Query database data only,c) Modify database data only,d) All of the mentioned,d,"Explanation: In a concurrent execution of these transactions, it is intuitively clear that they conflict, but this is a conflict not captured by our simple model. This situation is referred to as the phantom phenomenon, because a conflict may exist on “phantom” data. "
Question 700,"1. In order to maintain transactional integrity and database consistency, what technology does a DBMS deploy?",a) Triggers,b) Pointers,c) Locks,d) Cursors,c,Explanation: Locks are used to maintain database consistency. 
Question 701,2. A lock that allows concurrent transactions to access different rows of the same table is known as a,a) Database-level lock,b) Table-level lock,c) Page-level lock,d) Row-level lock,d,Explanation: Locks are used to maintain database consistency. 
Question 702,3. Which of the following are introduced to reduce the overheads caused by the log-based recovery?,a) Checkpoints,b) Indices,c) Deadlocks,d) Locks,d,Explanation: Checkpoints are introduced to reduce overheads caused by the log-based recovery. 
Question 703,4. Which of the following protocols ensures conflict serializability and safety from deadlocks?,a) Two-phase locking protocol,b) Time-stamp ordering protocol,c) Graph based protocol,d) None of the mentioned,b,Explanation: Time-stamp ordering protocol ensures conflict serializability and safety from deadlocks. 
Question 704,5. Which of the following is the block that is not permitted to be written back to the disk?,a) Dead code,b) Read only,c) Pinned,d) Zapped,c,Explanation:  A block that is not permitted to be written back to the disk is called pinned. 
Question 705,"6. If transaction Ti gets an explicit lock on the file Fc in exclusive mode, then it has an ________________ on all the records belonging to that file.",a) Explicit lock in exclusive mode,b) Implicit lock in shared mode,c) Explicit lock in shared mode,d) Implicit lock in exclusive mode,d,"Explanation:   If transaction Ti gets an explicit lock on the file Fc in exclusive mode, then it has an implicit lock in exclusive mode on all the records belonging to that file. "
Question 706,7. Which refers to a property of computer to run several operation simultaneously and possible as computers await response of each other,a) Concurrency,b) Deadlock,c) Backup,d) Recovery,a,"Explanation:  Concurrency is a property of systems in which several computations are executing simultaneously, and potentially interacting with each other. "
Question 707,8. All lock information is managed by a __________ which is responsible for assigning and policing the locks used by the transactions.,a) Scheduler,b) DBMS,c) Lock manager,d) Locking agent,c,Explanation:  A distributed lock manager (DLM) provides distributed software applications with a means to synchronize their accesses to shared resources. 
Question 708,9. The ____ lock allows concurrent transactions to access the same row as long as they require the use of different fields within that row.,a) Table-level,b) Page-level,c) Row-level,d) Field-level,d,Explanation:  Lock is limited to the attributes of the relation. 
Question 709,10. Which of the following is a procedure for acquiring the necessary locks for a transaction where all necessary locks are acquired before any are released?,a) Record controller,b) Exclusive lock,c) Authorization rule,d) Two phase lock,d,Explanation:  Two-phase lock is a procedure for acquiring the necessary locks for a transaction where all necessary locks are acquired before any are released. 
Question 710,1. A system is in a ______ state if there exists a set of transactions such that every transaction in the set is waiting for another transaction in the set.,a) Idle,b) Waiting,c) Deadlock,d) Ready,c,Explanation: When one data item is waiting for another data item in a transaction then system is in deadlock. 
Question 711,2. The deadlock state can be changed back to stable state by using _____________ statement.,a) Commit,b) Rollback,c) Savepoint,d) Deadlock,b,Explanation: Rollback is used to rollback to the point before lock is obtained. 
Question 712,3. What are the ways of dealing with deadlock ?,a) Deadlock prevention,b) Deadlock recovery,c) Deadlock detection,d) All of the mentioned,d,"Explanation: Deadlock prevention is also called as deadlock recovery.Prevention is commonly used if the probability that the system would enter a deadlock state is relatively high; otherwise, detection and recovery are more efficient. "
Question 713,"4. When transaction Ti requests a data item currently held by Tj , Ti is allowed to wait only if it has a timestamp smaller than that of Tj (that is, Ti is older than Tj ). Otherwise, Ti is rolled back (dies). This is",a) Wait-die,b) Wait-wound,c) Wound-wait,d) Wait,a,Explanation: The wait–die scheme is a non-preemptive technique. 
Question 714,"5. When transaction Ti requests a data item currently held by Tj , Ti is allowed to wait only if it has a timestamp larger than that of Tj (that is, Ti is younger than Tj ). Otherwise, Tj is rolled back (Tj is wounded by Ti ). This is",a) Wait-die,b) Wait-wound,c) Wound-wait,d) Wait,c,Explanation: The wound–wait scheme is a preemptive technique. It is a counterpart to the wait–die scheme. 
Question 715,6. The situation where the lock waits only for a specified amount of time for another lock to be released is,a) Lock timeout,b) Wait-wound,c) Timeout,d) Wait,a,"Explanation: The timeout scheme is particularly easy to implement, and works well if transactions are short and if longwaits are likely to be due to deadlocks. "
Question 716,7. The deadlock in a set of transaction can be determined by,a) Read-only graph,b) Wait graph,c) Wait-for graph,d) All of the mentioned,a,Explanation: Each transaction involved in the cycle is said to be deadlocked. 
Question 717,8. A deadlock exists in the system if and only if the wait-for graph contains a ___________,a) Cycle,b) Direction,c) Bi-direction,d) Rotation,a,Explanation: Each transaction involved in the cycle is said to be deadlocked. 
Question 718,9. Selecting the victim to be rollbacked to the previous state is determined by the minimum cost. The factors determining cost of rollback is,"a) How long the transaction has computed, and how much longer the transaction will compute before it completes its designated task",b) How many data items the transaction has used,c) How many more data items the transaction needs for it to complete,d) All of the mentioned,d,Explanation: We should roll back those transactions that will incur the minimum cost. 
Question 719,10. __________ rollback requires the system to maintain additional information about the state of all the running transactions.,a) Total,b) Partial,c) Time,d) Commit,b,Explanation: In total rollback abort the transaction and then restart it. 
Question 720,1. In a granularity hierarchy the highest level represents the,a) Entire database,b) Area,c) File,d) Record,a,Explanation: This level is the root of the tree.
Question 721,2. In a database the file  is contained in ________,a) Entire database,b) Two area,c) One area,d) more than one area,c,Explanation: This level is below the root of the tree.
Question 722,"3. If a node is locked in an intention mode, explicit locking is done at a lower level of the tree. This is called",a) Intention lock modes,b) Explicit lock,c) Implicit lock,d) Exclusive lock,a,"Explanation: There is an intention mode associated with shared mode, and there is one with exclusive mode."
Question 723,"4. If a node is locked in __________ explicit locking is being done at a lower level of the tree, but with only shared-mode locks.",a) Intention lock modes,b) Intention-shared-exclusive mode,c) Intention-exclusive (IX) mode,d) Intention-shared (IS) mode,a,"Explanation: There is an intention mode associated with shared mode, and there is one with exclusive mode."
Question 724,"5. If a node is locked in ____________ then explicit locking is being done at a lower level, with exclusive-mode or shared-mode locks.",a) Intention lock modes,b) Intention-shared-exclusive mode,c) Intention-exclusive (IX) mode,d) Intention-shared (IS) mode,c,"Explanation: There is an intention mode associated with shared mode, and there is one with exclusive mode."
Question 725,"6. If a node is locked in ______________ the subtree rooted by that node is locked explicitly in shared mode, and that explicit locking is being done at a lower level with exclusive-mode locks.",a) Intention lock modes,b) shared and intention-exclusive (SIX) mode,c) Intention-exclusive (IX) mode,d) Intention-shared (IS) mode,b,"Explanation: There is an intention mode associated with shared mode, and there is one with exclusive mode."
Question 726,7. ____________ denotes the largest timestamp of any transaction that executed write(Q) successfully.,a) W-timestamp(Q),b) R-timestamp(Q),c) RW-timestamp(Q),d) WR-timestamp(Q),a,Explanation: The most common method for doing ordering transaction is to use a timestamp-ordering scheme.
Question 727,8. The _____________ ensures that any conflicting read and write operations are executed in timestamp order.,a) Timestamp-ordering protocol,b) Timestamp protocol,c) W-timestamp,d) R-timestamp,a,Explanation: The most common method for doing ordering transaction is to use a timestamp-ordering scheme.
Question 728,"9. The __________ requires that each transaction Ti executes in two or three different phases in its lifetime, depending on whether it is a read-only or an update transaction.",a) Validation protocol,b) Validation-based protocol,c) Timestamp protocol,d) Timestamp-ordering protocol,a,Explanation: A concurrency-control scheme imposes overhead of code execution and possible delay of transactions. It may be better to use an alternative scheme that imposes less overhead.
Question 729,"10. This validation scheme is called the _________ scheme since transactions execute optimistically, assuming they will be able to finish execution and validate at the end.",a) Validation protocol,b) Validation-based protocol,c) Timestamp protocol,d) Optimistic concurrency-control,a,Explanation: A concurrency-control scheme imposes overhead of code execution and possible delay of transactions. It may be better to use an alternative scheme that imposes less overhead.
Question 730,1. The most recent version of standard SQL prescribed by the American National Standards Institute is,a) SQL 2011,b) SQL 2002,c) SQL – 4,d) SQL2,a,Explanation:  SQL-99 is the most recent version of standard SQL prescribed by the ANSI.
Question 731,2. ANSI-standard SQL allows the use of special operators in conjunction with the WHERE clause.  A special operator used to check whether an attribute value is null is,a) BETWEEN,b) IS NULL,c) LIKE,d) IN,b,Explanation: Exists is used to check whether an attribute value is null or not in conjunction with the where clause. 
Question 732,3. A lock that prevents the use of any tables in the database from one transaction while another transaction is being processed is called a,a) Database-level lock,b) Table-level lock,c) Page-level lock,d) Row-level lock,a,Explanation:  Data base-level lock prevents the use of any tables in the data base from one transaction while other transaction is being processed.
Question 733,4. A condition that occurs when two transactions wait for each other to unlock data is known as a(n),a) Shared lock,b) Exclusive lock,c) Binary lock,d) Deadlock,a,Explanation:  Deadlock occurs when two transactions wait for each other to unlock data.
Question 734,5. _______ means that data used during the execution of a transaction cannot be used by a second transaction until the first one is completed.,a) Serializability,b) Atomicity,c) Isolation,d) Time stamping,c,Explanation:  Isolation means that data used during the execution of a transaction can’t be used by a second transaction until the first one is completed..
Question 735,6. A unit of storage that can store one or more records in a hash file organization is denoted as,a) Buckets,b) Disk pages,c) Blocks,d) Nodes,a,Explanation:  Buckets are used to store one or more records in a hash file organization.
Question 736,7. The file organization which allows us to read records that would satisfy the join condition by using one block read is,a) Heap file organization,b) Sequential file organization,c) Clustering file organization,d) Hash files organization,c,Explanation: Clustering file organization allows us to read records that would satisfy the join condition by using one block read. 
Question 737,8. Which of the following is not true about B+ trees?,a) B+ tree index takes the form of balanced tree,b) Performance of B+ tree degrades as the file grows,c) Look-up in B+ tree is straightforward and efficient,d) Insertion and deletion in B+ tree is complicated but efficient,b,Explanation: The answer is evident .
Question 738,9. The extent of the database resource that is included with each lock is called the level of,a) Impact,b) Granularity,c) Management,d) DBMS control,b,Explanation:  The extent of the data base resource that is included with each lock is called the level of Granularity.
Question 739,10. DBMS periodically suspends all processing and synchronizes its files and journals through the use of,a) Checkpoint facility,b) Backup facility,c) Recovery manager,d) Database change log,a,Explanation: DBMS periodically suspends all processing and synchronizes its files and journals though the use of  Check point facility.
Question 740,1. Snapshot isolation is a particular type of ______________ scheme.,a) Concurrency-control,b) Concurrency-allowance,c) Redirection,d) Repetition-allowance,a,"Explanation: It has gained wide acceptance in commercial and open-source systems, including Oracle, PostgreSQL, and SQL Server."
Question 741,2. Snapshot isolation is used to give,a) Transaction a snapshot of the database,b) Database a snapshot of the transaction,c) Database a snapshot of committed values in the transaction,d) Transaction a snapshot of the database and Database a snapshot of committed values in the transaction,d,Explanation: The data values in the snapshot consist only of values written by committed transactions.
Question 742,3. Lost update problem is,a) Second update overwrites the first,b) First update overwrites the second,c) The updates are lost due to conflicting problem,d) None of the mentioned,a,Explanation: Lost update problem has to be resolved.
Question 743,4. Under first updater wins the system uses a __________ mechanism that applies only to updates.,a) Close,b) Read,c) Locking,d) Beat,c,"Explanation: Reads are unaffected by this, since they do not obtain locks."
Question 744,"5. When a transaction Ti attempts to update a data item, it requests a _________ on that data item.",a) Read lock,b) Update lock,c) Write lock,d) Chain lock,c,"Explanation: Reads are unaffected by this, since they do not obtain locks."
Question 745,"6. Each of a pair of transactions has read data that is written by the other, but there is no data written by both transactions, is referred to as",a) Read skew,b) Update skew,c) Write lock,d) None of the mentioned,d,Explanation: Write skew is the issue addressed here.
Question 746,7. An application developer can guard against certain snapshot anomalies by appending a ______ clause to the SQL select query.,a) For update,b) For read,c) For write,d) None of the mentioned,a,Explanation: Adding the for update clause causes the system to treat data that are read as if they had been updated for purposes of concurrency control.
Question 747,10. In which scenario would you use the ROLLUP operator for expression or columns within a GROUP BY clause?,a) To find the groups forming the subtotal in a row,b) To create group-wise grand totals for the groups specified within a GROUP BY clause,"c) To create a grouping for expressions or columns specified within a GROUP BY clause in one direction, from",right to left for calculating the subtotals,c,Explanation: Sequence is used to generate a series of values.
Question 748,1. Which statements are correct regarding indexes?,"a) When a table is dropped, the corresponding indexes are automatically dropped","b) For each DML operation performed, the corresponding indexes are automatically updated",c) A non-deferrable PRIMARY KEY or UNIQUE KEY constraint in a table automatically creates a unique index,d) All of the mentioned,d,Explanation: Indexes are used to access the data efficiently.
