Question Name,Question,Option A,Option B,Option C,Option D,Answer,Explanation
Question 496,"6.	After pre-amplification the signals are fed into",a) an electronic switch,b) a signal generator,c) a rectifier,d) a regulator,a,"Explanation: In a Dual Trace Oscilloscope, after the pre amplification process is done, the signals are fed into an electronic switch. The switch passes one channel at a time through the delay line."
Question 497,"7.	X-Y mode means",a) 2 modes,b) vertical and horizontal,c) x axis and y axis,d) ground and full line supply,b,"Explanation: In a Dual Trace Oscilloscope, X-Y mode means the oscilloscope operates from the first channel A as a vertical signal and from the second channel B as a horizontal signal."
Question 498,"8.	Electronic switch is controlled by",a) D flip-flop,b) SR flip-flop,c) T flip-flop,d) JK flip-flop,c,"Explanation: In the Dual Trace Oscilloscope, an electronic switch is controlled by making use of a T flip-flop which is also known as a toggle flip-flop. Switching occurs during the beginning of a new sweep."
Question 499,"9.	Which technique of a Dual Trace Oscilloscope maintains the phase between the signals?",a) Analog mode,b) Mixed mode,c) Chop mode,d) Alternate mode,d,"Explanation: In a Dual Trace Oscilloscope, the alternate mode of operation enables to maintain the correct phase relationship between the signals from the channels A and B.  "
Question 500,"2.	Signals are applied to ___________",a) input,b) gain control stage,c) output,d) capacitor,b,"Explanation: In a dual trace oscilloscope, the signals are applied to the gain control as well as the gate control stage. "
Question 501,"3.	What adjusts the amplitudes of the signals A and B?",a) L1 and L2,b) C1 and C2,c) R1 and R2,d) Oscillator,c,"Explanation: In a dual trace oscilloscope, the resistances R1 and R2 are used for adjusting the magnitudes of the amplitudes of the signals A and B of the two channels A and B."
Question 502,"4.	What is the role of a square wave generator?",a) generates square waves,b) generates triangular waves,c) generates saw-tooth signals,d) generates alternate inputs,d,Explanation: A square wave generator in a dual trace oscilloscope provides alternate biasing signals to the switches Q3 and Q4.
Question 503,"5.	How many switches work at a time?",a) 1,b) 3,c) 2,d) 5,a,"Explanation: In a dual trace oscilloscope, the square wave generator provides alternate bias signals to the switches Q3 and Q4. When Q3 is conducting, Q4 remains off while Q3 is off, Q4 conducts."
Question 504,"7.	A multitrace oscilloscope makes use of __________",a) three traces,b) two traces,c) many traces,d) one trace,c,"Explanation: In a multitrace oscilloscope, a signle electron beam is used. It makes use of several traces by switching the the Y deflection plates from one input signal to the other."
Question 505,"8.	A dual beam oscilloscope has __________",a) 2 beams,b) 4 beams,c) 6 beams,d) 8 beams,a,"Explanation: In a dual beam oscilloscope, the beams are deflected horizontally by means of a common set of plates. Each electron beam has its own set of vertical deflection plates."
Question 506,"9.	Two voltages can be studied simultaneously by making use of __________",a) single electron gun,b) two electron guns,c) four electron guns,d) six electron guns,b,"Explanation: On the Cathode Ray Oscilloscope, two voltages can be studied simultaneously by means of two electron guns generating two separate beams through a special cathode ray tube."
Question 507,"10.	A dual beam oscilloscope has __________",a) 8 vertical deflection plates,b) 6 vertical deflection plates,c) 2 vertical deflection plates,d) 4 vertical deflection plates,c,"Explanation: In a dual beam oscilloscope, there are two vertical deflection plates and two separate channels. Each channel consists of a preamplifier and an attenuator stage."
Question 508,"11.	Sweep generator is triggered by __________",a) oscillator,b) flip-flop,c) transformer,d) channel A or B,d,"Explanation: In a dual beam oscilloscope, the sweep generator is triggered internally by means of either the channel A signal or the channel B signal."
Question 509,"14.	In a multi-beam oscilloscope __________",a) single beam is produced,b) three beams are produced,c) many beams are produced,d) two beams are produced,c,"Explanation: In a multi-beam oscilloscope, several beams are produced from a single tube. Each system is made up of separate set of vertical deflection plates and a common time base system. "
Question 510,"1.	What is the main advantage of using a digital storage oscilloscope?",a) uses digital storage,b) uses analog storage,c) uses mixed mode storage,d) uses disc storage,a,Explanation: The disadvantage of a analog storage oscilloscope is overcome in a digital storage oscilloscope. The unreliable storage method in a analog storage oscilloscope is overcome in a digital storage oscilloscope. The digital storage oscilloscope makes use of digital storage for the memory.
Question 511,"3.	The waveform is stored in _________",a) compressed form,b) analog form,c) digital form,d) mixed form,c,Explanation: The waveform to be studied is stored in digital form in the digital storage oscilloscope. It is digitized and stored in a digital memory.
Question 512,"4.	Which oscilloscope is used in a digital storage oscilloscope?",a) multi trace,b) dual trace,c) modern,d) conventional,d,"Explanation: A digital storage oscilloscope makes use of a conventional cathode ray tube. As a result, the cost is reduced."
Question 513,"5.	 Power requirement is _________",a) low,b) high,c) medium,d) zero,a,"Explanation:  In a digital storage oscilloscope, the power required by the memory is less. It can be supplied through the means of a small battery."
Question 514,"6.	 The stored image can be displayed _________",a) for a limited time,b) for infinite time,c) for zero time,d) for an intermediate time,b,"Explanation: In a digital storage oscilloscope, the stored image can be displayed for a long time as long as the power supply to the digital memory is kept intact without any kind of disruption."
Question 515,"7.	 The analog signal is digitized using _________",a) D/A converter,b) Oscillator,c) A/D converter,d) Rectifier,c,"Explanation: In a digital storage oscilloscope, the analog signal is digitized by making use of an analog to digital converter. After digitizing the waveform is loaded into a computer and can be analyzed."
Question 516,"8.	How is the data displayed?",a) through a screen,b) through a computer,c) through an FPGA,d) through a microprocessor,d,"Explanation: In a digital storage oscilloscope, the data is displayed by passing it through a microprocessor which processes the data and displays the waveform onto a screen."
Question 517,"9.	A digital storage oscilloscope has _________",a) 3 modes,b) 2 modes,c) 4 modes,d) 5 modes,a,"Explanation: In a digital storage oscilloscope, there are three modes of operation. They are as follows:•	Store•	Roll•	Hold or Save."
Question 518,1. By making use of a CRO _________,a) many characteristics of a signal can be measured,b) only a few characteristics of a signal can be measured,c) no characteristics of a signal can be measured,d) signal can only be displayed,a,"Explanation: Through the means of a Cathode Ray Oscilloscope, most of the characteristics of an input signal can be measured. Properties of a signal can be studied as well."
Question 519,2. How is the waveform adjusted?,a) by adjusting the voltage,b) through shift controls,c) by reducing the current,d) by means of a galvanometer,b,"Explanation: In a Cathode Ray Oscilloscope, the waveform can be adjusted by means of shift controls. As a result, the measurement of divisions corresponding to the amplitude becomes easy."
Question 520,3. How is error in measurement reduced?,a) using r.m.s value,b) using absolute value,c) using peak to peak value,d) using a voltmeter,c,"Explanation: In a Cathode Ray Oscilloscope, the error in measurement is reduced by making use of the peak to peak value. "
Question 521,8. Period of a waveform is obtained by the relation.,a) T=number of divisions occupied by 1 cycle_(time),b) T=number of divisions occupied by 1 cycle_(1⁄division),c) T=number of divisions occupied by 1 cycle_(time⁄division),d) T=number of divisions occupied by 1 cycle,c,"Explanation: The time period of a waveform is obtained by using the relation,T=number of divisions occupied by 1 cycle_(time⁄division)."
Question 522,9. How is frequency related to time period?,a) square proportional,b) not related,c) directly proportional,d) inversely proportional,c,"Explanation: Frequency is inversely proportional to the time period of any given signal.f = 1⁄twhere, f is the frequency            T is the time period."
Question 523,1. How many types of acquisition methods are there in a digital storage oscilloscope?,a) 3,b) 6,c) 2,d) 4,a,"Explanation: In a digital storage oscilloscope, there are three methods in which a digital signal can be captured and stored. They are as follows:	Real time sampling	Random repetitive sampling	Sequential repetitive sampling."
Question 524,"3. In which method of acquisition, pretrigger event is lost?",a) Real time sampling,b) Random repetitive sampling,c) Sequential repetitive sampling,d) Analog Sampling,c,"Explanation: In Sequential repetitive sampling, pretrigger information cannot be captured. And the pretrigger view is lost. It can be used only in microwave digital oscilloscope as a result."
Question 525,4. In Sequential repetitive sampling how many samples are captured?,a) ten,b) five,c) two,d) one,:,"Explanation: In Sequential repetitive sampling, one sample is captured at a controlled time delay of tds. After each point is captured, the delay is increased by a small amount tse/sub>.  "
Question 526,6. Nyquist criteria states that,a) Fs = fmax/2,b) Fs ≥ 2fmax,c) Fs = fmax,d) Fs = 2,b,"Explanation: Nyquist criteria states that the sampling rate is twice the maximum frequency. It is given by the relation.Fs≥2fmaxwhere, Fs is the sampling rate             fmax is the maximum frequency."
Question 527,7. What plays an important role in Real time sampling?,a) small memory and fast sampling,b) large memory and slow sampling,c) large memory and fast sampling,d) small memory and slow sampling,c,"Explanation: In Real time sampling, a higher sampling rate is required to capture long time interval signal capturing. Large memory and a fast sampling rate are the characteristic feature of real time sampling."
Question 528,8. A single trigger event can capture how many samples in Real time sampling?,a) 1,b) nm/2,c) 2nm,d) nm,d,"Explanation: In Real time sampling, a trigger event can be used to capture as much asnm samples. The waveform is then displayed on a digital storage oscilloscope."
Question 529,9. In Real time sampling what is the 3 dB bandwidth?,a) fs/4,b) fs/8,c) 2fs,d) fs,a,"Explanation: In Real time sampling, the 3 dB bandwidth is set to fs/4 with an overshoot of 5%. Here fs is the sampling frequency."
Question 530,1. CRO is used for measurement of __________,a) AC as well as DC current,b) AC current only,c) DC current only,d) AC power only,a,"Explanation: A Cathode Ray Oscilloscope is used for the measurement of AC as well as DC current. It is used for the calculation peak to peak voltage, r.m.s value, duty cycle etc."
Question 531,2. CRO is used in a radar for __________,a) studying the pattern of flights,b) visualizing a target,c) measuring voltage,d) determining the distance between source and destination,b,"Explanation: A Cathode Ray Oscilloscope is used in a radar for visualizing a target such as an aeroplane, ship etc."
Question 532,"3. In radio applications, CRO is used for measuring __________",a) audio frequency range,b) a narrow range of frequencies,c) a wide range of frequencies,d) radio frequency range,c,"Explanation: By making use of a Cathode Ray Oscilloscope, a wide range of frequencies can be measured. The radio frequency, audio frequency and intermediate frequency signals can be measured by making use of a CRO."
Question 533,4.   In medical applications CRO can be used for __________,a) measuring the heart beats,b) monitoring the brain,c) improving the nervous system functioning,d) displaying cardiograms,d,"Explanation: A Cathode Ray Oscilloscope, can be used in medical applications for displaying cardiograms. Cardiograms are used for diagnosing the condition of heart of a patient. Electromyograms are used for studying the condition of a patient’s muscle."
Question 534,7. Curve tracers use CRO in __________,a) diodes,b) passive devices,c) active devices,d) op amps,c,"Explanation: Curve tracers in a Cathode Ray Oscilloscope are used for testing active devices such as vacuum tubes, transistors and integrated circuits."
Question 535,8. A CRO is used in check __________,a) op amps,b) resistors,c) voltage,"d) capacitance, inductance and diodes",d,Explanation: A Cathode Ray Oscilloscope is used for checking diodes. It is also used in the measurement of inductances and capacitances. A CRO can also be used for detecting the faults in a circuit. 
Question 536,9. A CRO is used in labs for __________,a) frequency measurement,b) voltage measurement,c) current measurement,d) resistance measurement,a,"Explanation: A Cathode Ray Oscilloscope is used in the laboratory for the measurement of frequency, phase and period of a signal. The periodic as well as non-periodic relationships of signals can also be studied."
Question 537,"1.	What is a data acquisition system?","a) system used for data processing, conversion and transmission",b) accepts data as an input,c) removes noise,d) boosts the signal,a,"Explanation: A data acquisition system basically is used for the processing of data. It is also used for data conversion, data transmission and storage of data."
Question 538,"2.	A typical data acquisition system consists of __________",a) op amps,b) sensors,c) rectifiers,d) transistors,b,"Explanation: Data acquisition system consists of sensors. It also consists of suitable signal conditioners, data converters, data processors, data handlers, storage and display systems."
Question 539,"3.	The data acquisition system implies input data collection.",a) in mixed signal form,b) in analog form,c) in digital form,d) in the form of binary codes,c,"Explanation: In a data acquisition system, input data is collected in the form of digital signals. The digital signals are collected in a fast, economic, reliable and accurate manner."
Question 540,"4.	Data measurement systems are __________",a) not flexible,b) rigid,c) less flexible,d) more flexible,d,Explanation: The data acquisition system are more flexible and easily programmable nowadays as a result of development in the automation field.
Question 541,"7.	A data acquisition system provides __________",a) partial communication,b) ineffective communication,c) effective communication,d) complete communication,c,Explanation: The data acquisition system must be able to provide proper human communication to minimize the unit availability and maximize the unit output at a lower cost.
Question 542,"8.	Data acquisition system can be used in  __________",a) 10 ways,b) 8 ways,c) 4 ways,d) 2 ways,d,"Explanation: A data acquisition system can be used to measure and record the signals in two ways. In the first method the signal can be directly measured from electrical quantities such as a.c., d.c. voltage or current. In the second case the signal originates from transducers such as pressure transducer, thermocouple etc.   "
Question 543,"9.	Data acquisition system is mainly classified into __________",a) 2 types,b) 4 types,c) 6 types,d) 8 types,a,Explanation: A data acquisition system is basically classified into two main types. They are analog and digital. While the analog data system deals with signals having analog input signals the digital data system consists of input signals in digital form.
Question 544,"1.	Transducer is used to convert a _________",a) physical quantity into an electrical signal,b) electrical signal into a physical quantity,c) physical quantity into a mechanical quantity,d) physical quantity into a chemical quantity,a,"Explanation: Transducer forms one of the most important components of an analog data acquisition system. It converts a physical quantity into an electrical signal. Strain gauge, thermocouples, piezoelectric devices are the most widely used transducers."
Question 545,"2.	Transducer produces a _________",a) proportional current,b) proportional voltage,c) proportional resistance,d) proportional power,b,Explanation: A transducer generates a voltage proportional to the physical quantity that is being measured. The voltage output from a transducer forms the input to a data acquisition system.
Question 546,"3.	Sensors produce frequency which is counted by _________",a) a chemical counter,b) a mechanical counter,c) an electronic counter,d) a basic counter,c,Explanation: Transducers consist of special sensors used to produce frequency that can be counted by means of an electronic counter. This frequency forms an integral part of the frequency measured.
Question 547,"4.	Signal conditioner is used for _________",a) attenuating the voltage,b) maintaining a constant voltage,c) keeping the voltage zero,d) boosting the voltage,d,Explanation: Signal conditioner is an important part of an analog data acquisition system. A signal conditioner converts the output voltage to the desired form which is accepted by the next stage.
Question 548,"5.	A multiplexer is used for _________",a) accepting multiple inputs,b) accepting single input,c) accepting multiple outputs,d) accepting single output,a,Explanation: A multiplexer forms an important constituent of an analog data acquisition system. It takes multiple analog inputs. By making use of a multiplexer many quantities can be transmitted.
Question 549,"7.	Output signal is captured using _________",a) CRO,b) plotter,c) recorder,d) voltmeter,c,"Explanation: In a analog data acquisition system, the output signal is recorded by means of an analog recorder. It includes the likes of strip chart recorder, magnetic tape recorder etc."
Question 550,"8.	Analog computers have __________",a)  zero cost,b) intermediate cost,c) more cost,d) less cost,d,Explanation: The accuracy of digital computers is more than that of analog computers. Analog computers are widely used when compared to digital computers because of their less cost. 
Question 551,"1.	A/D converter is used for __________",a) converting analog to digital,b) converting digital to analog,c) converting digital to mixed signal mode,d) converting analog to mixed signal mode,a,"Explanation: In a digital data acquisition system, an A/D converter is used for the purpose of converting analog signals to digital. "
Question 552,"2.	Output of A/D converter is _________",a) given to an analog display,b) given to a digital display,c) given to a CRO,d) given to an voltmeter,b,Explanation: Output from the analog to digital converter is given to a digital display device or to a digital recorder for the purpose of displaying or recording. 
Question 553,"3.	What are auxiliary equipments?",a) equipments,b) guard rings,c) devices,d) voltage source,c,Explanation: Auxiliary equipments are basically devices used for system programming functions and digital data processing applications. 
Question 554,"4.	What is the main function of auxiliary equipment?",a) unit step response,b) ramp response,c) non-linear response,d) linear response,d,Explanation: The typical functions of auxiliary equipments include linearization and limit compression for the input signals. Individual instruments or a digital computer is used to perform these functions.
Question 555,"5.	What is a digital recorder?","a)	records digital data","b)	records analog data","c)	does not record data","d)	records both analog and digital data",a,"Explanation: A digital recorder is used for the purpose of recording the digital data. Punched cards, magnetic tape recorders, type written pages, etc make use of digital recorders."
Question 556,"7.	For lower accuracies _________",a) digital acquisition system is used,b) both digital and analog acquisition systems are used,c) analog acquisition system is used,d) mechanical data acquisition system is sued,c,"Explanation: When low values of accuracy is required, analog data acquisition system is used. This includes a wide frequency bandwidth as well."
Question 557,"8.	Digital acquisition systems are used when _________",a) bandwidth is high,b) bandwidth is medium,c) bandwidth is zero,d) bandwidth is low,d,"Explanation: When the bandwidth required is low, usually digital acquisition systems are made use of. For higher accuracy and lower per channel cost, digital data acquisition systems are used."
Question 558,"2.	A/D conversion rate is __________",a) variable,b) predefined,c) zero,d) constant,b,"Explanation: In a single channel data acquisition system, the conversion rate of an analog to digital converter is predefined. A/D converter performs the conversions at a pre-determined rate."
Question 559,"3.	The buffer output is ________",a) analog,b) zero,c) digital,d) mixed mode,c,"Explanation: In a single channel data acquisition system, the output of the buffer circuitry is digital in nature. It is stored in a digital computer or a storage device or sometimes even a printer."
Question 560,"4.	The best example for a single channel data acquisition system is",a) CPM,b) BPM,c) APM,d) DPM,d,Explanation: A digital panel meter usually abbreviated as DPM is the best example for a single channel data acquisition system. 
Question 561,"5.	 Digital outputs are obtained from",a) A/D converter,b) D/A converter,c) Oscilloscope,d) Voltage source,a,Explanation: An analog to digital converter provides digital outputs. The A/D converters are designed in such a way that they accept external commands in order to convert and hold the operations.
Question 562,"7.	Which technique is most widely used in the single channel data acquisition system?",a) Counter type approximation,b)  Flash approximation,c) Successive approximation,d) Delta Sigma approximation,c,Explanation: The successive approximation technique is most widely used in a single channel data acquisition system. This is due to the fact that it has a high value of resolution and a high speed.
Question 563,"8.	What is pre-amplification?",a) reducing the magnitude of a signal,b) making the magnitude of a signal zero,c) reducing the noise,d) boosting the signal,d,"Explanation: To match the input needs, the level of an input signal is boosted. This is done as the magnitude of the input signal is sometimes very low. This is known as pre-amplification."
Question 564,"9.	How can the input be isolated from the system?",a) using optocouplers,b) using op-amps,c) using a capacitor,d) using rectifiers,a,"Explanation: By making use of an optocoupler, we can isolate the input signal from the system. Before processing the data, pre-amplifiers are fitted with active filters so as to eliminate the noise and boost the signal."
Question 565,"1.	Multichannel data acquisition system has",a) multiple channels,b) single channel,c) two channels,d) five channels,a,Explanation: A multichannel data acquisition system has multiple channels. The various subsystems can be shared in terms of time by more than two or more input sources.
Question 566,"2.	How many types of multiplexed system exist?",a) 2,b) 3,c) 5,d) 10,b,"Explanation: In general there are three types of multiplexed systems. They are as follows:•	Multichannel Analog Multiplexed System•	Multiplexing Output of Sample/Hold Circuits•	Multiplexing after A/D Conversion."
Question 567,"3.	Multichannel Analog Multiplexed System is",a) very fast,b) fast,c) slow,d) moderate,c,"Explanation: The Multichannel Analog Multiplexed System is one type of multiplexed system. It is comparatively slow. As it shares more than one channel, the cost is less."
Question 568,"4.	Multichannel Analog Multiplexed System utilises time",a) using a transformer,b) using a capacitor,c) using a flip-flop,d) using a mux,d,Explanation: Multichannel Analog Multiplexed System is one type of multiplexed system. It makes use of a multiplexer (mux) to utilise the time. The previous data stored in the sample and hold circuit gets converted into digital form.
Question 569,"5.	In a Multichannel Analog Multiplexed System",a) A/D converter is used,b) D/A converter is used,c) Sigma delta converter is used,d) Modulator is used,a,"Explanation: In a Multichannel Analog Multiplexed System, individual analog signals are applied directly. The signals are amplified and conditioned. An A/D converter then converts the signals into digital form."
Question 570,"7.	Many channels can be monitored at the same time by",a) Demultiplexing,b) A/D conversion,c) Multiplexing,d) D/A conversion,c,Explanation: Monitoring of a number of channels can be done at the same time by multiplexing the outputs of the sample and hold circuit. 
Question 571,"8.	Multiplexing after A/D conversion involves",a) noisy data,b) mixed signal data,c) analog data,d) digital data,d,"Explanation: Multiplexing after A/D conversion is also known as fast data acquisition. Digital data performs logical operation and depending on the relative speed, the scan rate can be increased or decreased."
Question 572,"1.	What led to development of PC based transducers?",a) low cost,b) medium cost,c) high cost,d) zero cost,a,"Explanation: Easy availability, low cost and large scale usage of Personal Computers have led to the development of interfaces between PC and the transducer outputs."
