Question Name,Question,Option A,Option B,Option C,Option D,Answer,Explanation
Question 287,5. Magnetic fields between the parallel plates of a capacitor are due to?,a) Displacement current,b) Conduction current,c) Both conduction and displacement current,d) Neither conduction nor displacement current,a,Explanation: Displacement current is the current which arises due to variations in the field. Change in the field results in the formation of magnetic fields. Hence displacement currents lead to magnetic field between the plates of a capacitor.
Question 288,6. The free electrons in practical dielectrics are due to ________,a) There are no free electrons,b) Conductors,c) Impurities,d) Displacement currents,c,"Explanation: Ideally, dielectrics are insulators and do not contain any free electrons. But no dielectric is a perfect dielectric, hence the free electrons are due to impurities present in each dielectric."
Question 289,7. The flow of electrons which does not pass through the battery is known as ____________,a) Conduction current,b) Leakage current,c) Charging current,d) Displacement current,a,"Explanation: Conduction current is the flow of electrons from the positive plate of the capacitor to the negative plate of the capacitor, not through the battery. Hence the type of current which flows without passing through the battery is conduction current."
Question 290,1. Paper capacitor is a type of _________,a) Fixed capacitor,b) Variable capacitor,c) Either fixed or variable depending on its usage,d) Neither fixed nor variable,a,"Explanation: Paper capacitors are fixed capacitors because, like fixed capacitors, its capacitance value remains constant. In paper capacitors, paper is used as the dielectric."
Question 291,2. A capacitor using chemical reactions to store charge is _______,a) Paper capacitor,b) Ceramic capacitor,c) Polyester capacitor,d) Electrolyte capacitor,d,Explanation: Electrolyte capacitors use chemical processes like pyrolysis to store charge between its plates.
Question 292,"3. Which, among the following, is the odd one out?",a) Ceramic capacitor,b) Electrolyte capacitor,c) Tuning capacitor,d) Paper capacitor,c,"Explanation: All, ceramic capacitor, electrolyte capacitor and paper capacitor, are fixed capacitors whereas tuning capacitors are a variable capacitor, hence it is the odd one out."
Question 293,"4. In a variable capacitor, capacitance can be varied by ______",a) Turning the rotatable plates in or out,b) Sliding the rotatable plates,c) Changing the plates,d) Changing the material of plates,a,"Explanation: As the plates are rotated, the area of the plates between which the field is, will vary. Capacitance depends on area, hence an area varies, capacitance also varies."
Question 294,5. The simplest kind of capacitor is ________,a) Ceramic capacitor,b) Electrolyte capacitor,c) Tuning capacitor,d) Paper capacitor,d,"Explanation: The paper capacitor consists of two strips of aluminium foil separated by sheets of waxed paper. This whole setup is rolled up into the form of a cylinder. Since the materials requires for its construction are easily available, it is the simplest kind of capacitor."
Question 295,6.  Capacitor preferred when there is high frequency in the circuits is _______,a) Electrolyte capacitor,b) Mica capacitor,c) Air capacitor,d) Glass capacitor,b,Explanation: Mica capacitors are preferred for high frequency circuits because they have low ohmic losses and less reactance.
Question 296,7. The type of capacitors used in communication transmitters are?,a) Electrolyte capacitor,b) Variable capacitor,c) Air capacitor,d) Glass capacitor,b,Explanation: The variable capacitor is used to change the resonant frequency for fine modification to the communication transmitter.
Question 297,8. Which capacitors relatively costly?,a) Electrolyte capacitor,b) Mica capacitor,c) Air capacitor,d) Glass capacitor,b,"Explanation: Mica capacitors are relatively expensive because it consists either of alternate layers of mica and metal foil clamped tightly together, or of thin films of silver on the two sides of a mica sheet. Silver is an expensive metal, hence mica capacitors are expensive. "
Question 298,9. ____________ capacitors usually have a colour code to find its value.,a) Electrolyte capacitor,b) Variable capacitor,c) Polyester capacitor,d) Glass capacitor,c,Explanation: Polyester capacitors usually come with a colour code because they are very small and their values cannot be printed on its body.
Question 299,10. ______________ capacitors have a high leakage voltage.,a) Electrolyte capacitor,b) Variable capacitor,c) Air capacitor,d) Polyester capacitor,d,"Explanation: Polyester capacitors can operate at high voltages, that is, a few thousand volts and the leakage resistance is high, that is, usually 100 M. "
Question 300,1. What is the magnetic field outside a solenoid?,a) Infinity,b) Half the value of the field inside,c) Double the value of the field inside,d) Zero,d,"Explanation: There are no magnetic lines of force outside a solenoid, hence the magnetic field outside a solenoid is zero."
Question 301,"2.  Which, among the following qualities, is not affected by the magnetic field?",a) Moving charge,b) Change in magnetic flux,c) Current flowing in a conductor,d) Stationary charge,d,Explanation: A stationary charge is not affected by a magnetic field because stationary charges do not have any velocity. Magnetic field cannot occur in a particle having zero velocity.
Question 302,"3. When a charged particle moves at right angles to the magnetic field, the variable quantity is?",a) Momentum,b) Speed,c) Energy,d) Moment of inertia,a,"Explanation: When a charged particle moves perpendicular to the field, its speed remains the same whereas its velocity keeps on changing. Momentum is the product of the mass of the particle and the velocity if the particle, hence since velocity varies, momentum also varies."
Question 303,"4. If the flow of electric current is parallel to the magnetic field, the force will be ______",a) Zero,b) Infinity,c) Maximum,d) Half the original value,a,"Explanation: Force is a cross product. A cross product involves the sine of the angle between them. If two quantities are parallel to each other, the angle between them is zero. Sin(0) is zero, hence force is zero."
Question 304,5. The ratio of magnetic force to electric force on a charged particle getting undeflected in a field is?,a) 1,b) 0,c) 2,d) 4,a,"Explanation: When a charged particle is undeflected in a field, the magnitude of the magnetic force and electric force acting on the particle is the same, hence the ratio is 1."
Question 305,6. What is the strength of magnetic field known as ________,a) Flux,b) Density,c) Magnetic strength,d) Magnetic flux density,d,Explanation: Strength of magnetic field is also known as magnetic flux density. It is the amount of magnetic flux lines crossing through a unit area.
Question 306,7. Weakest force in nature is?,a) Electric force,b) Gravitational force,c) Weak force,d) Magnetic force,a,Explanation: Gravitational force is the weakest force in nature as it does not bind anything strongly with its help.
Question 307,8. How can a magnetic field be produced?,a) Using a permanent magnet,b) Electric current,c) Using a temporary magnet,d) Using a permanent magnet or electric current,d,Explanation: An electric field as well as the permanent magnet produces a magnetic field whereas a temporary magnet fails to do so.
Question 308,9. Can we see magnetic flux lines?,a) Yes,b) No,c) Depends on the strength of the field,d) Only when the field strength is very large,b,"Explanation: No, we cannot see magnetic flux lines as the Òlines of magnetic fluxÓ is purely an imaginary concept to understand the magnetic field clearly."
Question 309,10. Magnetic Field lines move from _______,a) North to south,b) South to north,c) West to east,d) East to west,a,Explanation: Magnetic field lines originate at the north pole and terminate at the south pole of the magnet.
Question 310,1. Field lines move from __________,a) North to south,b) South to north,c) West to east,d) East to west,a,Explanation: Magnetic field lines originate at the north pole and terminate at the south pole of the magnet.
Question 311,2. Magnetic field lines ___________ at the north pole.,a) Emerge,b) Converge,c) Neither emerge nor converge,d) Either emerge or converge,a,Explanation: Magnetic field lines emerge at the north pole. Field lines seem to emerge at the north pole because they originate at the north pole.
Question 312,3. Magnetic field lines ___________ at the south pole.,a) Emerge,b) Converge,c) Neither emerge nor converge,d) Either emerge or converge,b,Explanation: Magnetic field lines converge at the south pole. Field lines seem to converge at the south pole because they end at the south pole.
Question 313,4. Which of the following is used to determine the direction of magnetic field in a current carrying conductor?,a) Left hand thumb rule,b) Right hand thumb rule,c) Right hand palm rule,d) Left hand palm rule,b,"Explanation: The right hand thumb rule determines the direction of a magnetic field in a current carrying conductor. The rule states that when we align our right thumb in the direction of the current and curl our fingers around it, the direction of our fingers is the direction of the magnetic field."
Question 314,"5. According to FlemmingÕs left hand rule, the index finger denotes?",a) Direction of magnetic field,b) Direction of current,c) Direction of force,d) Direction of force as well as current,a,"Explanation: According to FlemmingÕs left hand rule, the index finger denotes the direction of the magnetic field, the thumb denoted the direction of force and the middle finger denoted the direction of the current."
Question 315,"6. According to FlemmingÕs left hand rule, the middle finger denotes?",a) Direction of magnetic field,b) Direction of current,c) Direction of force,d) Direction of force as well as current,b,"Explanation: According to FlemmingÕs left hand rule, the index finger denotes the direction of the magnetic field, the thumb denoted the direction of force and the middle finger denoted the direction of the current."
Question 316,"7. According to FlemmingÕs left hand rule, the thumb denotes?",a) Direction of magnetic field,b) Direction of current,c) Direction of force,d) Direction of force as well as current,c,"Explanation: According to FlemmingÕs left hand rule, the index finger denotes the direction of the magnetic field, the thumb denoted the direction of force and the middle finger denoted the direction of the current."
Question 317,8. The relation between the direction of force and the direction of magnetic field is _________,a) Same direction,b) Opposite direction,c) Perpendicular,d) Unrelated,c,"Explanation: When a conductor carries a certain value of current, the force developed in the conductor, the current in the conductor and the magnetic field in the conductor are mutually perpendicular to each other."
Question 318,9. The relation between the direction of current and the direction of magnetic field is ________,a) Same direction,b) Opposite direction,c) Perpendicular,d) Unrelated,c,"Explanation: When a conductor carries a certain value of current, the force developed in the conductor, the current in the conductor and the magnetic field in the conductor are mutually perpendicular to each other."
Question 319,10. The relation between the direction of current and the direction of the force is _________,a) Same direction,b) Opposite direction,c) Perpendicular,d) Unrelated,c,"Explanation: When a conductor carries a certain value of current, the force developed in the conductor, the current in the conductor and the magnetic field in the conductor are mutually perpendicular to each other."
Question 320,1. Magnetic field lines seek the path of __________ resistance.,a) Maximum,b) Minimum,c) Infinite,d) Zero,b,"Explanation: Magnetic field lines will always seek the path of least resistance. It does not seek the path of zero resistance because, in practical scenarios, zero resistance is not possible."
Question 321,2. Magnetic field lines form _________ loops from pole to pole.,a) Open,b) Closed,c) Branched,d) Either closed or branched,b,Explanation: Magnetic field lines form closed loops from pole to pole. There is no discontinuity in the magnetic flux lines.
Question 322,3. Do magnetic flux lines intersect?,a) Yes,b) No,c) Depends on the situation,d) Cannot be determined,b,Explanation: Magnetic field lines do not cross each other because if they cross it means the there are two different directions of a magnetic field in that region and that is not possible.
Question 323,"4. Inside the magnet, field lines travel from?",a) North to south,b) South to north,c) West to east,d) East to west,b,"Explanation: Magnetic field lines originate at the north pole and terminate at the south pole of the magnet but inside the magnet, they seem to move from south to north."
Question 324,5. Lines of magnetic flux which are parallel and in the same direction __________ each other.,a) Attract,b) Repel,c) Intersect,d) Cancel,b,Explanation: Lines of magnetic flux which are parallel to each other and in the same direction repel each other because they tend to act as like poles and like poles repel each other.
Question 325,"6. More the number of magnetic flux lines, _______ is the force of the magnet.",a) Greater,b) Lesser,c) Either greater or lesser,d) Neither greater nor lesser,a,"Explanation: More the number of magnetic flux lines, greater is the force of the magnet. This is because the magnetic flux lines denote the strength of the field of the magnet."
Question 326,7. The relation between the direction of current and the direction of force in a current carrying conductor is?,a) Same direction,b) Opposite direction,c) Perpendicular,d) Unrelated,c,"Explanation: When a conductor carries a certain value of current, the force developed in the conductor, the current in the conductor and the magnetic field in the conductor are mutually perpendicular to each other."
Question 327,1. The force existing between two infinite parallel conductors is inversely proportional to ________,a) Radius of the conductors,b) Current in one of the conductors,c) The product of the current in the two conductors,d) The distance between the two conductors,d,"Explanation: When current is flowing in two different conductors, the force between the two conductors is directly proportional to the product of the current in the two conductors and inversely proportional to the distance between the two conductors."
Question 328,"2. When the distance of operation between the two conductors increases, what happens to the force between the two conductors?",a) Increases,b) Decreases,c) Remains the same,d) Becomes zero,b,"Explanation: When the distance of separation increases, the force between the two conductors decrease because the force between two conductors is inversely proportional to the distance of separation between them."
Question 329,"3.  According to FlemmingÕs left hand rule, the index finger denotes ________",a) Direction of magnetic field,b) Direction of current,c) Direction of force,d) Direction of force as well as current,a,"Explanation: According to FlemmingÕs left hand rule, the index finger denotes the direction of the magnetic field, the thumb denoted the direction of force and the middle finger denoted the direction of the current."
Question 330,"4. According to FlemmingÕs left hand rule, the middle finger denotes _________",a) Direction of magnetic field,b) Direction of current,c) Direction of force,d) Direction of force as well as current,b,"Explanation: According to FlemmingÕs left hand rule, the index finger denotes the direction of the magnetic field, the thumb denoted the direction of force and the middle finger denoted the direction of the current."
Question 331,"5. According to FlemmingÕs left hand rule, the thumb denotes _________",a) Direction of magnetic field,b) Direction of current,c) Direction of force,d) Direction of force as well as current,c,"Explanation: According to FlemmingÕs left hand rule, the index finger denotes the direction of the magnetic field, the thumb denoted the direction of force and the middle finger denoted the direction of the current."
Question 332,6. The relation between the direction of force and the direction of the magnetic field in a current carrying conductor is?,a) Same direction,b) Opposite direction,c) Perpendicular,d) Unrelated,c,"Explanation: When a conductor carries a certain value of current, the force developed in the conductor, the current in the conductor and the magnetic field in the conductor are mutually perpendicular to each other."
Question 333,7. The relation between the direction of current and the direction of the magnetic field in a current carrying conductor is?,a) Same direction,b) Opposite direction,c) Perpendicular,d) Unrelated,c,"Explanation: When a conductor carries a certain value of current, the force developed in the conductor, the current in the conductor and the magnetic field in the conductor are mutually perpendicular to each other."
Question 334,1. The magnetic field strength of a solenoid can be increased by inserting which of the following materials as the core?,a) Copper,b) Silver,c) Iron,d) Aluminium,c,Explanation: The Magnetic field of a solenoid increases when we insert an iron core because iron is a ferromagnetic material and ferromagnetic materials help in increasing the magnetic property.
Question 335,"2. If a coil is wound around a steel core and electric current is passed through the coil, the steel core acts as a?",a) Electromagnet,b) Permanent magnet,c) Neither electromagnet nor permanent magnet,d) Either electromagnet or permanent magnet,b,"Explanation: When a coin is wound around a steel core, the steel core behaves like a permanent magnet because it is a ferromagnetic material and once it becomes magnetic it does not lose its magnetic property."
Question 336,3. What is the formula for the magnetic field due to a solenoid?,a) _nI,b) _n2,c) _NI,d) _N2I2,a,"Explanation: The magnetic field due to a solenoid is:B= _nI, where _ is the permeability, n is the number of turns per unit length and I is the current in the solenoid."
Question 337,4. What happens to the magnetic field in the solenoid when the number of turns increases?,a) Increases,b) Decreases,c) Remains constant,d) Becomes zero,a,"Explanation: The magnetic field of a solenoid is directly proportional to the number of turns in it. Hence as the number of turns increases, the magnetic field also increases."
Question 338,5. What happens to the magnetic field in the solenoid when the current increases?,a) Increases,b) Decreases,c) Remains constant,d) Becomes zero,a,"Explanation: The magnetic field of a solenoid is directly proportional to the current in it. Hence as the current increases, the magnetic field also increases."
Question 339,6. What happens to the magnetic field in the solenoid when the length of the solenoid increases?,a) Increases,b) Decreases,c) Remains constant,d) Becomes zero,b,"Explanation: The magnetic field of a solenoid is inversely proportional to the length. Hence as the length increases, the magnetic field decreases."
Question 340,"7. The current in a solenoid is 30A, the number of turns per unit length is 500 turns per metre. Calculate the magnetic field if the core is air.",a) 18.84T,b) 18.84mT,c) 1.84T,d) 1.84mT,b,"Explanation: The magnetic field in a solenoid is given by:B=_nISubstituting the values in the given values in the equation, B=18.84mT."
Question 341,"8. The magnetic field of the solenoid is 18.84mT, the number of turns per unit length is 500 turns per metre. Calculate the current if the core is air.",a) 300A,b) 30A,c) 3A,d) 300mA,b,"Explanation: The magnetic field in a solenoid is given by:B=_nISubstituting the values in the given values in the equation, I=30A."
Question 342,"9. The magnetic field of the solenoid is 18.84mT, the current is 30A. Calculate the number of turns per unit length if the core is air.",a) 1500 turns/m,b) 1000 turns/m,c) 500 turns /m,d) 2000 turns/m,c,"Explanation: The magnetic field in a solenoid is given by:B=_nISubstituting the values in the given values in the equation n=500 turns/m."
Question 343,1. What is the expression for force in a current carrying conductor?,a) F=Kq1/r2,b) F=Kq2/r2,c) F=Kq1q2/r2,d) F=Kq1q2/r,c,"Explanation: The force in a current carrying conductor is directly proportional to the product of the two charges and inversely proportional to the square of the distance between them. Hence F=Kq1q2/r2, where K is the constant of proportionality."
Question 344,2. Force in a conductor is__________ to the product of the charges.,a) Directly proportional,b) Inversely proportional,c) Not related,d) Cannot be determined,a,Explanation: The force in a current carrying conductor is directly proportional to the product of the two charges and inversely proportional to the square of the distance between them. 
Question 345,3. Force in a conductor is __________ to the square of the distance between the charges.,a) Directly proportional,b) Inversely proportional,c) Not related,d) Cannot be determined,b,Explanation: The force in a current carrying conductor is directly proportional to the product of the two charges and inversely proportional to the square of the distance between them.
Question 346,4. Calculate the force between two charges having magnitude 3nC and 2nC separated by a distance of 2micro m.,a) 13.5N,b) 13.5kN,c) 1.35N,d) 1.35kN,b,"Explanation: From the expression:F=Kq1q2/r2, the value of K being 9*109, we get F=13.5kN."
Question 347,"5. If the flow of electric current is parallel to the magnetic field, the force will be?",a) Zero,b) Infinity,c) Maximum,d) Half the original value,a,"Explanation: Force is a cross product. A cross product involves the sine of the angle between them. If two quantities are parallel to each other, the angle between them is zero. Sin(0) is zero, hence force is zero."
Question 348,6. The ratio of magnetic force to electric force on a charged particle getting undeflected in a field is ______,a) 1,b) 0,c) 2,d) 4,a,"Explanation: When a charged particle is undeflected in a field, the magnitude of the magnetic force and electric force acting on the particle is the same, hence the ratio is 1."
Question 349,7. Weakest force in nature is __________,a) Electric force,b) Gravitational force,c) Weak force,d) Magnetic force,a,Explanation: Gravitational force is the weakest force in nature as it does not bind anything strongly with its help.
Question 350,8. The relation between the direction of force and the direction of magnetic field is __________,a) Same direction,b) Opposite direction,c) Perpendicular,d) Unrelated,c,"Explanation: When a conductor carries a certain value of current, the force developed in the conductor, the current in the conductor and the magnetic field in the conductor are mutually perpendicular to each other."
Question 351,9. The relation between the direction of current and the direction of the force is ________,a) Same direction,b) Opposite direction,c) Perpendicular,d) Unrelated,c,"Explanation: When a conductor carries a certain value of current, the force developed in the conductor, the current in the conductor and the magnetic field in the conductor are mutually perpendicular to each other."
Question 352,"1. Which, among the following, is the correct expression for force in a current carrying conductor?",a) F=Bi,b) F=B2il,c) F=Bil,d) F=Bl2,c,"Explanation: The correct expression for force in a current carrying conductor in a magnetic field is F=Bil, where B is the magnetic field, i is the current in the conductor and l is the length of the conductor."
Question 353,"2. When the current in the current carrying conductor increases, what happens to the force in the conductor which is at right angles to the magnetic field?",a) Increases,b) Decreases,c) Remains the same,d) Becomes zero,a,Explanation: The force at right angles to the magnetic field of a current carrying conductor increases when the current increases because it is directly proportional to the force.
Question 354,"3. When the length of the conductor in the current carrying conductor increases, what happens to the force in the conductor which is at right angles to the magnetic field?",a) Increases,b) Decreases,c) Remains the same,d) Becomes zero,a,Explanation: The force at right angles to the magnetic field of a current carrying conductor increases when the length of the conductor increases because it is directly proportional to the force.
Question 355,"4. When the magnetic field intensity in the current carrying conductor increases, what happens to the force in the conductor which is at right angles to the magnetic field?",a) Increases,b) Decreases,c) Remains the same,d) Becomes zero,a,Explanation: The force at right angles to the magnetic field of a current carrying conductor increases when the magnetic field intensity increases because it is directly proportional to the force.
Question 356,5. The unit for force in a current carrying conductor is _________,a) Newton,b) Tesla,c) Weber/metre,d) Ampere,a,Explanation: The unit for force in a current carrying conductor is newton because it is a force and the unit of force is Newton.
Question 357,"6. If the flow of electric current is parallel to the magnetic field, the force will be ________",a) Zero,b) Infinity,c) Maximum,d) Half the original value,a,"Explanation: Force is a cross product. A cross product involves the sine of the angle between them. If two quantities are parallel to each other, the angle between them is zero. Sin(0) is zero, hence force is zero."
