Question Name,Question,Option A,Option B,Option C,Option D,Answer,Explanation
Question 515,"3. If the current in one coil is steady, what happens to the mutual inductance?",a) Zero,b) Infinity,c) Doubles,d) Halves,a,"Explanation: A magnetic field is produced when there is a changing electric field. Hence the magnetic field is zero when the current is steady. When the magnetic field is zero there is no current induced in the other coil, thus the electric field is zero."
Question 516,4. What is the SI unit of mutual inductance?,a) Ohm,b) Henry,c) Volt,d) Siemens,b,"Explanation: Mutual inductance is the inductance between the two neighbouring coils. Since it is a type of inductance, its unit is that of inductance, that is, henry."
Question 517,"5. Which, among the following, is the correct expression for mutual inductance?",a) M=N2_2/I2,b) M=N2_2/I1,c) M=N1_2/I2,d) M=N1_1/I1,b,"Explanation: Mutual inductance is the product of the number of turns in one coil and the flux linkages of that coil, divided by the current in the other coil. Hence M=N2_2/I1 is the correct expression."
Question 518,"6. If the flux linkage in coil 1 is 3Wb-t and it has 500 turns and the current in coil 2 is 2A, calculate the mutual inductance.",a) 750H,b) 500H,c) 450H,d) 900H,a,"Explanation: We know that mutual inductance is the product of the number of turns in one coil and the flux linkages of that coil, divided by the current in the other coil.M=3*500/2=750H."
Question 519,"7. The flux linkage in coil 1 is 3Wb-t and it has x turns and the current in coil 2 is 2A, calculate the value of x if the mutual inductance is 750H.",a) 300,b) 400,c) 500,d) 700,c,"Explanation: We know that mutual inductance is the product of the number of turns in one coil and the flux linkages of that coil, divided by the current in the other coil.N=750*2/3= 300 turns."
Question 520,"8. The flux linkage in coil 1 is x Wb-t and it has 500 turns and the current in coil 2 is 2A, calculate the value of x if the mutual inductance is 750H.",a) 1Wb-t,b) 2Wb-t,c) 3Wb-t,d) 4Wb-t,c,"Explanation: We know that mutual inductance is the product of the number of turns in one coil and the flux linkages of that coil, divided by the current in the other coil._=750*2/500= 3Wb-t."
Question 521,"9. The flux linkage in coil 1 is 3 Wb-t and it has 500 turns and the current in coil 2 is xA, calculate the value of x if the mutual inductance is 750H.",a) 1A,b) 2A,c) 3A,d) 4A,b,"Explanation: We know that mutual inductance is the product of the number of turns in one coil and the flux linkages of that coil, divided by the current in the other coil.I=3*500/750= 2A."
Question 522,10. Practical application of mutual inductance is ____________,a) DC generator,b) AC generator,c) Transformer,d) Capacitor,c,"Explanation: A transformer is a device made of two or more inductors, one of which is powered by AC, inducing an AC voltage across the second inductor."
Question 523,11. The types of inductors are ____________,a) Fixed and variable,b) Only fixed,c) Only variable,d) Neither fixed nor variable,a,Explanation: The two types of inductors are fixed and variable inductors. Fixed inductors are those whose inductance value cannot be changed. Variable inductors are those whose values can be changed as and when required.
Question 524,1. What is the coupling coefficient when all the flux of coil 1 links with coil 2?,a) 0,b) 100,c) 1,d) Insufficient information provided,c,Explanation: When all the flux of coil 1 links with coil 2 it is known as an ideal coupling where the coupling coefficient is 1.
Question 525,2. What is the coupling coefficient when there is ideal coupling?,a) 0,b) 100,c) 1,d) Insufficient information provided,c,Explanation: When all the flux of coil 1 links with coil 2 it is known as an ideal coupling where the coupling coefficient is 1.
Question 526,3. Can the coupling coefficient practically ever be equal to 1?,a) Yes,b) No,c) Depends on the current in coil 1,d) Depends on the current in coil 2,b,Explanation: Coupling coefficient can never be equal to 1 because all the flux of coil 1 can never link with coil 2. There are bound to be losses.
Question 527,4. Mutual inductance between to coupled coils depends on?,a) Amount of flux linkage,b) Rate of change of flux linkage,c) Rate of change of current,d) Flux density,b,"Explanation: FaradayÕs law of induction states that the magnitude of the induced EMF is the product of the number of turns of the coil and the rate of change of flux linkage in it. Hence, the mutual inductance depends on the rate of change of flux linkage."
Question 528,"5. Which, among the following, is the correct formula to find the coupling coefficient?",a) k=M/sqrt(L1L2),b) k=M/sqrt(L12),c) k=M/sqrt(L22),d) k=M/(L1L2),a,Explanation: The correct formula for the coupling coefficient is k=M/sqrt(L1L2). Where L1 and L2 are the inductance values of the first and second coil respectively and M is the mutual inductance.
Question 529,6. What happens to the coupling coefficient when the flux linkage of coil 1 and coil 2 increases?,a) Increases,b) Decreases,c) Remains the same,d) Becomes zero,a,"Explanation: When the flux linkage of coil 1 and coil 2 increases, its mutual inductance increases. The coupling coefficient is directly proportional to the mutual inductance hence as mutual inductance increases, the coupling coefficient increases."
Question 530,7. What is the SI unit of coupling coefficient?,a) H,b) H-1,c) No unit,d) H2,c,Explanation: The expression to find mutual inductance is k=M/sqrt(L1L2)= H/sqrt(H*H)= 1. Therefore it does not have any unit.
Question 531,"8. Find the coupling coefficient if the Mutual inductance is 20H, the inductance of coil 1 is 2H and the inductance of coil 2 is 8H.",a) 5,b) 20,c) 2,d) 8,a,"Explanation: we know that:k=M/sqrt(L1L2)Substituting the values from the question, we get k=5."
Question 532,"9. Find the value of x if the Mutual inductance is x H, the inductance of coil 1 is 2H and the inductance of coil 2 is 8H. The coupling coefficient is 5.",a) 10H,b) 20H,c) 16H,d) 15H,b,"Explanation: we know that:k=M/sqrt(L1L2)Substituting the values from the question, we get M=20H."
Question 533,"10. Find the value of x if the Mutual inductance is 20H, the inductance of coil 1 is xH and the inductance of coil 2 is 8H. The coupling coefficient is 5.",a) 2H,b) 4H,c) 6H,d) 8H,a,"Explanation: we know that:k=M/sqrt(L1L2)Substituting the values from the question, we get L1=2H."
Question 534,1. What is the equivalent inductance when inductors are connected in series?,a) Sum of all the individual inductances,b) Product of all the individual inductances,c) Sum of the reciprocal of all the individual inductances,d) Product of the reciprocal of all the individual inductances,a,"Explanation: When inductances are connected in series, the equivalent inductance is equal to the sum of all the individual inductance values."
Question 535,"2. When inductances are connected in series, the equivalent inductance is ____________ the largest individual inductance.",a) Greater than,b) Less than,c) Equal to,d) Not related to,a,"Explanation: When inductances are connected in series, the equivalent inductance is equal to the sum of all the individual inductance values. Hence the equivalent inductance is greater than the largest individual inductance."
Question 536,"3. Three inductors having inductance values 3H, 4H and 5H are connected in series, calculate the equivalent inductance.",a) 10H,b) 12H,c) 3H,d) 5H,b,"Explanation: When inductances are connected in series, the equivalent inductance is equal to the sum of all the individual inductance values.Hence Leq= L1+L2+L3= 12H."
Question 537,"5. When inductors are connected in series, the voltage across each inductor is _________",a) Equal,b) Different,c) Zero,d) Infinity,b,"Explanation: In a series circuit, the current across all elements remain the same and the total voltage of the circuit is the sum of the voltages across all the elements."
Question 538,"6. In a series circuit, which of the parameters remain constant across all circuit elements such as resistor, capacitor, inductor etcetera?",a) Voltage,b) Current,c) Both voltage and current,d) Neither voltage nor current,b,"Explanation: In a series circuit, the current across all elements remain the same and the total voltage of the circuit is the sum of the voltages across all the elements."
Question 539,7. Batteries are generally connected in?,a) Series,b) Parallel,c) Either series or parallel,d) Neither series nor parallel,a,Explanation: Batteries are generally connected in series so that we can obtain the desired voltage since voltages add up once they are connected in series.
Question 540,"1. Which, among the following, is the correct expression for alternating emf generated?",a) e=2Blusin(theta),b) e=2B2lusin(theta),c) e=Blusin(theta),d) e=4Blusin(theta),a,"Explanation: The correct expression for alternating emf generated is e=2Blusin(theta). Where B stands for magnetic field density, l is the length of each of the parallel sides u is the velocity with which the conductor is moved and theta is the angle between the velocity and the length."
Question 541,2. What should theta be in order to get maximum emf?,a) 0,b) 90,c) 180,d) 45,b,Explanation: The value of theta should be 90 in order to get maximum emf because e=2Blusin(theta) and sin is maximum when theta is 90.
Question 542,"3. Calculate the maximum emf when the velocity is 10m/s, the length is 3m and the magnetic field density is 5T.",a) 150V,b) 100V,c) 300V,d) 0V,c,"Explanation: We know that: e=2Blusin(theta)Substituting the values from the given question, we get e=300V."
Question 543,"4. When a coil is rotated in a magnetic field, the emf induced in it?",a) Is maximum,b) Is minimum,c) Continuously varies,d) Remains constant,c,"Explanation: When a coil is rotated in a magnetic field the emf continuously varies as the cross sectional area varies due to which the number of flux lines crossing it varies, which causes the emf to vary."
Question 544,5. An E.M.F. can be induced by ___________,a) Change in magnetic field,b) Change in the area of cross section,c) Change in angle between magnetic field and area,"d) Change in magnetic field, area and angle",d,"Explanation: This is the dot product of magnetic field vector and area vector.emf=BAcos(theta), hence if either of the three, that is, magnetic field, area or angle changes, the emf will change."
Question 545,"6. In an A.C. generator, increase in number of turns in the coil _________",a) Increases emf,b) Decreases emf,c) Makes the emf zero,d) Maintains the emf at a constant value,a,"Explanation: In an A.C. generator, the emf increases as the number of turns in the coil increases because the emf is directly proportional to the number of turns."
Question 546,7. The number of cycles that occur in one second is termed as ___________,a) Waveform,b) Frequency,c) Amplitude,d) Period,a,Explanation: The number of cycles that occur in one second is known as the frequency. It is the reciprocal of the time period. 
Question 547,1. The variation of a quantity such as voltage or current shown on a graph is known as ___________,a) Waveform,b) Peak value,c) Instantaneous value,d) Period,a,"Explanation: The variation of a quantity, which is voltage or current in this case, shown on a graph with the x-axis as time is known as a waveform."
Question 548,2. What is the duration of one cycle known as _________,a) Waveform,b) Peak value,c) Instantaneous value,d) Period,d,Explanation: The duration of one cycle is known as a period. A function which repeats the same waveform at equal intervals of time is known as a periodic function.
Question 549,"3. The repetition of a variable quantity, recurring at equal intervals, is known as ___________",a) Waveform,b) Instantaneous value,c) Cycle,d) Period,c,"Explanation: Each repetition of a variable quantity, recurring at equal intervals, is termed as a cycle. "
Question 550,4. The value of a given waveform at any instant time is termed as ___________,a) Waveform,b) Instantaneous value,c) Cycle,d) Period,b,Explanation: Instantaneous value is the value of the waveform at that instant. Hence the value of a given waveform at any instant time is termed as instantaneous value.
Question 551,5. The maximum instantaneous value measured from zero value is known as?,a) Peak value,b) Peak to peak value,c) Cycle,d) Period,a,Explanation: The maximum instantaneous value measured from the zero value is termed as the peak value.
Question 552,6. The maximum variation between the maximum positive and the maximum negative value is known as?,a) Peak value,b) Peak to peak value,c) Cycle,d) Period,a,Explanation: The maximum variation between the maximum positive instantaneous value and the maximum negative instantaneous value is the peak-to-peak value. 
Question 553,7. What is the correct reaction between the peak value and peak to peak value for a sinusoidal waveform?,a) Vp=4Vp-p,b) Vp=Vp-p,c) Vp-p=2Vp,d) Vp=2Vp-p,c,"Explanation: The maximum variation between the maximum positive instantaneous value and the maximum negative instantaneous value is the peak-to-peak value. For a sinusoidal waveform, it is twice the peak value. Hence Vp-p=2Vp."
Question 554,"8. If the peak to peak voltage is 10V, calculate the peak voltage.",a) 10V,b) 2V,c) 4V,d) 5V,d,"Explanation: Vp-p=2VpSubstituting the values from the question, we get Vp=5V."
Question 555,"9. If the peak voltage is 9V, calculate the peak to peak voltage.",a) 9V,b) 20V,c) 18V,d) 12V,c,"Explanation: Vp-p=2VpSubstituting the values from the question, we get Vp-p= 18V."
Question 556,1. The waveform of the emf generated undergoes one complete cycle when?,a) Conductors move past north pole,b) Conductors move past south pole,c) Conductors move past north and south poles,d) Conductors are stationary,c,Explanation: The waveform of the e.m.f. generated in an a.c. generator undergoes one complete cycle of variation when the conductors move past an N and an S pole.
Question 557,2. When is the shape of the negative half of the emf waveform equal to the positive half?,a) When the conductors move past north pole,b) When conductors move past south pole,c) When conductors move past both north and south pole,d) When conductors are stationary,c,Explanation: The waveform of the e.m.f. generated in an a.c. generator undergoes one complete cycle of variation when the conductors move past an N and an S pole and the shape of the wave over the negative half is exactly the same as that over the positive half.
Question 558,3. Which is the correct formula for frequency in an ac generator?,a) f=pn,b) f=p/n,c) f=n/p,d) f=n2p,a,"Explanation: The frequency in an ac generator is pn, where p is pairs of poles and speed is n revolutions per second."
Question 559,4. What will happen to the frequency if the number of revolutions increases?,a) Increases,b) Decreases,c) Remains the same,d) Becomes zero,a,"Explanation: We know that:f=pn, therefore, as n increases, also increases."
Question 560,5. What happens to the frequency if the number of pairs of poles increases?,a) Increases,b) Decreases,c) Remains the same,d) Becomes zero,a,"Explanation: We know that:f=pn, therefore, as p increases, also increases."
Question 561,6. Calculate the frequency if the number of revolutions in 300 and the paired poles are 50.,a) 15kHz,b) 150kHz,c) 1500kHz,d) 150Hz,a,"Explanation: We know that:f=pnSubstituting the values from the given question, we get f=15kHz."
Question 562,7. Calculate the number of revolutions if the frequency is 15kHz and the paired poles are 50.,a) 100,b) 200,c) 300,d) 400,c,"Explanation: We know that:f=pnSubstituting the values from the given question, we get n=300."
Question 563,8. Calculate the number of paired poles if the frequency id 15kHz and the number of revolutions is 300.,a) 10,b) 30,c) 50,d) 70,c,"Explanation: We know that:f=pnSubstituting the values from the given question, we get n=50."
Question 564,9. What is the frequency of a two pole machine having n=50?,a) 100Hz,b) 200Hz,c) 50Hz,d) 25Hz,c,"Explanation: For a two pole machine, p=1.f=pn= 1*50= 50Hz."
Question 565,10. What is the minimum number of poles that a machine must have __________,a) 1,b) 2,c) 4,d) 10,b,Explanation: The minimum number of poles that a machine must have is 2 because a machine must have at least one pair of poles= 2 poles.
Question 566,"1. Find the average value of current when the current that are equidistant are 4A, 5A and 6A.",a) 5A,b) 6A,c) 15A,d) 10A,a,Explanation: The average value of current is the sum of all the currents divided by the number of currents. Therefore average current= (5+4+6)/3=5A.
Question 567,2. What is the current found by finding the current in an equidistant region and dividing by n?,a) RMS current,b) Average current,c) Instantaneous current,d) Total current,b,Explanation: The average value of the current is the sum of all the currents divided by the number of currents. 
Question 568,3. RMS stands for ________,a) Root Mean Square,b) Root Mean Sum,c) Root Maximum sum,d) Root Minimum Sum,a,"Explanation: RMS stands for Root Mean Square. This value of current is obtained by squaring all the current values, finding the average and then finding the square root."
Question 569,4. What is the type of current obtained by finding the square of the currents and then finding their average and then fining the square root?,a) RMS current,b) Average current,c) Instantaneous current,d) Total current,a,"Explanation: RMS stands for Root Mean Square. This value of current is obtained by squaring all the current values, finding the average and then finding the square root."
Question 570,5. __________ current is found by dividing the area enclosed by the half cycle by the length of the base of the half cycle.,a) RMS current,b) Average current,c) Instantaneous current,d) Total current,b,Explanation: The average value of current is the sum of all the currents divided by the number of currents. Hence it can also be found by dividing the area enclosed by the half cycle by the length of the base of the half cycle.
Question 571,6. What is the effective value of current?,a) RMS current,b) Average current,c) Instantaneous current,d) Total current,a,"Explanation: Effective current is also known as the effective current. RMS stands for Root Mean Square. This value of current is obtained by squaring all the current values, finding the average and then finding the square root."
Question 572,"7. In a sinusoidal wave, average current is always _______ rms current.",a) Greater than,b) Less than,c) Equal to,d) Not related,b,"Explanation: The average value of current is the sum of all the currents divided by the number of currents whereas RMS current is obtained by squaring all the current values, finding the average and then finding the square root. Hence RMS current is greater than average current."
Question 573,"8. For a rectangular wave, average current is ______ rms current.",a) Greater than,b) Less than,c) Equal to,d) Not related,c,"Explanation: The rms value is always greater than the average except for a rectangular wave, in which the heating effect remains constant so that the average and the rms values are the same. "
Question 574,9. Peak value divided by the rms value gives us?,a) Peak factor,b) Crest factor,c) Both peak and crest factor,d) Neither peak nor crest factor,c,Explanation: Peak and crest factor both mean the same thing. Hence the peak value divided by the rms value gives us the peak or crest factor.
Question 575,10. Calculate the crest factor if the peak value of current is 10A and the rms value is 2A.,a) 5,b) 10,c) 5A,d) 10A,a,"Explanation: We know that:Crest factor= Peak value/RMS value.Substituting the values from the given question, we get crest factor=5."
Question 576,1. RMS stands for ____________,a) Root Mean Square,b) Root Mean Sum,c) Root Maximum sum,d) Root Minimum Sum,a,"Explanation: RMS stands for Root Mean Square. This value of current is obtained by squaring all the current values, finding the average and then finding the square root."
Question 577,"2. If Im is the maximum value of a sinusoidal voltage, what is the instantaneous value?",a) i=Im/2,b) i=Imsin_,c) i=Imcos_,d) i=Im,b,"Explanation: The instantaneous value of a sinusoidal varying current is i=Imsin_, where theta is the angle from an instant of zero current."
Question 578,3. Average value of current over a half cycle is?,a) 0.67Im,b) 0.33Im,c) 6.7Im,d) 3.3Im,a,"Explanation: Integrating id_ in the interval from 0 to pi ( since we are finding the average current over one half cycle), we get i=0.61Im."
Question 579,4. What is the correct expression for the rms value of current?,a) Irms=Im/2,b) Irms=Im/Ã2,c) Irms=Im/4,d) Irms=Im,b,"Explanation: The correct expression for the rms value of current is Irms= Im/Ã2, where Im is the maximum or peak value of the current."
Question 580,5. Average value of current over a half cycle is _________,a) 0.67Im,b) 0.33Im,c) 6.7Im,d) 3.3Im,a,"Explanation: Integrating id_ in the interval from 0 to pi (since we are finding the average current over one half cycle) , we get i=0.61Im."
Question 581,6. What is the correct expression for the form factor?,a) I*Iav,b) I/Iav,c) I+Iav,d) I-Iav,b,"Explanation: The correct expression for form factor is ki=I/Iav, where I is the rms value of the current and Iav is the average current."
Question 582,"7. For a direct current, the rms current is ________ the mean current.",a) Greater than,b) Less than,c) Equal to,d) Not related to,c,"Explanation: For a direct current, that is, a non-sinusoidal current, the mean current value is the same as that of the rms current."
Question 583,"8. For a direct voltage, the rms voltage is ________ the mean voltage.",a) Greater than,b) Less than,c) Equal to,d) Not related to,c,"Explanation: For a direct current, that is, a non-sinusoidal current, the mean voltage value is the same as that of the rms voltage."
Question 584,"1. For addition and subtraction of phasors, we use the _________ form.",a) Rectangular,b) Polar,c) Either rectangular or polar,d) Neither rectangular nor polar,a,"Explanation: For addition and subtraction of phasors, we use the rectangular form because in the rectangular form we can only add the real part and the complex part separately to get the total value."
Question 585,"2. For multiplication and division of phasors, we use ____________ form.",a) Rectangular,b) Polar,c) Either rectangular or polar,d) Neither rectangular nor polar,a,"Explanation: For multiplication and division of phasors, we use the polar form because in the rectangular form we just multiply or divide the values and add or subtract the angles."
Question 586,"3. If a voltage of 2+5j and another voltage of 3+ 6j flows through two different resistors, connected in series, in a circuit, find the total voltage in the circuit.",a) 2+5j V,b) 3+6j V,c) 5+11j V,d) 5+10j V,c,"Explanation: The total voltage in the circuit is the sum of the two voltages where we add the real parts and imaginary parts separately.Therefore, Vtotal= 5+11j V."
Question 587,4. Find the total current in the circuit if two currents of 4+5j flow in the circuit.,a) 4+5j A,b) 4A,c) 5A,d) 8+10j A,d,"Explanation: The total current in the circuit is the sum of the two currents where we add the real parts and imaginary parts separately.Therefore, Itotal= 8+10j A."
Question 588,5. What is the correct expression of _?,a) _=2*pi,b) _=2*pi*f,c) _=pi*f,d) _=2f2,b,Explanation: The correct expression for _ is _=2*pi*f where f is the frequency of the alternating voltage or current.
Question 589,6. Find the value of _ if the frequency is 5Hz?,a) 3.14 rad/s,b) 31.4 rad/s,c) 34 rad/s,d) 341 rad/s,b,"Explanation: The expression for _ is _=2*pi*f.Substituting the value of f from the question, we get _=31.4 rad/s."
Question 590,"7. When one sine wave passes through the zero following the other, it is _________",a) Leading,b) Lagging,c) Neither leading nor lagging,d) Either leading or lagging,b,"Explanation: The sine wave is said to lag because it passes though zero following the other, hence it crosses zero after the first wave, therefore it is said to lag."
Question 591,"8. A phasor has frozen at 30 degrees, find the value of the phase angle.",a) 30 degrees,b) 60 degrees,c) 120 degrees,d) 180 degrees,a,"Explanation: The value of the phase angle is the value at which the phasor stops or freezes. Here, it freezes at 30 degree, hence the phase angle is 30 degrees."
Question 592,9. The time axis of an AC phasor represents?,a) Time,b) Phase angle,c) Voltage,d) Current,b,Explanation: The time axis while measuring an AC sinusoidal voltage or current represents the phase angle when converting it to a phasor.
Question 593,10. The length of the phasor represents?,a) Magnitude of the quantity,b) Direction of the quantity,c) Neither magnitude nor direction,d) Either magnitude or direction,a,"Explanation: The length of the phasor arrow represents the magnitude of the quantity, whereas the angle between the phasor and the reference represents the phase angle."
Question 594,1. Ammeters and voltmeters are calibrated to read?,a) RMS value,b) Peak value,c) Average value,d) Instantaneous value,a,Explanation: Ammeters and voltmeters are calibrated to read the rms value because the rms value is the most accurate average value.
Question 595,2. The rms value is _________ times he maximum value,a) 1.414,b) 0.5,c) 2,d) 0.707,d,"Explanation: We know that the rms value is i/root(2) time the maximum value, hence the rms vale is 0.707 times the maximum value."
Question 596,3. The rms value is 0.707 times the _________ value.,a) Peak,b) Instantaneous,c) Average,d) DC,a,"Explanation: We know that the rms value is i/root(2) time the peak value, hence the rms value is 0.707 times the peak value."
