Question Name,Question,Option A,Option B,Option C,Option D,Answer,Explanation
Question 278,"3.	Phase angle can be made 90 degrees using",a) lead circuit,b) lag circuit,c) special design,d) transformer,c,Explanation: Phase angle in an energy meter can be made approximately 90 degrees by making use of a special design in the energy meter.
Question 279,"5.	Copper shading bands are _________",a) placed as resistance,b) placed as wire,c) placed outside the central limb,d) placed around central limb,d,"Explanation: The central limb of a shunt magnet consists of copper shading bands. They can be moved up or down by making use of the central limb. Figure below illustrates the use of copper shading bands."
Question 280,"6.	As copper shading bands move up",a) more flux is induced,b) less flux is induced,c) intermediate flux is induced,d) no flux is induced,a,"Explanation: When the copper shading bands are moved up the central limb, more flux is induced. As a result the difference in angle between the phase and voltage increases. The angle can be made approximately equal to 90 degrees."
Question 281,"7.	 Shunt flux is made to lag the applied voltage using",a) lead circuit,b) lag adjustment,c) lead-lag circuit,d) transformer,b,Explanation: We make use of shading coil on the central limb of a shunt magnet and shading bands in order to make the shunt flux to lag the applied voltage by almost 90 degrees. 
Question 282,"8.	At overloads, magnetic shunt ________",a) aids the series flux,b) diverts series flux,c) maintains zero flux,d) disables the shunt flux,b,"Explanation: As the magnetic shunt reaches saturation at overloads, magnetic shunt diverts the flux due to series magnet. As a result a large portion of the flux appears in the gap of the air disc. This compensates the self braking torque."
Question 283,"1.	Energy meter reads correctly when",a) torque is small,b) torque is large,c) torque is medium,d) torque is zero,a,Explanation: The reading in an energy meter is obtained correctly when the torque value is small at low loads. It is independent of the load on the meter an acts in the same direction as the driving torque.
Question 284,"2.	Small torque for energy meter is provided",a) by a supply,b) by a shading loop,c) by unshaded loop,d) by a transformer,b,"Explanation: Friction can be compensated in an energy meter by making use of a shading loop. It is placed between the central limb of the shunt magnet and a disc. Figure below illustrates the same."
Question 285,"4.	Friction torque is eliminated by _________",a) using lubricating oil,b) by suspending the components in air,c) by adjusting position of limb,d) by using steel alloy components,c,Explanation: We can eliminate the friction torque completely by adjusting the position of the shading loop. This enables in providing compensation for the frictional torque.
Question 286,"6.	At full load, disc",a) partially revolves and then stops,b) continuously revolves,c) does not revolve at all,d) revolves in an alternating fashion,b,"Explanation: When an energy meter is operated in full load condition, disc revolves continuously due to the field of the series magnet. As a result, an e.m.f is induced in the disc."
Question 287,"7.	Self braking torque is _________",a) proportional to cube of load current,b) proportional to load current,c) proportional to square of load current,d) proportional to reciprocal of load current,c,"Explanation: In an energy meter, the self braking torque is dependent on the square of the load current. As a result the disc rotates at a slightly slower speed at high value of loads."
Question 288,"8.	Self braking action is minimised by _________",a) maintaining high speed for disc,b) maintaining medium speed for disc,c) keeping the disc at rest,d) maintaining low speed for disc,d,"Explanation: In an energy meter we can minimise or eliminate the self braking action by keeping the disc speed as low as possible at full load condition. This is achieved by maintaining the flux due to the current coil smaller than that due to the shunt coil. Figure below shows the compensating device."
Question 289,"9.	Overload compensating devices is _________",a) in the form of a magnetic shunt,b) in the form of a series magnet,c) in the form of a transformer,d) in the form of a supply,a,"Explanation: Magnetic shunt reaches saturation at overloads. As a result, its permeability reduces. Hence the overload compensating device takes the form of a magnetic shunt."
Question 290,"1.	Magnitude of flux in an energy meter varies __________",a) due to abnormal currents and voltages,b) due to high resistance and inductance values,c) due to change in the transformer turns,d) due to the induced e.m.f in the windings,a,"Explanation: In the driving system of an energy meter, magnitude of flux can be incorrect as a result of abnormal values of currents and voltages. This occurs due to change in the resistance of the pressure coil circuit."
Question 291,"3.	Energy meter creeps __________",a) due to change in supply,b) due to reversal in polarity of voltage,c) due to asymmetry in magnetic circuit,d) due to turns ratio of transformer,c,"Explanation: In an energy meter, when the magnetic circuit is asymmetrical, a driving torque is produced. As a result of this driving torque, the energy meter creeps."
Question 292,"4.	Supply voltage in an energy meter is __________",a) constant always,b) zero always,c) depends on the load,d) can fluctuate,d,Explanation: Generally the supply voltage is constant in an energy meter. It can fluctuate as a result of unavoidable reasons leading to errors in the reading of the energy meter. 
Question 293,"5.	How is the flux of shunt coil related to voltage?",a) flux is proportional to square of voltage,b) directly proportional,c) inversely proportional,d) independent of each other,a,"Explanation: In an energy meter, the supply voltage may fluctuate as a result of unavoidable reasons leading to errors in the reading. Supply voltage causes the shunt flux to induce an e.m.f in the disc. This is results in a self braking torque proportional to square of the voltage."
Question 294,"6.	How can temperature effect be compensated in an energy meter?",a) through heat sinks,b) by a temperature shunt,c) by using resistance,d) by using a coolant,b,Explanation: The resistance of the copper and aluminium parts in an energy meter increase with an increase in the temperature. As a result the disc rotates with a speed that is higher than actual. Temperature effects can be compensated by making use of a temperature shunt on the brake magnet.
Question 295,"8.	Creeping is avoided by __________",a) reversing the polarity of the voltage,b) drilling two diametrically opposite holes,c) holding the disc,d) increasing the friction,b,"Explanation: In an energy meter, creeping causes the disc to rotate even when there is no current flowing. By drilling two diametrically opposite holes under the edge of the poles of a shunt magnet, rotation of the disc is limited to a minimum value."
Question 296,"9.	In some energy meters, creeping can be avoided by __________",a) attaching small gold pieces,b) attaching small aluminium pieces,c) attaching small iron pieces,d) attaching small zinc pieces,c,"Explanation: By attaching some iron pieces to the edge of the disc, creeping can be limited in some energy meters. Force of attraction that is experienced by the brake magnet as a result of the iron piece is enough to eliminate the creeping.  "
Question 297,"1.	An electronic energy meter makes use of ___________",a) IC,b) Transformer,c) CRO,d) Multimeter,a,"Explanation: Basically, integrated circuits also known as IC’s are used for the operation of an electronic energy meter. "
Question 298,"2.	Measurement of energy involves _________",a) inductance and capacitance measurement,b) power consumption and time duration,c) resistance measurement and voltage drop,d) current consumption and voltage drop,b,"Explanation: An electronic energy meter is used in two stages. Energy measurement basically involves measurement of power and the time duration. In the first stage, it is used as a wattmeter while in the second stage it is used monitoring the power consumed in a time interval."
Question 299,"3.	Average power is _________",a) product of voltage and current,b) product of average current and voltage,c) product of instantaneous voltage and current,d) product of absolute voltage and current,c,Explanation: The average power is computed as the product of the instantaneous voltage across the load and the instantaneous current flowing through the load. A scaling device is used to bring the supply voltage to a proper level.
Question 300,"4.	What is the role of a multiplier?",a) it multiplies the voltage and current,b) divides the alternating voltage and current,c) supplies instantaneous voltage and current,d) multiplies alternating voltage and current,d,Explanation: A multiplier basically performs the multiplication of the alternating voltage and the current. Multiplier also provides the current in the form of instantaneous power to a voltage controlled oscillator.
Question 301,"5.	Frequency of oscillation in an electronic energy meter depends on",a) output current of multiplier,b) output voltage of multiplier,c) output power of multiplier,d) input resistance of multiplier,a,Explanation: Oscillator used in an energy meter generates a square wave. The frequency of the this depends on the output current flowing through the multiplier. 
Question 302,"6.	Analog signal is converted _________",a) into oscillations,b) into digital,c) into pulses,d) into current,b,"Explanation: The analog signal obtained in an electronic energy meter is converted into digital by making use of a digital circuit. By making use of a seven-segment display, energy is mentioned in watt-hours."
Question 303,"9.	Creeping in an energy meter can be found using _________",a) creep adjustment,b) preliminary light load adjustment,c) full load u.p.f adjustment,d) light load adjustment,b,Explanation: Energy meter can be tested for creeping using preliminary light load adjustment. Disc holes are so positioned that they aren’t under the poles of a series magnet.
Question 304,"10.	Preliminary light load adjustment involves _________",a) applying rated voltage across current coil,b) making use of a light load,c) applying rated voltage across pressure coil,d) adjusting the light load,c,"Explanation: Rated voltage is applied across the pressure coil. No current flows through the current coil. Till the disc stops rotating, light load device or equipment is adjusted continuously."
Question 305,"11.	Creep adjustment involves _________",a) adjusting the creep,b) exciting the current coil,c) adjusting the turns ratio,d) exciting the pressure coil,d,Explanation: The pressure coil is excited by 110% with respect to the rated voltage. Load current is zero. The meter will not creep provided the light load is adjusted correctly.  
Question 306,"12.	Light load adjustment involves _________",a) applying rated voltage across the pressure coil,b) adjusting a light load,c) applying rated current across the transformer,d) applying rated voltage across the current coil,a,Explanation: Disc rotation is adjusted in such a way that correct speed is maintained. The pressure coil is supplied with the rated voltage and the current coil is provided with only about 5 % of the full load at u.p.f.
Question 307,"13.	Low power factor adjustment involves _________","a)	 adjusting the power factor at lower loads",b) applying rated voltage to pressure coil and a p.f. of 0.5 for current coil,c) only applying rated voltage to pressure coil,d) only a p.f. of 0.5 for the current coil,b,"Explanation: Rated voltage is applied to the pressure coil. The current coil is provided with a current at 0.5 p.f. lagging. Till the disc rotates at correct speed, lag device is adjusted."
Question 308,"14.	Full load u.p.f adjustment involves _________",a) adjusting the loads at unity power factor,b) applying rated voltage to pressure coil and a p.f. of unity for current coil,c) only applying rated voltage to pressure coil,d) only a p.f. of unity for the current coil,c,Explanation: Rated voltage is applied to the pressure coil. The current coil is provided with a current at unity p.f. Errors are kept minimum and the position of the brake magnet is so adjusted that disc rotates at correct speed.
Question 309,"2.	Synchronization of A.C. supply means __________",a) different phase sequence,b) same phase sequence,c) zero phase,d) using a transformer,b,"Explanation: During synchronization, the phase sequences of any two given supplies are maintained equal. This is ensured by making use of a phase sequence indicator."
Question 310,"3.	How many types of phase sequence indicators are there?",a) 1,b) 5,c) 2,d) 10,c,"Explanation: Generally, two types of phase sequence indicators are used. The first one is the rotating type while the second type is the static type. Usually the rotating type of phase sequence indicator is used."
Question 311,"4.	A rotating phase sequence indicator consists of ________",a) 1 coil,b) 2 coils,c) 5 coils,d) 3 coils,d,"Explanation: A rotating type of phase sequence indicator basically consists of three coils. These are mounted at 120º to each other is space. The ends of the coils are connected to the terminals R, Y, and B respectively."
Question 312,"5.	The three coils are ________",a) star connected,b) delta connected,c) not connected,d) shorted,a,"Explanation: In a rotating type phase sequence indicator, the three coils are connected in the form of a star and excited by a three-phase supply. "
Question 313,"6.	Excitation of the three coils produces ________",a) a static magnetic field,b) a rotating magnetic field,c) a static electric field,d) a rotating electric field,b,Explanation: Aluminum disc is mounted on the top of the three coils. A rotating magnetic field is produced when the three coils are excited by a supply of three phase. As a result e.m.f with eddy current effects are induced in the coils.
Question 314,"8.	Disc rotation is determined by ________",a) the supply voltage,b) an arrow,c) the turns ratio,d) the load current,b,Explanation: Direction of rotation of the disc is determined by making use of an arrow that is marked on the disc. The phase sequence of the supply voltage is same as that mentioned on the terminals of the meter provided disc rotates in the same direction as the arrow head.
Question 315,"2.	In olden days voltmeters were __________",a) made of transistors,b) made of vaccum tubes,c) made of transformers,d) made of diodes,b,"Explanation: Initially, voltmeters were made of vaccum tubes. These voltmeters were known as vaccum tube voltmeters (VTVM)."
Question 316,"3.	Modern day voltmeters are made of __________",a) made of transformers,b) made of vaccum tubes,c) made of transistors and diodes,d) made of insulated iron coils,c,"Explanation: Nowadays in voltmeters, transistors and semiconductor diodes are used. A transistor voltmeter makes use of transistor in a voltmeter."
Question 317,"4.	FETVM is __________",a) an ammeter,b) a galvanometer,c) a multimeter,d) a voltmeter,d,Explanation: Field effect transistors can also be used at the input. Such voltmeters are known as FETVM (Field Effect Voltmeter).
Question 318,"5.	Electronic voltmeters are __________",a) compact,b) large in size,c) not portable,d) difficult to use,a,"Explanation: When compared to conventional analog voltmeters, electronic voltmeters are compact and also portable. This is due to the small size of the components."
Question 319,"7.	Electronic voltmeters are __________",a) dependent of frequency,b) dependent of voltage,c) independent of frequency,d) dependent of current,c,"Explanation: Usually electronic voltmeters can measure frequency in the range of a few volts D.C. to frequencies of the order of hundreds of MHz. As a result, the effect of frequency on the response of electronic voltmeters is negligible."
Question 320,"8.	Dynamic range of electronic voltmeter is __________",a) zero,b) limited,c) narrow,d) wide,d,"Explanation: When compared to conventional analog voltmeters, the dynamic range is very wide and improved in electronic voltmeters. Very low as well as very high input signals can be measured using an electronic voltmeter."
Question 321,"9.	Loading effect in electronic voltmeters is __________",a) nil,b) high,c) low,d)  medium,a,"Explanation: In an electronic voltmeter as the power is supplied by an external circuit, there is no loading effect. In a PMMC instrument, a minimum current of 50 µA is obtained from the signal that is to be measured and this leads to loading effect."
Question 322,"10.	Electronic voltmeters are ____________",a) measure high level signals,b) measure low level signals,c) measure medium level signals,d) don’t measure any signal,b,Explanation: Electronic voltmeters make use of amplifier circuits. As a result they can be used for measuring low level signals. 
Question 323,1. Input impedance of a voltmeter is ___________,a) high,b) low,c) medium,d) zero,a,"Explanation: In order to prevent the loading effect in a voltmeter, the input impedance is maintained as high as possible. It must be maintained higher than the impedance of the circuit being used."
Question 324,2. Input impedance depends on _________,a) resistance,b) capacitance,c) inductance,d) voltage,b,"Explanation: Shunt capacitance appearing across the input terminals affects the input impedance. Capacitive reactance of the capacitance is inversely proportional to the frequency.Xc _ 1⁄fwhere, Xc is the capacitive reactance      f is the frequency."
Question 325,3. At high frequencies the capacitive reactance.,a) is constant,b) increases,c) decreases,d) becomes zero,c,"Explanation: We know that the capacitive reactance is inversely proportional to the frequency.Xc _ 1⁄fAt high frequencies, the capacitive reactance becomes very small."
Question 326,4. Voltage ranges in a meter are _________,a) 5-10-15,b) 20-50-100,c) 0.5-1-1.5,d) 1-3-10,d,Explanation: Meter scale will have a calibration of 1-3-10 for the voltage range with a separation of 10 dB. It can also be in the sequence of 1.5-5-15. We can also make use of a single scale.
Question 327,5. Linear meter with 1% accuracy must have _________,a) 100 divisions,b) 50 divisions,c) 200 divisions,d) 500 divisions,a,Explanation: In order to recognise a reading with 1% accuracy it must have 100 divisions on the 1 V range.
Question 328,7. Noise is a function of _________,a) voltage,b) current,c) bandwidth,d) frequency,c,Explanation: Noise in general depends on the value of the bandwidth. Voltmeter having a large bandwidth takes up more noise. Usually the sensitivity of a voltmeter is 1mV for a bandwidth of 10Hz – 10MHz.
Question 329,8. Current can be measured effectively by making use of _________,a) d.c. voltmeter,b) a.c. ammeter,c) d.c. ammeter,d) a.c. voltmeter,d,Explanation: By making us e of a a.c. voltmeter in series with a resistance we can obtain the current value. We can also make use of the current probe method to obtain the value of the current without effectively disturbing the circuit.
Question 330,"1.	Low voltage signals can be measured by ___________",a) amplifiers,b) transformers,c) transducers,d) voltmeters,a,Explanation: Electronic voltmeters make use of amplifiers to measure low voltage signals. It consists of two or more stages of D.C. amplifiers. 
Question 331,"2.	Input impedance of an electronic voltmeter is ________",a) low,b) high,c) medium,d) zero,b,"Explanation: In an electronic voltmeter, the input impedance is maintained very high. This is achieved by making use of an FET (Field Effect Transistor) at the input of an electronic voltmeter."
Question 332,"4.	Bridge is balanced by ________",a) galvanometer,b) oscillator,c) zero adjustment resistor,d) head phone,c,Explanation: Bridge circuit in a basic D.C. electronic voltmeter is balanced by making use of a zero adjustment resistor such that the pointer shows zero deflection. 
Question 333,"5.	What is the effect of the input on the transistor Q2?",a) bias on Q2 decreases,b) bias on Q2 is constant,c) bias on Q2 is zero,d) bias on Q2 increases,d,Explanation: The bias on the transistor Q2 increases when the input voltage is applied. As a result a proportional amount of current flows through the meter. Hence the deflection of the meter is directly proportional to the applied voltage within the dynamic range.
Question 334,"6.	What is basic range of a meter?",a) causes maximum deflection,b) causes minimum deflection,c) causes zero deflection,d) causes medium deflection,a,Explanation: The input voltage that causes maximum deflection of the meter is known as the basic range of a meter. It occupies the lowest range on the range switch in the unamplified circuits.
Question 335,"7.	High range can be obtained in a basic D.C. electronic voltmeter by",a) a transformer,b) an attenuator,c) a transducer,d) a resistor,b,"Explanation: By making use of an attenuator in a basic D.C. electronic voltmeter, we get high range of values for the voltage reading. Attenuator is basically a voltage divider circuit with a predefined front panel."
Question 336,"9.	Overloading is ________",a) damages the meter,b) increases the temperature,c) doesn’t affect the meter,d) decreases the sensitivity,c,"Explanation: As transistors saturate after a certain range of operating voltage and current, the value of the meter current is limited. As a result, overloading does not affect the meter and it remains safe."
Question 337,1. R.M.S value means _________,a) root mean square,b) rate mean second,c) root median second,d) rate mode second,a,Explanation: R.M.S value indicates the Root Mean Square. It is obtained by taking the square root of the average value of the square of the input signal. It is also known as the effective value.
Question 338,2. Meter reading is obtained by ________,a) sensing voltage,b) sensing heat power,c) sensing current,d) sensing resistance,b,"Explanation: In a true R.M.S responding voltmeter, the meter reading is obtained by sensing the heat power of the waveform. The heat power is directly proportional to the r.m.s value of the input."
Question 339,3. Measurement of heat power ________,a) uses a heat sink,b) uses a thermometer,c) uses a thermocouple,d) uses a black body,c,Explanation: A thermocouple is used to measure the heat power in a true R.M.S responding voltmeter. Input voltage under measurement is applied to the heater to which a thermocouple is also attached.
Question 340,4. Sufficient heating of the heater is ensured by ________,a) increasing the temperature,b) making use of induction coil,c) amplifying d.c. input,d) amplifying a.c. input,d,Explanation: Maximum heating of the heater is obtained by making use of an amplified a.c. input. As a result the thermocouple generates maximum voltage level in order to cause the meter deflection.
Question 341,5. Power in a thermocouple is given by ________,a) Power =  E2 rms / Rheater,b) Power = E2 rms,c) Power = Rheater,d) Power =E2 rms _ Rheater,a,"Explanation: The power consumed in a thermocouple is given by the relationPower =  E2 rms ⁄ Rheaterwhere, Erms is the r.m.s value of the a.c. input signal            Rheater is the resistance of the heater."
Question 342,6. Main disadvantage of a true r.m.s responding voltmeter is ________,a) presence of transducer,b) presence of thermocouple,c) presence of transformer,d) presence of oscillator,b,Explanation: Thermocouples have non-linear voltage and current characteristics. This is the major drawback of the true r.m.s responding voltmeter. This is overcome in some instruments by making use of an additional thermocouple in the same thermal environment.
Question 343,7. What is the naming convention for the two thermocouples?,a) thermocouple 1 and thermocouple 2,b) input thermocouple and output thermocouple,c)  measuring thermocouple and balancing thermocouple,d) internal thermocouple and external thermocouple,c,Explanation: The thermocouple used in the input section of the voltmeter is known as the measuring thermocouple whereas the thermocouple used in the feedback path is known as the balancing thermocouple.
Question 344,8. Sensitivity is of the order of ________,a) MV,b) V,c) GV,d) mV,d,Explanation: By making use of true r.m.s responding voltmeter we get sensitivity of the order of mV. The voltage ranges from 100 µV to 300 V with a frequency range of 10 Hz to 100 MHz.
Question 345,"1.	Electronic multimeter measures ________","a) voltage, current and resistance",b) voltage and current,c) current and power,d) energy and power,a,"Explanation: A.C. as well as D.C. voltage, current and resistance can be measured by making use of an electronic multimeter. It is also known as an voltage-ohm meter."
Question 346,"2.	Basic circuit of multimeter consists ________",a) of a.c. amplifier,b) of d.c. amplifier,c) operational amplifier,d) power amplifier,b,"Explanation: A.C. as well as D.C. voltage, current and resistance can be measured by making use of an electronic multimeter. The basic circuit of a multimeter is made up of d.c. amplifier circuit in the form of a balanced bridge."
Question 347,"3.	Input signal magnitude is limited by ________",a) button,b) resistance,c) attenuator,d) voltage,c,Explanation: A range switch is provided in an electronic multimeter in order to limit the input signal in terms of magnitude. We can adjust the input attenuator and limit the input signal in terms of magnitude.
