Question Name,Question,Option A,Option B,Option C,Option D,Answer,Explanation
Question 1,1. Which circuit is called as regenerative repeaters?,a) Analog circuits,b) Digital circuits,c) Amplifiers,d) A/D converters,b,Explanation: The main advantage of digital communication is that the signals can be reproduced easily. Thus digital circuits are called as regenerative repeaters.
Question 2,2. What are the advantages of digital circuits?,a) Less noise,b) Less interference,c) More flexible,d) All of the mentioned,d,"Explanation: Digital circuits are less subject to noise, distortion and interference as it works on digital pulses and also the pulses can be regenerated."
Question 3,3. How many different combinations can be made from a n bit value?,a) 2(n+1),b) 2(n),c) 2(n)+1,d) None of the mentioned,b,"Explanation: 2(n) different combinations can be made from n bit value. For example, from 2 bit value 22 different combinations-00,01,10,11 can be made."
Question 4,4. How many bytes does a gigabyte have?,a) 1 million bytes,b) 10 million bytes,c) 1 billion bytes,d) 10 billion bytes,c,Explanation: One gigabyte has 1 billion bytes.
Question 5,5. What is the ASCII value of space?,a) 32,b) 48,c) 96,d) 65,a,Explanation: The ASCII value of space is 32 and ASCII value of 0 is 48.
Question 6,6. Which block or device does the data compression?,a) Channel encoder,b) Source encoder,c) Modulator,d) None of the mentioned,b,Explanation: Source encoder converts the digital or analog signal to a sequence of binary digits. This process is called as source encoding or compression.
Question 7,7. What is the code rate?,a) k/n,b) n/k,c) All of the mentioned,d) None of the mentioned,a,Explanation: Here n is the total bits of sequence and k bits are mapped. Amount of redundancy introduced is given by n/k and its reciprocal is the code rate.
Question 8,8. Pulse shaping is done by which block or system?,a) Encoder,b) Baseband modulator,c) Pulse code modulator,d) Demodulator,c,Explanation: Pulse code modulator does filtering process to build pulses that occupy more than one bit time.
Question 9,9. Equalizer is used for?,a) Filtering,b) Diminish distortion,c) All of the mentioned,d) None of the mentioned,c,Explanation: Equalizer is used as a filtering option and also diminishes or reduces the distortion.
Question 10,10. Source coding block is used for?,a) Compressing,b) Digitizing,c) A/D conversion,d) All of the mentioned,d,"Explanation: Source encoding does all these processes-compression, digitizing the signal and performs analog to digital conversion."
Question 11,11. Which measurement considers phase as an important parameter?,a) Coherent,b) Non-coherent,c) All of the mentioned,d) None of the mentioned,a,Explanation: Coherent measurement considers phase as an important parameter.
Question 12,12. The size of the alphabet M in symbol is calculated as?,a) 2(k+1),b) 2k,c) 2(k-1),d) 1+2k,b,Explanation: The size of the alphabet is calculated using 2^k where k is the number of bits in the symbol.
Question 13,1. What is the period of a signal x(t)?,a) T,b) 2T,c) T/2,d) None of the mentioned,a,Explanation: A signal is said to be periodic if the duration of one complete cycle is T and it repeats itself after this duration.
Question 14,2. Which of the given signals are periodic?,a) x(t) = 4 cos(5πt),b) x(t) = u(t) – 1/2,c) x(t) = 4u(t) + 2sin(3t),d) x[n] = 2sin(3n),a,"Explanation:	T=2π / 5π = 2/5, periodic with period 2/5."
Question 15,3. Check whether the signal is periodic or not?,x(t) = cos(4t) + 2sin(8t),a) Periodic with period π/2,b) Periodic with period 2,c) Periodic with period 2/π,a,"Explanation: T1=2π /4   T2=2π /8, T1/T2 = 2   T=T1 or 2T2, T=π /2. "
Question 16,4. Find the periodicity of the following signal. x(t)=cos((2π/7)t)sin((3π/5)t),a) 30,b) 7,c) 35,d) 5/3,c,"Explanation: T1=2π/2π/7 = 7, T2=2π/3π/5=5/3, T1/T2=5/21, T=21T1 or 5T2, T=35. "
Question 17,5. Find the fundamental period of 1+sin^2 (3π/5)n.,a) 10/3,b) 5,c) 3π/5,d) None of the mentioned,b,Explanation: sin2(3π/5)n = (1-cos(6π/5)n)/2 = 1/2-1/2cos(6π/5)n ; period = 6π/(5*2π) = k/N = 3/5 ; N=5. 
Question 18,6. Which signal is called as energy signal?,a) Finite energy and zero power,b) Finite energy and non-zero power,c) Infinite energy and zero power,d) Infinite energy and non-zero power,a,Explanation: A signal is said to be an energy signal if it has finite energy and zero average power.
Question 19,7. Which signal is said to be power signal?,a) Infinite power and zero energy,b) Infinite power and non-zero energy,c) Finite power and infinite energy,d) Finite power and zero energy,c,Explanation: A signal is said to be power signal if it has finite power and infinite energy.
Question 20,8. Determine the periodicity and also find whether it is a power or energy signal?,"		e(-at)u(t)",a) Periodic and energy signal,b) Non periodic and energy signal,c) Periodic and power signal,b,Explanation: This is non periodic as it does not repeat itself after any period. And on calculating we will get energy as 1/2a which is finite. Thus it is an energy signal.
Question 21,9. Continuous Impulse signal is a power or energy signal?,a) Power signal,b) Energy signal,c) Both power and energy,d) Neither power nor energy signal,d,Explanation: On calculating using the power and energy calculation formula we will arrive at it is neither power nor energy signal.
Question 22,10. Discrete impulse signal is a power or energy signal?,a) Power signal,b) Energy signal,c) Both  power and energy signal,d) Neither power or energy signal,b,Explanation: On calculating using energy formula we will get the energy of this signal as 1 which is a finite value. Thus it is a energy signal.
Question 23,11. A unit impulse function has?,a) Large amplitude,b) Zero pulse width,c) Unity weight,d) All of the mentioned,d,"Explanation: An impulse function has infinite or large amplitude, zero pulse width and unity weight which is concentrated at zero."
Question 24,1. Power spectral density function is a?,a) Real and even function,b) Non negative function,c) Periodic,d) All of the mentioned,d,Explanation: A power signal is periodic signal and its function is a real even and non negative function as per the definition.
Question 25,2. Energy spectral density defines,a) Signal energy per unit area,b) Signal energy per unit bandwidth,c) Signal power per unit area,d) Signal power per unit bandwidth,b,Explanation: Energy spectral density gives the signal energy equal to the area under the waveform energy spectral density versus frequency curve.
Question 26,3. Power spectrum describes distribution of _________ under frequency domain.,a) Mean,b) Variance,c) Gaussian,d) None of the mentioned,b,"Explanation: Power spectrum gives the distribution of variance of a signal in the frequency domain, sampled into spectral components."
Question 27,4. How can power spectral density of non periodic signal be calculated?,a) By integrating,b) By truncating,c) By converting to periodic,d) None of the mentioned,b,"Explanation: A power signal usually is a periodic signal. But power spectral density of non periodic signal can be calculated by truncating it and observing it in the range of (-T/2,T/2)."
Question 28,5. What is Wiener-Khinchin theorem?,a) Spectral density and auto-covariance makes a fourier transform pair,b) Spectral density and auto-correlatioon makes a fourier tranform pair,c) Spectral density and variance makes a fourier tranform pair,d) None of the mentioned,b,Explanation: According to the theorem spectral density of a signal x(t) and auto correlation function makes a fourier tranform pair.
Question 29,6. According to Parseval’s theorem the energy spectral density curve is equal to?,a) Area under magnitude of the signal,b) Area under square of the magnitude of the signal,c) Area under square root of magnitude of the signal,d) None of the mentioned,b,Explanation: According to Parseval/s theorem the energy spectral density function can be given as equal to the square of the magnitude of the signal x(t).
Question 30,7. Spectogram is the graph plotted against?,a) Frequency domain,b) Time domain,c) Frequency & Time domain,d) None of the mentioned,b,Explanation: Spectral density function is plotted against frequency domain and spectogram is a graph which is plotted against time domain.
Question 31,8. Autocorrelation is a function which matches,a) Two same signals,b) Two different signal,c) One signal with its delayed version,d) None of the mentioned,c,Explanation: Autocorrelation is a function that matches a signal with its delayed version.
Question 32,9. Autocorrelation is a function of,a) Time,b) Frequency,c) Time difference,d) Frequency difference,c,Explanation: Autocorrelation is a function of time difference as it matches the signal with its delayed version.
Question 33,10. Autocorrelation is maximum at _______,a) Unity,b) Origin,c) Infinite point,d) None of the mentioned,b,Explanation: According to its properties autocorrelation is maximum at origin.
Question 34,11. Autocorrelation function of periodic signal is equal to _______,a) Energy of the signal,b) Power of the signal,c) Its area in frequency domain,d) None of the mentioned,b,Explanation: Autocorrelation function of a real valued signal is equal to the energy of the signal and auto-correlation function of the periodic signal is equal to the average power of the signal.
Question 35,12. Autocorrelation is a _______ function.,a) Real and even,b) Real and odd,c) Complex and even,d) Complex and odd,a,Explanation: According to properties of autocorrelation function it a even function when the frequency value f is real.
Question 36,13. Autocorrelation function of white noise will have?,a) Strong peak,b) Infinite peak,c) Weak peak,d) None of the mentioned,a,Explanation: Autocorrelation function curve of continuous time white noise signal has a strong peak.
Question 37,1. Random variables give relationship between _____,a) Two random events,b) Probability of occurence of two random events,c) Random event and a real number,d) Random event and its probability of occurrence,c,Explanation: A random variable gives a functional relationship between a random event and a real number.
Question 38,2. The distribution function of random variable is,a) P(X less than or equal to x),b) P(X greater than or equal to x),c) P(X less than x),d) P(X greater than x),a,Explanation: The distribution function of a random variable is the probability that the value taken by the random variable is less than or equal to the real number x.
Question 39,3. The distribution function of -(infinity) and (infinity) is _____,a) 0 and 1,b) 1 and 0,c) Both 0,d) Both 1,a,Explanation: F(minus infinity) is 0 and F(infinity) is 1.
Question 40,4. The value of the probability density function of random variable is,a) Positive function,b) Negative function,c) Zero,d) One,a,Explanation: The probability density function is always greater than 0. It is a non negative function with the area of 1.
Question 41,5. Which gives the measure of randomness of the random variable?,a) Mean,b) Variance,c) Standard variance,d) Pdf,b,Explanation: Variance gives the randomness of the random variable. It is the difference between the mean square value and square of the mean.
Question 42,6. Random process is a function of ______,a) Random event and time,b) Random event and frequency,c) Random event and real number,d) None of the mentioned,a,Explanation: Random process is a function of two variables: a random event and its time of occurrence.
Question 43,7. A random process is called as stationary in strict sense if,a) Its statistics vary with shift in time origin,b) Its statistics does not vary with shift in time origin,c) Its autocorrelation vary with shift in time,d) Its autocorrelation does not vary with shift in time,a,Explanation: A random process is defined to be stationary in a strict sense if its statistics varies with a shift in time origin.
Question 44,"8. For a stationary process, autocorrelation function depends on",a) Time,b) Time difference,c) Does not depend on time,d) None of the mentioned,b,Explanation:  Autocorrelation function depends on the time difference between t1 and t2.
Question 45,9. The autocorrelation function is maximum at,a) Origin,b) Infinity,c) Origin & Infinity,d) None of the mentioned,a,Explanation: On substituting different values in the formula for autocorrelation function it wil be maximum at the origin.
Question 46,10. Standard deviation is ______,a) Rms value of dc,b) Rms value or ac,c) Either ac or dc,d) Neither dc nor ac,b,Explanation: The standard deviation of a random variable gives the rms value of an ac component.
Question 47,11. The average power of white noise is,a) Zero,b) Unity,c) Infinity,d) Between zero and one,c,Explanation: The average power of white noise is infinity because its bandwidth is infinite.
Question 48,12. White noise has _____ mean and ______ variance.,a) Zero and zero,b) Finite and zero,c) Zero and finite,d) One and zero,c,"Explanation: White noise is a zero mean function with infinite average power, finite variance and infinite bandwidth."
Question 49,1. The process of data conversion along with formatting the data is called as ______,a) Formatting,b) Modulation,c) Source coding,d) Amplifying,c,Explanation: The process of converting source information to a digital signal and also formatting it is called as source coding.
Question 50,2. Formatting is the process which includes,a) Pulse code modulation,b) Sampling,c) Quantization,d) All of the mentioned,d,"Explanation: Formatting is the process in which the source information is converted to digital signals using methods like sampling, pulse code modulation etc."
Question 51,3. Analog information is converted to digital data using,a) Sampling,b) Quantization,c) Coding,d) All of the mentioned,d,"Explanation: Textual information, analog information and digital information undergoes different processes before converting to binary or digital data. The method used for converting analog information are the given methods."
Question 52,4. The process that transforms text into binary digits is called as _______,a) Binary coding,b) Data coding,c) Character coding,d) Sampling,c,Explanation: According to the definition the process of converting textual data to binary digits is called as character coding.
Question 53,"5. For the number of bits, k=1 and number of symbols, M=2 the system is called as",a) Unary,b) Binary,c) Quarternary,d) None of the mentioned,b,"Explanation: For k number of bits, the number of symbols are M=2k. For k=1 and M=2 the system is called as binary coding."
Question 54,6. Perform the bit stream partitioning and find the 8-ary waveform for the word ‘THINK’.,a) 1204443464,b) 4643444021,c) 1240443464,d) none of the mentioned,a,"Explanation: “THINK”ASCII value: T-001010 ; H-000100; I-100100; N-011100; K-110100	8-ary symbols(split into 3 bits): 1 2 0 4 4 4 3 4 6 4. "
Question 55,7. Find the 32-ary waveform for the word ‘THINK’.,a) 514172520,b) 202517415,c) 541172520,d) None of the mentioned,a,"Explanation: “THINK”	ASCII value: T-001010; H-000100; I-100100; N-011100; K-110100	32-ary symbols(split into 5 bits): 5 1 4 17 25 20. "
Question 56,8. Find the 8-ary waveform for the word ‘HAPPY’.,a) 4040020246,b) 0440020246,c) 6420200440,d) None of the mentioned,b,"Explanation: “HAPPY”	ASCII value: H-000100; A-100000; P-000010; P-000010; Y-100110	8-ary symbols: 0 4 4 0 0 2 0 2 4 6. "
Question 57,9. Find the 32-ary waveform for the word ‘HAPPY’.,a) 280856,b) 658082,c) 288056,d) None of the mentioned,a,"Explanation: “HAPPY”	ASCII value: H-000100; A-100000; P-000010; P-000010; Y-100110	32-ary symbols: 2 8 0 8 5 6. "
Question 58,10. What are the characteristics of an ideal transmission line?,a) Different amplitude,b) No distortion,c) Time delay,d) All of the mentioned,d,Explanation: The output from the ideal transmission line has some time delay different amplitude but it should not have distortion it should have the same shape as the input.
Question 59,11. The point at which the output signal power has fallen to 0.707 of its peak value is called as _____,a) 3db point,b) Half power point,c) 3db & Half power point,d) None of the mentioned,c,Explanation: The frequency at which the output signal power falls to half the peak value is called as half power point or 3db point.
Question 60,12. The ratio of the filter bandwidth at -60db and -6db amplitude response point is called as _____,a) Half point factor,b) Normalized factor,c) Shape factor,d) None of the mentioned,c,Explanation: Shape factor is a measure of how well realizable filter approximates to ideal filter. It is the ratio of filter bandwidths -60db and -6db amplitude points.
Question 61,"13. As the order of the filter increases, the cost ______ and complexity ______","a) Increases, increases","b) Increases, decreases","c) Decreases, increases","d) Decreases, decreases",a,Explanation: According to the design of the filter as the order increases the complexity and cost of the filter also increases.
Question 62,14. Which filter has maximum flatness?,a) Chebyshev filter,b) Butter-worth filter,c) High pass filter,d) Normalized filter,b,Explanation: Butter-worth filter as the best approximation to ideal filter and has the maximum flatness in the filter pass-band.
Question 63,15. The measure of the width of the main lobe is called as ________,a) Null to null bandwidth,b) Half power bandwidth,c) Normalized bandwidth,d) Absolute bandwidth,a,Explanation: The main lobe consists of the maximum signal power. The measure of the width of the main lobe is called as null to null bandwidth.
Question 64,1. SQNR can be improved by _______ sampling rate.,a) Increasing,b) Decreasing,c) Does not depend,d) None of the mentioned,a,Explanation: SQNR can be improved by increasing the sampling rate.
Question 65,2. Which offers better SQNR?,a) Delta modulation,b) PCM,c) Delta modulation & PCM,d) None of the mentioned,b,Explanation: PCM offers better SQNR than delta modulation.
Question 66,3. Two functions are called as orthogonal if on integrating the product we get,a) One,b) Zero,c) Infinity,d) None of the mentioned,b,Explanation: Two functions are called as orthogonal if the integral value of integrating the product is zero.
Question 67,5. Shot noise is produced by,a) Electrons,b) Photons,c) Electrons & Photons,d) None of the mentioned,c,Explanation: Shot noise occurs due to particle like the behaviour of electron and photon.
Question 68,6. Shot noise is avoidable when current is,a) Zero,b) One,c) Infinity,d) None of the mentioned,a,Explanation: Shot noise is avoidable only when the current is zero.
Question 69,7. Shot noise is,a) Stochastic process,b) Poisson process,c) Stochastic & Poisson process,d) None of the mentioned,b,Explanation: Shot noise is a Poisson process.
Question 70,8. Which occurs due to equilibrium fluctuations?,a) Thermal noise,b) Johnson noise,c) Thermal & Johnson noise,d) None of the mentioned,c,Explanation: Thermal noise occurs due to equilibrium fluctuations. This noise is also called as Johnson noise.
Question 71,9. Flicker noise is called as,a) White noise,b) Pink noise,c) Brown noise,d) None of the mentioned,b,Explanation: Flicker noise is called as pink noise.
Question 72,10. Which has the same power spectral density?,a) White noise,b) Brown noise,c) White & Brown noise,d) None of the mentioned,a,Explanation: White noise has same power spectral density where as it decreases in case of brown noise.
Question 73,1. Which noise is useful for dithering?,a) White noise,b) Pink noise,c) Brown noise,d) None of the mentioned,c,Explanation: Brown noise is sometimes useful for dithering.
Question 74,2. Capacity of a channel can be increased by,a) Increasing channel bandwidth,b) Increasing signal power,c) Increasing channel bandwidth &signal power,d) None of the mentioned,c,Explanation: Capacity of a channel can be increased by increasing channel bandwidth and also by increasing signal power.
Question 75,4. Noise has,a) Infinite energy,b) Infinite power,c) Infinite energy & power,d) None of the mentioned,a,Explanation: Noise has infinite energy signal.
Question 76,5. Thermal noise is,a) Energy signal,b) Power signal,c) Energy & Power signal,d) None of the mentioned,b,Explanation: Thermal noise is considered as power signal as it has infinite energy.
Question 77,7. The maximum likelihood function is,a) Positive,b) Negative,c) Any of the mentioned,d) None of the mentioned,a,Explanation: The maximum likelihood function is always positive.
Question 78,8. Matched filtering operation includes,a) Spectral phase matching,b) Spectral amplitude matching,c) Spectral phase &  amplitude matching,d) None of the mentioned,c,Explanation: Matched filtering includes two operations – spectral amplitude matching and spectral phase matching.
Question 79,9. Matched filter is,a) Linear,b) Non linear,c) Linear & Non linear,d) None of the mentioned,a,Explanation: Matched filter is a linear filter.
Question 80,10. Which consists of less ISI?,a) Nyquist filter,b) Raised cosine filter,c) Nyquist & Raised cosine filter,d) None of the mentioned,b,Explanation: Raised cosine filter results in less ISI than Nyquist filter.
Question 81,1. Digital communication is _______ to environmental changes?,a) Less sensitive,b) More sensitive,c) Does not depend,d) None of the mentioned,a,Explanation: Digital communication is less sensitive to environmental changes like temperature etc.
Question 82,2. Advantages of digital communication are,a) Easy multiplexing,b) Easy processing,c) Reliable,d) All of the mentioned,d,"Explanation: Digital communication is a very reliable communication. It is easy for multiplexing, easy for signalling and processing etc."
Question 83,3. What is necessary for digital communication?,a) Precision timing,b) Frame synchronization,c) Character synchronization,d) All of the mentioned,d,"Explanation: Bit, character, frame synchronization and precision timing is necessary for digital communication. This is considered as a disadvantage of digital communication."
Question 84,4. What are the disadvantages of digital communication?,a) Needs more bandwidth,b) Is more complex,c) Needs more bandwidth & Is more complex,d) None of the mentioned,c,"Explanation: Digital communication needs more bandwidth, has higher complexity and little performance degradation occurs during analog to digital conversion and vice versa."
Question 85,5. Examples of digital communication are,a) ISDN,b) Modems,c) Classical telephony,d) All of the mentioned,d,"Explanation: Some of the examples of digital communication systems are classical telephony, ISDN, Modems, LANs, PCM TDM etc."
Question 86,6. Which system uses digital transmission?,a) ISDN,b) LANs,c) ISDN & LANs,d) None of the mentioned,c,"Explanation: Though the signal type is analog or digital, the transmission takes place in the digital domain in ISDN and LANs."
Question 87,7. The interval of frequencies outside which the spectrum is zero is called as ________,a) null to null bandwidth,b) normalized bandwidth,c) absolute bandwidth,d) none of the mentioned,c,Explanation: The measure of frequencies outside which spectrum is zero is called as absolute bandwidth. It is usually infinite.
Question 88,8. The attenuation level in bounded power spectral density is,a) 35,b) 50,c) 35 & 50,d) none of the mentioned,c,Explanation: Bounded power spectral density is the bandwidth outside which the spectrum must have fallen to a stated level below that found at the band center.
Question 89,9. Synchronization available in digital communication are,a) Symbol synchronization,b) Frame synchronization,c) Carrier synchronization,d) All of the mentioned,d,"Explanation: The synchronization techniques available in digital communication are symbol synchronization, frame synchronization and carrier synchronization."
Question 90,10. Digital system includes,a) Better encryption algorithm,b) Difficult data multiplexing,c) All of the mentioned,d) None of the mentioned,a,"Explanation: Digital system has an advantage of better encryption algorithm, easier data multiplexing and more reliability."
Question 91,11. Analog to digital conversion includes,a) Sampling,b) Quantization,c) Sampling & Quantization,d) None of the mentioned,c,Explanation: Analog to digital conversion is a two step process which includes sampling and quantization.
Question 92,1. What are the main features of a receiver?,a) Synchronization,b) Multiple parallel receiver chain,c) Synchronization & Multiple parallel receiver chain,d) None of the mentioned,c,"Explanation: The main features of a receiver which increases its complexity are synchronization of carrier, phase, and timing and multiple parallel receiver chain."
Question 93,2. What conditions must be fulfilled in a good digital communication system?,a) High data rate,b) High fidelity,c) Low transmit power,d) All of the mentioned,d,"Explanation: Some of the conditions which must be satisfied in a digital communication system are high data rate, high fidelity, low bandwidth, low transmit power and low transmitter and receiver complexity."
Question 94,3. Wired channels are,a) Lossy,b) Lossless,c) Lossy & Lossless,d) None of the mentioned,a,Explanation: Wired channels are lossy channels.
Question 95,4. The equivalent temperature in a receiver design must be kept,a) Low,b) High,c) Does not affect the receiver,d) None of the mentioned,a,Explanation: The equivalent temperature is the function of the receiver design and it must be always kept low.
Question 96,5. Which corrects the sampling time problem in a digital system?,a) Interpolator,b) Decimator,c) Equalizer,d) Filter,a,Explanation: Interpolator corrects the sampling time problem using discrete time processing.
