Question Name,Question,Option A,Option B,Option C,Option D,Answer,Explanation,
Question 591,Next step after 'defining current business' is to,external and internal audit,Formulating a new direction,Formulating strategies,Implement the strategies,A,No explanation,
Question 592,An idea of instituting 'HR' policies to support and encourage senior workers is part of,promotions,transfers,reality shock,managing retirements,D,No explanation,
Question 593,'performance appraisal' is an example of,human process intervention,techno structural interventions,strategic intervention,HRM interventions,D,No explanation,
Question 594,In career development discussing your career with your manager is part of,individual role,manager role,employer role,line manager,A,No explanation,
Question 595,'supply chain management' is included in,personal competencies,interpersonal competencies,business management,Both A and C,C,No explanation,
Question 596,Scale is used in 'HRD' scorecard consists of,5-point scale,10-point scale,4-point scale,none of above,B,No explanation,
Question 597,Kind of union security from employees unions in which company can hire people that are not members of unions is classified as,closed shop,union shop,agency shop,preferential shop,B,No explanation,
Question 598,Employers generally use feedback to,employee development,avoid central tendency and biases,rank someone,hire the employee,A,No explanation,
Question 599,'job rotation' means,redesigning jobs of workers,assigning additional activities to workers,moving workers from one job to the other,none of above,C,No explanation,
Question 600,Stage in which manager makes sure that past practices are still in continuation or not is,unfreezing stage,moving stage,refreezing stage,nonmoving stage,C,No explanation,
Question 601,'Talent Management' automated end to end process involves,recruiting and hiring,managing employees,compensating employees,all of above,D,No explanation,
Question 602,Asking manager 'Does employee is informed about performance standards' is part of,antecedents,behavior,consequences,counseling,A,No explanation,
Question 603,An example of 'variable pay' is,profit sharing plan,pay for performance,pay for skills,pay for tenure,A,No explanation,
Question 604,Bankers are best classified in a personality type of,realistic orientation,investigative orientation,social orientation,conventional orientation,D,No explanation,
Question 605,'qualitative methods of evaluation' does not include,point method,factor comparison method,graphical evaluation,none of above,D,No explanation,
Question 606,People favors career in which personal needs of employees are subordinated to company is,realistic orientation,investigative orientation,social orientation,conventional orientation,D,No explanation,
Question 607,Ranging and grading salary into just few levels is called,broad banding,less branding,competency model,skill based pay model,A,No explanation,
Question 608,Changing behavior of employees by rewarding or punishing is called,behavior modification,behavior modeling,behavior reshaping,behavior management,A,No explanation,
Question 609,In traditional focus providing information about skills learning is included in,training and development,performance appraisal,recruiting and placement,human resource planning,A,No explanation,
Question 610,In talent management end to end process learning management systems lead to,succession planning,performance management,compensation management,e-recruiting,D,No explanation,
Question 611,"In 'ABC' approach which is used in formulating hypothesis ""A"" stands for",apprenticeship,antecedents,appraisal performance,appraisal management,B,No explanation,
Question 612,'HR' activities lead to,Achievement of strategic goals,Organizational performance,Emergent employee behaviors,all of above,D,No explanation,
Question 613,Interviews with employees who are leaving firm for any reason are classified as,termination interview,outplacement counseling,exit interviews,subordination interviews,C,No explanation,
Question 614,People attracted to occupations that require physical activities are best classified as,realistic orientation,investigative orientation,social orientation,artistic orientation,A,No explanation,
Question 615,Certain basic factors used for comparing jobs are called,compensable factors,intuitive factors,logical factors,comprehensive factors,A,No explanation,
Question 616,An employee training and confidence building is best classified as,extrinsic rewards,intrinsic rewards,de-expectancy,expectancy,D,No explanation,
Question 617,Online career development workshops are one of method of,career management,appraisal management,performance management,employee development,A,No explanation,
Question 618,In setting SMART goals 'M' stands for,Measureable,Managed personnel,More than expected,none of above,A,No explanation,
Question 619,'commission' that salesmen earns is an example of,direct pay,indirect pay,compensation,direct recruitment,A,No explanation,
Question 620,Measure of 'cost effectiveness' among employees is part of,HRD culture,Business linkage score,HRD competence score,HRD system maturity score,B,No explanation,
Question 621,Validity test for applicants for a specific job is called,concurrent validation,predictive validation,criterion validity,content validity,B,No explanation,
Question 622,Lawyers are tend to be classified as personality type of,social,non artistic,investigative,enterprising,D,No explanation,
Question 623,Types of 'test validity' consist of,criterion validity,content validity,Score validity,Both A and B,D,No explanation,
Question 624,Example of 'general competency' related to job is included,strategic thinking,mathematical reasoning,reading and writing,both b and c,D,No explanation,
Question 625,Providing employees development budget is a method relating to,career management,appraisal management,performance management,employee development,A,No explanation,
Question 626,Building blocks of performance management are,3,4,5,6,D,No explanation,
Question 627,In career development realistic career plans is included in,individual role,manager role,employer role,line manager,A,No explanation,
Question 628,A system which measures ongoing performance and e-mails reports is called,direction sharing,goal alignment,ongoing performance monitoring,ongoing feedback,C,No explanation,
Question 629,An availability of information systems to integrate learning with employee pay is part of,phased retirement,preretirement counseling,talent management,modifying selection procedure,C,No explanation,
Question 630,Distinct task of staff manager is to,Advise other employees,Evaluating performance,Issuing orders to others,Appraising performance,A,No explanation,
Question 631,An availability of information systems to integrate recruitment with learning is a part of,phased retirement,preretirement counseling,talent management,modifying selection procedure,C,No explanation,
Question 632,Disadvantage of graphic rating scale is,halo effect,bias,central tendency,all of above,D,No explanation,
Question 633,Rates are placed in percentages in performance categories is followed in,graphic rating scale method,forced distribution method,alternation ranking method,paired comparison method,B,No explanation,
Question 634,Counseling with employees for benefits advice and second careers is an example of,phased retirement,preretirement counseling,honoring experience,modifying selection procedure,B,No explanation,
Question 635,Interviews can be,structured only,unstructured only,both structured and unstructured,none of above,C,No explanation,
Question 636,An availability of new talent management information system is a key driver of,phased retirement,career management,talent management,modifying selection procedure,C,No explanation,
Question 637,Defining factors to be compared is included in,selection of compensable factors,selection of intuitive factors,selection of logical factors,selection of comprehensive factors,A,No explanation,
Question 638,A company's strategic goals must work towards,succession planning,performance management,compensation management,all of above,D,No explanation,
Question 639,In career development providing timely performance feedback is a futile part of,individual role,manager role,employer role,line manager,B,No explanation,
Question 640,Training of employees during a job is called,on the job training,off the job training,job instruction training,none of above,A,No explanation,
Question 641,A country in which headquarters of company are located are classified as,Third country nationals,home country nationals,expatriates,subordinates,B,No explanation,
Question 642,Introduction of new or current trends for optimal 'HR' utilization is part of,Coordinative function,Staff function,Line function,all of above,B,No explanation,
Question 643,An equity theory of motivation applies to employees who are often,under paid,over paid,regularly paid,non paid internees,A,No explanation,
Question 644,Reducing in work hours is an example of,phased retirement,flexible work,honoring experience,modifying selection procedure,A,No explanation,
Question 645,Each department of company helps in achieving company goals is referred as,Corporate strategy,Competitive strategy,Functional strategy,Both a and b,C,No explanation,
Question 646,Calculating numerical rating and arranging each job according to skill is called,point method,job grading,factor comparison method,alternation ranking method,C,No explanation,
Question 647,"In 'ABC' approach which is used in formulating hypothesis ""B"" stands for",behavior,benchmarking,best supporting team,bearing peer pressure,A,No explanation,
Question 648,Establishing company based career centers is a method relating to,career management,appraisal management,performance management,employee development,A,No explanation,
Question 649,Process of identifying assessing and developing leadership is called,Employment planning,Human resource planning,Succession planning,all of above,C,No explanation,
Question 650,Straight commission plan pay salespeople for their,results,experience,skills,knowledge,A,No explanation,
Question 651,Performance management distinct feature is,continuous evaluating,continuous re-evaluating,never evaluating performances,evaluating for salary purposes,B,No explanation,
Question 652,Comparison of fairness of job's pay rate to other jobs in company is called,external equity,collective equity,individual equity,internal equity,D,No explanation,
Question 653,Workers compensation disability insurance health and hospitalization costs are all types of,employment benefits,unemployment benefits,insurance benefits,optional benefits,C,No explanation,
Question 654,One time paid payment at time of termination of employees is classified as,compensation pay,supplemental pay,sick leave pay,severance pay,D,No explanation,
Question 655,Counseling with employees before retirement for second careers outside firm is an example of,phased retirement,preretirement counseling,honoring experience,modifying selection procedure,B,No explanation,
Question 656,Coordination of personnel activities is a crucial part of,Functional authority,Line function,Staff functions,all of above,A,No explanation,
Question 657,First step in planning process is to,Set an objective,Evaluate alternatives,Determine strength and weaknesses,none of above,A,No explanation,
Question 658,An advantage of 'critical incident method' is,avoids central tendency and biases,avoids central tendency and biases,provides behavioral anchors,ongoing basis evaluation,D,No explanation,
Question 659,A company 'Apollo' tyres diversifying in entertainment business can be a classic example of,Conglomerate diversification,Related diversification,Both A and B,none of above,A,No explanation,
Question 660,Dimension which measures competency of company's top management to lower level employees is,HRD systems maturity score,HRD competence score,HRD culture,Employee linkage score,B,No explanation,
Question 661,An employee compares his pay with other's pay in company at same position is called,internal equity,external equity,collective equity,individual equity,B,No explanation,
Question 662,Period that spans between ages 15 to 24 is classified as,exploration stage,trial sub stage,establishment stage,maintenance stage,A,No explanation,
Question 663,Generally in chain of command no one can issue orders outside their own department is,staff managers,line managers,CEO,none of above,A,No explanation,
Question 664,Levels and series of steps based on years of service in pay grades are called,pay ranges,grade ranges,similar jobs grades,anchoring pay ratings,A,No explanation,
Question 665,When person's performance is not satisfactory but can be improved is,satisfactory-promotable interview,satisfactory-not promotable interview,unsatisfactory-correctable interview,unsatisfactory-uncorrectable interview,C,No explanation,
Question 666,Measuring performance on basis of job tasks actually done is called,sampling technique,work sampling technique,work sample,all of above,B,No explanation,
Question 667,Reduction in size of company size,Geographic expansion,Consolidation,Diversification,Horizontal integration,B,No explanation,
Question 668,Understanding career skills and effectively use them for employees is process known as,career,career management,career planning,career development,B,No explanation,
Question 669,Creating culture of honoring experience is a tool of,keeping retirees,keeping employees,attracting retirees,Both A and C,D,No explanation,
Question 670,In traditional focus managing attitudes related to job are included in,training and development,performance appraisal,recruiting and placement,human resource planning,A,No explanation,
Question 671,Through test measuring for Checking what we intended to know is,test validity,criterion validity,content validity,reliability,A,No explanation,
Question 672,An underlying talent management components in software suites are,e-recruiting,e-training,performance reviews and rewards,all of above,D,No explanation,
Question 673,A manager have line or staff authority is determined by,person in charge,Name of person in charge,type of department,nature of relationship,D,No explanation,
Question 674,A method in which corresponding points of each compensable factors for calculation of total point is called,point method,factor comparison,job classification,alternation ranking method,A,No explanation,
Question 675,Promoting organizational effectiveness through 'HR' policies and practices is known as,human resource metrics,evidence based management,high performance work system,none of above,C,No explanation,
Question 676,A willful and deliberate violation of code of ethic of any organization is classified as,misconduct,lack of qualifications,unsatisfactory satisfaction,insubordination,A,No explanation,
Question 677,People belongs to profession of chemist is best classified as,realistic orientation,investigative orientation,social orientation,artistic orientation,B,No explanation,
Question 678,Disadvantage of 'forced distribution method' is,difficult to develop,cause of disagreements,time consuming,ranking is based on employer's cutoff points,D,No explanation,
Question 679,A job analysis consists of,job description,job specification,Both A and B,none of above,C,No explanation,
Question 680,Incentive and pay plan is tied to company's overall profitability is called,fixed pay,variable pay,fixed-variable pay,mixed pay,B,No explanation,
Question 681,Benefits given to victims who have work-related accidents are called,insured compensation,supplemental compensation,workers compensation,optional compensation,C,No explanation,
Question 682,Focus on career development tuition reimbursement plans are part of,training and development,performance appraisal,recruiting and placement,compensation and benefits,D,No explanation,
Question 683,Bargaining items that are neither mandatory nor illegal while negotiation parties do not compel each other for bargaining are classified as,voluntary bargaining items,permissible bargaining items,illegal bargaining items,both a and b,D,No explanation,
Question 684,'commonsense' observations are part of,Maslow's motivation theory,Victor Vroom expectancy theory,Fredrick Herzberg motivation theory,Edward Deci motivation theory,B,No explanation,
Question 685,In recent years job title and tenure is replaced by,employee performance and competencies,company growth and market share,employee skills and creativity,pay for knowledge,A,No explanation,
Question 686,In career development providing training and development workshops is part of,individual role,manager role,employer role,line manager,C,No explanation,
Question 687,Job analysis information can be collected through,Interviews,Questionnaires,Both A and B,none of above,C,No explanation,
Question 688,In traditional focus reward is based on,training and development,performance appraisal,recruiting and placement,compensation and benefits,D,No explanation,
Question 689,Duties of 'HR' manager and staff functions consist of,Assisting line manager,Implementing the policies,Directing the tasks of people,all of above,A,No explanation,
Question 690,Jobs pay rates on basis of each individual performance is called,individual equity,pay rate equity,collective equity,procedural equity,A,No explanation,
Question 691,'market leadership' can be best classified as,Potential opportunities,Potential Threats,Potential Strengths,Potential Weaknesses,C,No explanation,
Question 692,Portion of increased salary paid to employee for an individual performance is called,merit pay,motivators,de-merit pay,fixed merit pay,A,No explanation,
Question 693,'explanation of Social Security benefits' is an example of,phased retirement,preretirement counseling,honoring experience,modifying selection procedure,B,No explanation,
Question 694,'Human Resource Management' is process of,Acquiring Employees,Training Employees,Appraising and Compensating Employees,all of above,D,No explanation,
Question 695,In a big five models 'openness to experience' is tendency to be,imaginative,assertive,achievement,autonomous,A,No explanation,
Question 696,'Behaving ethically' is included in,personal competencies,interpersonal competencies,business management,Both A and C,A,No explanation,
Question 697,Use of data facts analytics and evaluated research for making decision is,Evidence based HRM,High performance work system,Both A and B,none of above,A,No explanation,
Question 698,In career development seeking out information for career is included in,individual role,manager role,employer role,line manager,A,No explanation,
Question 699,Values of top executives include,polycentric,geocentric,ethnocentric,all of above,D,No explanation,
Question 700,Relationship between two variables can be identified with help of,ratio analysis,scatter plot,trend analysis,all of above,B,No explanation,
Question 701,A problem occurs when supervisor might rate all employees 'high' or 'low' is called,lenient/strict tendency,biasing tendency,central tendency,different tendencies,A,No explanation,
Question 702,A manager teaches job-related skills in coaching for,longer span of time,shorter span of time,resetting salary schedules,self-managing teams,B,No explanation,
Question 703,An availability of new 'IT' system to track succession planning is part of,phased retirement,preretirement counseling,talent management,modifying selection procedure,C,No explanation,
Question 704,An advantage of 'forced distribution method' is,avoids central tendency and biases,avoids central tendency and biases,provides behavioral anchors,end up with predetermined rating figures,D,No explanation,
Question 705,A company can translate mission into strategic objectives by,Vertical integration,Diversity,Geographic coverage,all of above,D,No explanation,
Question 706,Wages and salaries are included in,direct financial payments,indirect financial payments,compensations,counseling,A,No explanation,
Question 707,Performance rating as good or bad on numerical rating scale is called,critical incident method,forced distribution method,behaviorally anchored rating scale,paired comparison method,C,No explanation,
Question 708,Equity theory of motivation includes,external equity,internal equity,individual equity,all of above,D,No explanation,
Question 709,Type of employees pay rate in which pay is attached with productivity is called,fixed pay,variable pay,fixed-variable pay,mixed pay,B,No explanation,
Question 710,Company 'Asian paints' operates in 18 countries is an example of,Horizontal integration,Vertical integration,Geographic expansion,none of above,C,No explanation,
Question 711,Period in which people learn how to develop new roles is called,exploration stage,growth stage,midcareer crisis sub stage,decline stage,D,No explanation,
Question 712,Fair procedures perceived for allocation of job pay rates is included in,procedural equity,pay rate equity,primary equity,individual equity,A,No explanation,
Question 713,Consistency of obtained scores in a test is measured by,test validity,criterion validity,content validity,reliability,D,No explanation,
Question 714,Process which consists how and what positions are to be filled is called,Employment planning,Human resource planning,Succession planning,all of above,D,No explanation,
Question 715,Disadvantage of 'BARS' appraisal system is,halo effect,bias,central tendency,difficult to develop,D,No explanation,
Question 716,Levels within a 'pay grade' are called,pay ranges,grade scales,group of similar jobs,tuning pay rates,A,No explanation,
Question 717,A technique is used for obtaining information from person orally and directly is called,Interviews,questionnaires,appraisal interview,none of above,A,No explanation,
Question 718,In talent management end to end process performance management leads,succession planning,compensation management,learning management systems,e-recruiting,C,No explanation,
Question 719,Stage in which person focuses on maintaining established position is called,exploration stage,growth stage,midcareer crisis sub stage,maintenance stage,D,No explanation,
Question 720,A validity test that contains a fair sample of performed tasks in actual job is called,criterion validity,content validity,Score validity,Both A and B,B,No explanation,
Question 721,People having 'foreign services' as profession are best classified as,realistic orientation,investigative orientation,social orientation,artistic orientation,C,No explanation,
Question 722,'unclear standards' usually results in,unfair appraisals,fake appraisals,true appraisals,Both A and B,D,No explanation,
Question 723,Second step in planning process is to,Set an objective,Evaluate alternatives,Determine strength and weaknesses,none of above,C,No explanation,
Question 724,Converting of strategies into actions is meant by,Formulate strategies,Implement the strategies,Evaluate performance,all of above,B,No explanation,
Question 725,Ranking of all employees measuring a specific trait by making pairs of employees is called,graphic rating scale method,management by objectives,alternation ranking method,paired comparison method,D,No explanation,
Question 726,Series of lifetime activities contributing in establishment fulfillment and success of a person's career is called,career,career management,career planning,career development,D,No explanation,
Question 727,'controlled experimentation' is a technique use for,designing of evaluation,the things to measure,in-house development,consolidation of gains,A,No explanation,
Question 728,Comparison between what salary coworkers are getting for similar jobs is called,individual equity,pay rate equity,collective equity,procedural equity,A,No explanation,
Question 729,In 'job grading method' group of jobs that are different is called,classes,rank jobs,grades,rows,B,No explanation,
Question 730,Score that measures how much business goals are achieved by 'HRD' efforts is,HRD culture,Business linkage score,HRD competence score,HRD system maturity score,B,No explanation,
Question 731,An employee's aspirations and plans are linked to,appraisal feedback,appraisal performance,employee training,employee development,A,No explanation,
Question 732,Meaning of 'direction sharing' is,communicating line authority,staff authority,communicating company's higher-level goals,communicating future HR policies,C,No explanation,
Question 733,An overview of knowledge skills and behaviors in a single diagram is called,need analysis competency model,competency model,task analysis,Both A and C,B,No explanation,
Question 734,Stage in which a person develops a self-concept is called,exploration stage,growth stage,establishment stage,maintenance stage,B,No explanation,
Question 735,People who choose medical profession is an example of,conventional personality,non-conventional personality,investigative personality,non investigative personality,C,No explanation,
Question 736,People who are investment managers in personality orientation are classified as,artistic,investigative,realistic,enterprising,D,No explanation,
Question 737,Study of different employment needs of company is,ratio analysis,scatter plot,trend analysis,all of above,C,No explanation,
Question 738,'HR' manager must be familiar with,Strategic planning,Production department,Marketing and finance,all of above,D,No explanation,
Question 739,People that are attracted to occupations involving interpersonal skills more than physical activities are said to be,realistic orientation,investigative orientation,social orientation,artistic orientation,C,No explanation,
Question 740,Planning function of management process involves,Developing employees,Evaluating performance,Establishing departments,Establishing goals,D,No explanation,
