Question Name,Question,Option A,Option B,Option C,Option D,Answer,Explanation,
Question 149,In career development employees self-assessment for their own values are being considered regarded as,individual role,managerial role,employer role,line manager's role,A,No explanation,
Question 150,In career development communicating company mission and vision is included in,individual role,managerial role,employer role,line manager's role,C,No explanation,
Question 151,'performance management' is always,goal oriented,performance oriented,sales oriented,none of above,A,No explanation,
Question 152,An interview candidates are being asked about relevant past experiences known as,situational interview,stress interview,behavioral test,job related interview,B,No explanation,
Question 153,A list consisting of job duties and responsibilities part of,job descriptions,job analysis,job specifications,both A and C,A,No explanation,
Question 154,In big five model 'extraversion' is tendency to be,assertive,unconventional,autonomous,achievement,A,No explanation,
Question 155,In big five model 'conscientiousness' is tendency to be,unconventional,assertive,achievement,autonomous,C,No explanation,
Question 156,Time period in which many people have few responsibilities and authority is called,exploration stage,growth stage,midcareer crisis sub stage,decline stage,D,No explanation,
Question 157,'cooperative union-management projects' is an example of,human process intervention,techno structural interventions,strategic intervention,HRM interventions,B,No explanation,
Question 158,'integrated strategic management' is an example of,action research,survey research,marketing research,human research,A,No explanation,
Question 159,'unfreezing stage' in Lewin organizational change process considered as,mobilize commitment,consolidation of gains,monitoring and assessing programs,creating guiding coalition,A,No explanation,
Question 160,An employer; not paying for title of job and hired  regarded as,pay based on company's profit,pay based on company's stocks,pay based on competency,pay based on time,C,No explanation,
Question 161,Traditional pay plan used in companies is mostly,person oriented,job oriented,tenure oriented,evaluation oriented,B,No explanation,
Question 162,'reward systems' is an example of,human process intervention,techno structural interventions,strategic intervention,HRM interventions,D,No explanation,
Question 163,Coordination of several human resource activities is required in,phased retirement,preretirement counseling,talent management,modifying selection procedure,C,No explanation,
Question 164,An alternation ranking method is often classified as,What you are measuring?,how you are measuring performance,what are the set standards,the rules of performance appraisals,B,No explanation,
Question 165,Procedure of ranking jobs or grouping in clusters is included in,getting job information,combining ratings,ranking jobs,selecting and grouping jobs,D,No explanation,
Question 166,What our business is' is stated in,mission statement,strategic goals,vision statement,all of above,A,No explanation,
Question 167,Public relations executives tend to be one of personality orientation types regarded as,non artistic,artistic,non enterprising,non-conventional,B,No explanation,
Question 168,A test examinees respond to situations representing jobs known as,situational test,reasoning test,video simulation test,job training,A,No explanation,
Question 169,Revenue growth is included in,short-term of shareholder value,compensation of company executive,determination of stocks,determination of investment,A,No explanation,
Question 170,In career development providing performance feedback which is career oriented is part of,individual's role,manager's role,employer's role,line manager,C,No explanation,
Question 171,Bankers and accountants are mostly having a specific personality type known as,realistic,investigative,artistic,conventional,D,No explanation,
Question 172,Determining duties and characteristics of positions in staffing known as,job descriptions,job analysis,job specifications,both A and C,B,No explanation,
Question 173,External and internal audit of a company includes,economic trends,political trends,competitive trends,all of above,D,No explanation,
Question 174,Comparison of company's performance in context of before and after change is,mobilize commitment,consolidation of gains,monitoring and assessing programs,creating guiding coalition,C,No explanation,
Question 175,In traditional focus rewards for employees which are based on talent is a part of,training and development,performance appraisal,recruiting and placement,compensation and benefits,D,No explanation,
Question 176,In Lewin organizational change process 'communication of shared vision' is,unfreezing stage,moving stage,refreezing stage,all of above,C,No explanation,
Question 177,In career development focus individual goal setting is part of,training and development,performance appraisal,recruitment and placement,human resource planning,B,No explanation,
Question 178,In career development focus providing information about career path is futile part of,training and development,performance appraisal,recruiting and placement,compensation and benefits,A,No explanation,
Question 179,Easiest performance appraisal interview is,satisfactory-promotable interview,satisfactory-not promotable interview,unsatisfactory-correctable interview,unsatisfactory-uncorrectable interview,A,No explanation,
Question 180,People who are more attracted towards career involving in organizational understanding are said to be,realistic oriented,investigative oriented,social oriented,artistic oriented,B,No explanation,
Question 181,Strategy to understand problem and to formulate hypothesis is called,planning,preparation,follow-up,compensating employees,A,No explanation,
Question 182,Diversification' can be best classified as,potential opportunities,potential threats,potential strengths,potential weaknesses,A,No explanation,
Question 183,Third step in 'ranking method' of evaluating job method is to,select compensable factors,combine ratings,rank jobs,select and group jobs,D,No explanation,
Question 184,Items for bargaining that are not allowed to deal by law are classified as,voluntary bargaining items,permissible bargaining items,illegal bargaining items,mandatory bargaining items,C,No explanation,
Question 185,An interview in which you ask about a candidate's behavior in a certain given situation is,situational interview,situational test,behavioral tests,job related questions,A,No explanation,
Question 186,Document that consists of all ethical standards that employer expects from employees is classified as,ethics code,descriptive code,procedural code,distributive code,A,No explanation,
Question 187,'Benchmarking' of jobs is included in,internal equity,external equity,procedural equity,salary survey,D,No explanation,
Question 188,Financial and investment counseling is an example of,phased retirement,preretirement counseling,honoring experience,modifying selection procedure,B,No explanation,
Question 189,An outline of chain of command and reporting relationships in form of chart is stated in,organization chart,process chart,process management,production unit,A,No explanation,
Question 190,A group interviewer questions are being asked from group of interviewee considered as,panel interview,mass interview,computer interview,personal interview,B,No explanation,
Question 191,Understanding behavior and culture of host country's market by host manager in corporation orientation is known to be,ethnocentric,polycentric,geocentric,expat-centric,B,No explanation,
Question 192,Disadvantage of Management by Objectives (MBO) method is,difficult to develop,cause of disagreements,time consuming,difficult to rate,C,No explanation,
Question 193,An evaluation process of employee's performance in comparison to set standards is called,performance appraisal,compensation,counseling,design of evaluation,A,No explanation,
Question 194,In arbitration dispute parties no longer accord with agreement willing to change existing agreement known as,binding arbitration,non-binding arbitration,interest arbitration,rights arbitration,C,No explanation,
Question 195,People who are attracted to career involving expression of emotions belongs to personality type of,enterprising orientation,investigative orientation,social orientation,conventional orientation,A,No explanation,
Question 196,First step in 'Job ranking' evaluation method is to,obtain job information,select and group jobs,select compensable factors,rank jobs,A,No explanation,
Question 197,Increments based on performance is a basis of,direct financial payments,non direct financial payments,direct compensation,bonuses,A,No explanation,
Question 198,A manager reviewing 'Does employee's training is adequate' is part of,antecedents,behavior,consequences,counseling,B,No explanation,
Question 199,In career development seeking out career resources is included in,individual role,manager role,employer role,line manager,A,No explanation,
Question 200,Top management works on,strategic plan,corporate plan,budgeting,both A &amp; B,A,No explanation,
Question 201,Counseling employees for second careers inside firm is an example of,phased retirement,preretirement counseling,honoring experience,modifying selection procedure,B,No explanation,
Question 202,Kind of pension plan in which employer's contribution is specified in employees retirement savings funds is classified as,defined benefit pension plan,defined contribution pension plan,defined noncontributory pension plan,deferred contribution pension plan,B,No explanation,
Question 203,Sabbatical leave funeral leave jury duty and vacations are examples of,optional pay benefits,unemployment pay benefits,compensation law benefits,supplemental pay benefits,D,No explanation,
Question 204,Compensation for top executive job is largely based on,job complexity,employer's ability to pay,executive's human capital,all of above,D,No explanation,
Question 205,An appraisal interview which results in occasional 'well-done' technique is said to be,satisfactory-promotable interview,satisfactory-not promotable interview,unsatisfactory-correctable interview,unsatisfactory-uncorrectable interview,B,No explanation,
Question 206,Person's fixed pay and guaranteed bonus is included in,base pay,short-term incentives,executive benefits,long-term incentives,A,No explanation,
Question 207,Types of interventions to overcome effect of impasse included,fact finder,arbitration,mediation,all of above,D,No explanation,
Question 208,Achieving aims and monitoring results in HR management of financial and non-financial goals regarded as,HR scorecard,HR digital dashboard,both A and B,none of above,A,No explanation,
Question 209,In career development establishing self-career goals is included in,an individual role,a managerial role,an employer role,a line manager's role,A,No explanation,
Question 210,Training effects that are to be measured consist of,reaction,learning,behavior,all of above,D,No explanation,
Question 211,Management guru Edward Deming argues that employee's performance is result of,training communication,quality management,own motivation,both A and B,D,No explanation,
Question 212,In which incentive executives are given right to purchase stocks for specific period ?,long-term incentives,short-term incentives,pay scale,ranking jobs,A,No explanation,
Question 213,'formal structural change' is an example of,human process intervention,techno structural interventions,strategic intervention,HRM interventions,B,No explanation,
Question 214,Strategy employers follow to vacate a position where employee is no longer needed is included in,promotions,transfers,reality shock,formal training,B,No explanation,
Question 215,An 'Equity theory of Motivation' does not include,internal equity,external equity,collective equity,individual equity,C,No explanation,
Question 216,According to Herzberg job working conditions are considered as,hygiene's,DE motivators,intrinsic hygiene's,extrinsic hygiene's,A,No explanation,
Question 217,Ranking of job based on difficulty is,job description,job specification,job evaluation,ranking method,D,No explanation,
Question 218,For continuous work growth company's direct non-financial and financial payments are being received by employees categorized as,benefits,stock ownership,loyalty scholarships,all of above,A,No explanation,
Question 219,Mentoring is very useful when mentors works for,same department,different department,informal training,formal training,A,No explanation,
Question 220,In career development providing individual development plans for employees is part of,individual role,manager role,employer role,line manager,C,No explanation,
Question 221,Providing step by step training and enlisting job's basic tasks is,job rotation,off the job training,job instruction training,apprenticeship training,C,No explanation,
Question 222,Two basic issues to address in training evaluation are,design of evaluation,the things to measure,in-house development,Both A and B,D,No explanation,
Question 223,Which term describes union membership is not required as a condition of employment classified as,right to proceed,right to work,right to get hired,right to join a union,B,No explanation,
Question 224,Formulating 'SMART' performance training objectives is included in,need analysis,instructional design,implement,evaluate,B,No explanation,
Question 225,Solving and implementing solutions in empowering employees to review problems can best classified as,action research,customer research,marketing research,human research,A,No explanation,
Question 226,Advantage of 'graphic rating scale method' is that; it is,simple to use,avoids central tendency and biases,ends up with predetermined rating figures,an ongoing basis evaluation,A,No explanation,
Question 227,Career planning and development is an example of,human process intervention,techno structural interventions,strategic intervention,HRM interventions,D,No explanation,
Question 228,'refreezing stage' considers,mobilize commitment,consolidation of gains,creating guiding coalition,reinforcement of new programs,D,No explanation,
Question 229,Period in which people act as mentors for younger employees is called,exploration stage,growth stage,midcareer crisis sub stage,decline stage,D,No explanation,
Question 230,'corporate strategy' does not include,diversification,consolidation,cost leadership,vertical integration,C,No explanation,
Question 231,People who are 'public relations executives' are best classified as,enterprising orientation,investigative orientation,social orientation,conventional orientation,A,No explanation,
Question 232,Most of time manager of 'Human Resource' department is,line manager,staff manager,active manager,both A and B,B,No explanation,
Question 233,Approaches used to compare jobs are,intuitive approaches,systematic approaches,mathematical approaches,logical approaches,A,No explanation,
Question 234,An analysis of pending retirements should include,determination of average retirement age,planning pension benefits,determine extent of retirement problem,all of above,D,No explanation,
Question 235,Work experience and field of study are included in,working capital,human capital,compensation capital,size of working capital,B,No explanation,
Question 236,Method in which 'problem to be solved' is described for employees is called,job rotation,action learning,lifelong learning,case study method,D,No explanation,
Question 237,People; having social personality type often choose careers as,auto sales dealers,school administrators,lawyers,both A and B,D,No explanation,
Question 238,Benefit paid to terminated employees or laid-off employees is,vacations and holidays,lifelong learning,severance pay,optional pay benefits,C,No explanation,
Question 239,Voluntary withdrawal of labor of company is classified as,strike,picketing,boycott,impasse boycott,A,No explanation,
Question 240,'employ's wellness responsibility' is an example of,human process intervention,techno structural interventions,strategic intervention,HRM interventions,D,No explanation,
Question 241,'coherent career' plan links,employee's performance,career interests,developmental needs,all of above,D,No explanation,
Question 242,Comparison of employees' actual performance with set standards is involved in,leading,organizing,controlling,staffing,C,No explanation,
Question 243,Theory according to which people are motivated in a sequence of hierarchy of needs is called,prepotency process principle,prepotency process principle,process principle,hierarchy principle,A,No explanation,
Question 244,Improving current and future management performance is called,job rotation,job training,lifelong learning,management development,D,No explanation,
Question 245,Frederick Herzberg Abraham and Maslow gave theories of,motivation,HR system,appraisal system,performance based appraisal,A,No explanation,
Question 246,'psychological counseling' is an example of,phased retirement,preretirement counseling,honoring experience,modifying selection procedure,B,No explanation,
Question 247,Less career plans and benefits for people of color are concluded in,bias,reality shock,promotion,transfer,A,No explanation,
Question 248,First step in management by objectives is to,set departmental goals,set organizational goals,set individual goals,discuss departmental goals,B,No explanation,
Question 249,Managers can support 'instrumentality' by creating,easy incentive plans,uneasy incentive plans,intrinsic incentive plans,extrinsic incentive plans,A,No explanation,
Question 250,In career development focus compensations planned for non-job related activities is part of,training and development,performance appraisal,recruiting and placement,compensation and benefits,D,No explanation,
Question 251,People who are often executives of chamber of commerce are classified in personality type of,non enterprising,enterprising,social,investigative,B,No explanation,
Question 252,A process of making workers highly skilled with help of on job training and formal learning is,job rotation,off the job training,job instruction training,apprenticeship training,D,No explanation,
Question 253,Standard of 'output' for a job is called,fair day's work,unfair day's work,incentive rate,systematic soldiering,A,No explanation,
Question 254,After ensuring external and internal equity next step in establishing pay rates is,group similar jobs,price each pay grade,fine tune pay rates,determining the worth of each job,A,No explanation,
Question 255,In career development providing assignments that develop careers is part of,individual role,manager role,employer role,line manager,B,No explanation,
Question 256,Plans that are designed to motivate employees short term performance are called,annual bonus,annual award,annual sales promotion,annual transfer,A,No explanation,
Question 257,Workflow detailed picture is called,organization chart,process chart,process management,production unit,B,No explanation,
Question 258,Reward given to workers whose work exceeds some set standards is called,financial incentives,non-financial incentives,effective incentives,ineffective incentives,A,No explanation,
Question 259,Non-citizen employees of a country in which they are working is classified as,expatriates,subordinates,coordinates,none of above,A,No explanation,
Question 260,'Hay consulting firm' emphasizes compensable factors such as,skills,efforts and responsibility,knowledge,accountability,D,No explanation,
Question 261,Focusing on daily tasks that can be easily relearn is part of,coaching,mentoring,informal training,formal training,A,No explanation,
Question 262,If a worker gets a premium for extra 'output' than a 'set standard' is called,standard hour plan,standard piece rate,standard piecework,variable hour plan,A,No explanation,
Question 263,In group interview questions are being asked from interviewee known as,panel interview,mass interview,computer interview,none of above,A,No explanation,
Question 264,Employees beliefs that successful performance leads to rewards is best explanation of,expectancy,instrumentality,valence,de-expectancy,B,No explanation,
Question 265,Techniques which allow employer for flexible labor stance is,job classification,job evaluation method,job ranking technique,pay ranges,D,No explanation,
Question 266,Employees training and evaluating performance before actual job is,situational test,reasoning test,video simulation test,miniature job training,D,No explanation,
Question 267,Manager reviewing and evaluating reward system is part of,antecedents,behavior,consequences,counseling,C,No explanation,
Question 268,In performance management main feature of performance management is to,increase salary,planning incentives,comparing performance with goals,comparing sales figures from last year,C,No explanation,
Question 269,Job schedules in which employees can work for fewer days but for longer time in each day are classified as,deferred work week,compressed work week,flexible work week,stable work week,B,No explanation,
Question 270,Ranking of all employees measuring a specific trait such as communicating is measured in,graphic rating scale method,management by objectives,alternation ranking method,paired comparison method,C,No explanation,
Question 271,'T-group' suggests that participation should be,voluntary,involuntary,in-house development,lifelong learning,A,No explanation,
Question 272,Method in which teams consisting managers compete on solving problems is called,management game,action learning,lifelong learning,case study method,A,No explanation,
Question 273,An interview in which candidates are asked about relevant past experiences is a,situational interview,situational test,behavioral tests,job related questions,D,No explanation,
Question 274,Benefits paid for time not worked are also called,compensation law benefits,supplemental pay benefits,optional pay benefits,unemployment pay benefits,B,No explanation,
Question 275,One who issues orders in chain of command outside their department is,staff managers,line managers,finance manager,both A and B,B,No explanation,
Question 276,People who are attracted to career involving verbal activities rather than physical activities are classified as,enterprising oriented,investigation oriented,social orientation,conventional orientation,A,No explanation,
Question 277,After translating company mission into strategic goals next step is to,formulate strategies,implement the strategies,evaluate performance,none of above,A,No explanation,
Question 278,First step in retirement management is to conduct,numerical analysis of retirements,determination of average retirement age,planning pension benefits,determine extent of retirement problem,A,No explanation,
Question 279,Total profit and rate of return is classified as,employer's ability to pay,employer's ability to hire,employer's ability to train employees,employer's ability to grow,A,No explanation,
Question 280,Enabling employees to link company's and his own departmental goals is,direction sharing,goal alignment,ongoing performance monitoring,ongoing feedback,B,No explanation,
Question 281,An interview in which you discuss person's career plans and plan professional development it is said to be,a satisfactory-promotable interview,a satisfactory-not promotable interview,an unsatisfactory-correctable interview,an unsatisfactory-uncorrectable interview,A,No explanation,
Question 282,Diagrams and charts available to guide workers at job site considered as,job rotation,job training,job aid,programmed learning,C,No explanation,
Question 283,Determining type of people which a company needs for job is referred as,job descriptions,job analysis,job specifications,both A and C,C,No explanation,
Question 284,In 'HRD' scorecard scales scale 1 represents,moderate maturity level,least maturity level,highest maturity level,all of above,B,No explanation,
Question 285,Strike occurs when labor does not agree on conditions of contract classified as,unfair labor practice strike,economic strike,sympathy strike,wildcat strike,B,No explanation,
Question 286,Pay for time not worked sick leave supplemental benefits and severance pay are types of benefits called,supplemental pay benefits,optional pay benefits,compensation law benefits,unemployment pay benefits,A,No explanation,
Question 287,Disadvantage of alternation ranking method is,difficult to develop,cause disagreements,time consuming,difficult to rate,B,No explanation,
Question 288,'Microsoft' pays new programmers for learning Windows particulars classified as,pay plan based on knowledge,pay plan based on title of job,pay plan based on tenure,pay plan based on performance,A,No explanation,
Question 289,Job changes in an existing job in same firm for retirement aged employees is an example of,phased retirement,preretirement counseling,honoring experience,modifying selection procedure,A,No explanation,
Question 290,'performance' appraisal feedback always includes,assessment of employee performance,setting work standards,providing feedback to the employees,all of above,D,No explanation,
Question 291,Managing workforce diversity is an example of,human process intervention,techno structural interventions,strategic intervention,HRM interventions,D,No explanation,
Question 292,Specific procedure according to which 'employees of company has legal rights to take part in policy designing' is classified as,sub-determination,sub-ordination,co-ordination,codetermination,D,No explanation,
Question 293,An employee is rated high in performance appraisal because of 'religion' is an example of,lenient/strict tendency,bias,central tendency,different tendencies,B,No explanation,
