Question Name,Question,Option A,Option B,Option C,Option D,Answer,Explanation,
Question 1,What affective activities are required to make people attracted towards occupations?,realistic oriented,investigation oriented,social oriented,artistic oriented,B,No explanation,
Question 2,A plan offering a 75% base salary along with 25% incentives is classified as,combination plan,non commission plan,competitive plan,noncompetitive plan,A,No explanation,
Question 3,New performance 'appraisal systems' and incentives usage is part of,mobilize commitment,consolidation of gains,creating guiding coalition,reinforcement of new programs,D,No explanation,
Question 4,Financial payments above and over a regular base pay for employees are called,ethnocentric allowances,mobility premiums,hardship allowances,Foreign Service premiums,D,No explanation,
Question 5,Types of 'appraisal interviews' are,tell-and-listen,tell- and-sell,problem solving,all of above,D,No explanation,
Question 6,In traditional focus providing opportunities for learning is part of,training and development,performance appraisal,recruiting and placement,human resource planning,A,No explanation,
Question 7,If company defines authority and communication channels for employees it is performing,staffing function,organizing function,leading function,controlling function,B,No explanation,
Question 8,Employees abroad supply services or having outside vendors that company's own employees previously did in-house is known as,outsourcing,offshoring,alternative staffing,none of above,B,No explanation,
Question 9,In a career development focus information about individual interests and preferences is a part of,training and development,performance appraisal,recruiting and placement,human resource planning,D,No explanation,
Question 10,A company's ' HR' department can create an advisory relationship through,line authority,staff authority,hiring authority,all of above,B,No explanation,
Question 11,Communications and employs' participation is part of,company's plan,strategic plan,vision,mission,A,No explanation,
Question 12,When employee's high expectations confront reality of boring job it is called,promotions,transfers,reality shock,formal training,C,No explanation,
Question 13,'strategy' that employees seek for interesting jobs and greater advancement opportunities is known as,promotions,transfers,reality shock,formal training,B,No explanation,
Question 14,In a career development focus addition of development plans is a part of,training and development,performance appraisal,recruiting and placement,compensation and benefits,B,No explanation,
Question 15,An employer's refusal to provide work opportunities is classified as,grievance procedure,lock out,injunction,strike procedure,B,No explanation,
Question 16,'piecework' pay plan is often called,individual pay plan,group pay plan,extrinsic rewards,intrinsic rewards,A,No explanation,
Question 17,Factor which influence 'bonuses' are,eligibility,fund size,individual performance,all of above,D,No explanation,
Question 18,Validity test that focused on comparing test scores of already existing employees to a measure of their job performance is,concurrent validity,predictive validity,criterion validity,content validity,A,No explanation,
Question 19,Adding 'incentives' to job is included in,intrinsic motivation,extrinsic motivation,outsourced motivation,in-house motivation,B,No explanation,
Question 20,Large inventories can be best classified as,potential opportunities,potential Threats,potential Strengths,potential Weaknesses,D,No explanation,
Question 21,In a career development providing support in employee's development plans is regarded as,an individual role,a managerial role,employer role,line manager's role,B,No explanation,
Question 22,Communicating leadership' involves,personal competencies,interpersonal competencies,business management,both A and C,B,No explanation,
Question 23,'Coaching of employees' does not include,planning,preparation,follow-up,compensating employees,D,No explanation,
Question 24,In talent management end to end process workforce compensation management leads to,succession planning,performance management,learning management systems,e-recruiting,B,No explanation,
Question 25,Assistance to top level management for strategic plans is provided by,transactional HR group,corporate HR group,embedded HR group,center of expertise,B,No explanation,
Question 26,A marketing concept holding a society's long-term interest belongs to,realistic orientation,investigation oriented,societal orientation,art oriented,C,No explanation,
Question 27,Providing personal development opportunities shifting of an employee from one job to another without altering their job designation considered as a,promotion,transfer,reality shock,formal training,B,No explanation,
Question 28,Anchoring jobs and slotting other jobs accordingly is called,benchmarking jobs,evaluating pay scales,evaluating pay grades,evaluating internal equity,A,No explanation,
Question 29,A 'quantitative technique' in job evaluation processes is,job classification,alternative ranking method,aligned reward strategy,point method,D,No explanation,
Question 30,Each band in 'broad banding' contains,wide range of jobs,lesser range of job,only one type of job,unspecified job description,A,No explanation,
Question 31,All incentive plans focused on,performance,skills,tenure,particular knowledge,A,No explanation,
Question 32,"In 'ABC' approach which is used in formulating hypothesis ""C"" stands for",compensating,communication,counseling,consequences,D,No explanation,
Question 33,Teaching of current employees with skills needed to perform effectively on job is,training,negligent training,both A and B,learning,A,No explanation,
Question 34,A company's HR team is responsible for,training of supervisors,monitor the appraisal system affectivity,training the employees,all of above,D,No explanation,
Question 35,Reward of performance must have some value for employee an example of,expectancy,instrumentality,valence,de-expectancy,C,No explanation,
Question 36,Professional competence and consistency is exhibited by,effective mentors,performance manager,appraisal manager,professional training,A,No explanation,
Question 37,Data of benefits like employees insurance and other fringe benefits can be collected through,benchmark surveys,salary surveys,primary survey,secondary survey,B,No explanation,
Question 38,Modifying selection procedures for senior employees is a step towards,keeping retirees,keeping employees,retirement benefits,talent management,A,No explanation,
Question 39,Re-assignment of work related to job in another part of organization at similar position is called,promotions,transfers,reality shock,formal training,B,No explanation,
Question 40,Steps involves in employer's movement for performance management is,total quality,appraisal issues,strategic planning,all of above,D,No explanation,
Question 41,In surveying market a way to know what others are paying known as,salary survey,market survey,equity survey,motivation survey,A,No explanation,
Question 42,A combined refusal in buying products of employers union members as well as employees known as,boycott,impasse boycott,strike,picketing,A,No explanation,
Question 43,Each unit made by worker is paid  considered as,time based pay,performance based pay,promotion,salary increments,B,No explanation,
Question 44,In traditional focus rewards based on production is part of,training and development,performance appraisal,recruiting and placement,compensation and benefits,D,No explanation,
Question 45,Process of attracting selecting training and promoting employees through a particular firm is called,phased retirement,preretirement counseling,talent management,modifying selection procedure,C,No explanation,
Question 46,Employees 'career hazards' are dealt in,coaching,mentoring,career management,career development,B,No explanation,
Question 47,In traditional focus ratings or rewards are part of,training and development,performance appraisal,recruiting and placement,human resource planning,B,No explanation,
Question 48,In talent management end to end process workforce and succession planning leads to,compensation management,performance management,learning management systems,e-recruiting,A,No explanation,
Question 49,Concession employees gets in form of discounts in air ticket and bus fares is an example of,incentives,non direct payments,direct payments,salary increments,B,No explanation,
Question 50,Relationship between value of job and average salary paid for job is called,wage curve,salary curve,job evaluation curve,job description curve,A,No explanation,
Question 51,Types of third party negotiation known as arbitration includes,non-binding arbitration,interest arbitration,non-binding arbitration,all of above,D,No explanation,
Question 52,Company's paying strategies for employee's learning organizational skills included,pay for knowledge,skill-based pay,time based pay,Both A and B,D,No explanation,
Question 53,Managers and executives are often paid in form of,salaries,bonuses,promotion,shopping discounts,A,No explanation,
Question 54,Transition to independent contracts status is an example of,phased retirement,flexible work,honoring experience,modifying selection procedure,A,No explanation,
Question 55,Employees involuntary separation from a job for a certain time period known as,mergers,acquisitions,layoffs,downsizing,C,No explanation,
Question 56,An equal rating of all employees such as 'good' is called,lenient tendency,strict tendency,biasing tendency,central tendency,D,No explanation,
Question 57,According to business perspective employees carrying sign language in depicting their concerns regarded as,strike,picketing,boycott,impasse boycott,B,No explanation,
Question 58,Justice and fairness of a result of a decision is often classified as,descriptive justice,procedural justice,distributive justice,severance justice,C,No explanation,
Question 59,Aligning of skills training and performance to have a successful career is also known as,phased retirement,career management,talent management,modifying selection procedure,C,No explanation,
Question 60,Formal procedure in which job terminated person is counseled and trained to secure a job position by teaching self-appraising techniques is classified as,termination interview,outplacement counseling,exit interviews,subordination interviews,B,No explanation,
Question 61,Addition of new product lines in a company is,diversification,vertical integration,horizontal integration,geographic expansion,A,No explanation,
Question 62,First step in establishing pay rates is to,conduct salary survey,group similar jobs,price each pay grade,fine-time pay rates,A,No explanation,
Question 63,In a career development establishing career plans is a/an,individual role,managerial role,employer role,line manager's role,A,No explanation,
Question 64,Kind of union security in which organizations can hire current union members is classified as,closed shop,union shop,agency shop,preferential shop,A,No explanation,
Question 65,Lewin's process consists of,unfreezing stage,moving stage,refreezing stage,all of above,D,No explanation,
Question 66,In talent management end to end process an e-recruiting leads to,succession planning,performance management,compensation management,e-recruiting,A,No explanation,
Question 67,Mentoring by employees deals with,longer span of time,shorter span of time,resetting salary schedules,self-managing teams,A,No explanation,
Question 68,In a career development offering and discussing variety of paths for career development included,individual role,manager role,employer role,line manager,C,No explanation,
Question 69,Union security in which union members are given preferences in hiring classified as,closed shop,union shop,agency shop,preferential shop,D,No explanation,
Question 70,People choosing career as a 'managers' belongs to,enterprising orientation,investigative orientation,social orientation,conventional orientation,A,No explanation,
Question 71,Re-designing a business process in getting more efficient and effective results known as,redesigning jobs of workers,assigning additional activities to workers,moving workers from one job to the other,reengineering,D,No explanation,
Question 72,'Managing tasks effectively' comes under,personal competencies,interpersonal competencies,business management,Both A and C,A,No explanation,
Question 73,Term 'job enlargement' means,redesigning jobs for workers,assigning additional activities for workers,moving workers from one job to the other,none of above,B,No explanation,
Question 74,'moving stage' in Lewin's organizational change process considers,mobilize commitment,consolidation of gains,monitoring and assessing programs,reinforcement of new programs,B,No explanation,
Question 75,'self-designing organizations' is an example of,human process intervention,techno structural interventions,strategic intervention,HRM interventions,C,No explanation,
Question 76,Formulating 'SMART' performance training objectives are a part of,human process intervention,techno structural interventions,strategic intervention,HRM interventions,A,No explanation,
Question 77,Analyzing and identifying specific skills needed for specific job is called,need analysis competency model,competency model,task analysis,Both A and C,C,No explanation,
Question 78,Appraisals of employees must be discussed in context of,employees' career aspirations,performance applications,industry leading compensation,employee training,A,No explanation,
Question 79,In Lewin organizational change process 'creation of sense of urgency' is called,unfreezing stage,moving stage,refreezing stage,all of above,A,No explanation,
Question 80,In new approach of jobs pay rates employers are focusing on,employee's family name,employee's competency,employee's performance,employee's equity,B,No explanation,
Question 81,In a career development accepting responsibility for your own career is included in,an individual role,a manager role,a employer role,a line manager's role,A,No explanation,
Question 82,For an occupation of farming best classified personality orientation can be,realistic orientation,investigative orientation,social orientation,artistic orientation,A,No explanation,
Question 83,In employees pension plan a portion of employees earnings contribution into fund classified as,cash balance plans,early retirement window,deferred profit sharing plan,savings and thrift plan,D,No explanation,
Question 84,An informal employee-manager refers to,social recognition program,performance feedback,non-financial awards,financial awards,A,No explanation,
Question 85,Types of 'diversification' are,2,3,4,5,A,No explanation,
Question 86,Which personality type involves in individualistic activities to make people attracted towards careers ?,enterprising orientation,investigative orientation,social orientation,conventional orientation,A,No explanation,
Question 87,'HR' plans of any organization does not include,personnel plans,production plans,compensation plans,training and development plans,B,No explanation,
Question 88,Structured interview is also called,non directive interview,directive interview,both A and B,collaborative approach,A,No explanation,
Question 89,In 'job classification' group that contains jobs with similar difficulty level is called,classes,grades,rank jobs,combine ratings,B,No explanation,
Question 90,Centers of expertise provide special assistance in,updates regarding appraisal,production department,organizational change,long term strategic plan,C,No explanation,
Question 91,In traditional focus use of statistical data included,training and development,performance appraisal,recruiting and placement,human resources planning,D,No explanation,
Question 92,In quantitative measure employee's turnover and training hours called,human resource metrics,evidence based management,high performance work system,competitive advantage,A,No explanation,
Question 93,Term 'job enrichment' means,redesigning jobs for workers,assigning additional activities to workers,moving workers from one job to the other,reforming and analyzing the job,A,No explanation,
Question 94,A stage employee decides whether or not continue specific field known as,stabilization sub stage,trial sub stage,establishment stage,maintenance stage,B,No explanation,
Question 95,Organizational development consists of,action search,applying behavioral knowledge,change toward empowerment,all of above,D,No explanation,
Question 96,When person's performance in an interview is neither satisfactory nor correctable,satisfactory-promotable interview,satisfactory-not promotable interview,unsatisfactory-correctable interview,unsatisfactory-uncorrectable interview,D,No explanation,
Question 97,Pension plan in which specific amount of profit is transferred to employees account that are payable at time of retirement or death is classified as,deferred profit sharing plan,savings and thrift plan,cash balance plans,early retirement window,A,No explanation,
Question 98,Relationships section of job description defines whom would you,supervise,report to,work with,all of above,D,No explanation,
Question 99,'incentives' given to employees are a part of,non direct financial payment,direct financial payments,compensation,pension benefits,B,No explanation,
Question 100,Ways of direct financial payments are,increments based on time,increments based on piecework,increments based on overtime,increments based on occupations,A,No explanation,
Question 101,In how many dimensions HRD maturity level in an organization is measured?,3,4,5,6,B,No explanation,
Question 102,Research and development managers are classified as,conventional personality,non-conventional personality,investigative personality,non investigative personality,C,No explanation,
Question 103,'organizational confronting meeting' is an example of,human process intervention,techno structural interventions,strategic intervention,HRM interventions,A,No explanation,
Question 104,Human resource department plays/serves as,advisory role,line authority,hiring department only,training department only,A,No explanation,
Question 105,In 'ABC' approach analyzing behaviors means,measuring aptitudes,measuring adequacy of tools,measuring adequacy of training,all of above,D,No explanation,
Question 106,Stage in career management that spans roughly between 24 to 44 and heart of people's career is,stabilization sub-stage,trial sub stage,establishment stage,maintenance stage,C,No explanation,
Question 107,Employees who are more committed and loyal to employer more likely to,leave before retirement age,stay beyond than retirement age,never leave the firm,never encouraged by employers,B,No explanation,
Question 108,In 'ABC' approach reviewing consequences means,reviewing reward system,reviewing performance appraisal,reviewing line of authority,reviewing staff authority,A,No explanation,
Question 109,A cycle that starts from first job to promotion until retirement is called,career management,career management life cycle,on boarding,performance management,B,No explanation,
Question 110,Dismissal of employee who violates law of contractual arrangements stated by employer is classified as,descriptive termination,distributive termination,wrongful discharge,wrongful termination,C,No explanation,
Question 111,Advancements in position with increased responsibility is called,promotions,transfers,reality shock,formal training,A,No explanation,
Question 112,An advantage of Management by Objectives (MBO) is,avoids central tendency and biases,jointly agreed performance objectives,provides behavioral anchors,ongoing basis evaluation,B,No explanation,
Question 113,A pension plan an employer's acknowledgement of financial standing of employee's account placing percentage on basis of annual compensation and interest regarded as,cash balance plan,severance pay plan,early retirement window plan,employee stock ownership plan,A,No explanation,
Question 114,Bottom line of any business plan is,marketing plan,financial plan,personnel plan,production plan,B,No explanation,
Question 115,"What does ""TCN"" stand for",host country national,expatriates,home country national,Third country national,D,No explanation,
Question 116,Main disadvantage of critical incident method is,difficult to develop,cause of disagreements,time consuming,difficult to rate,D,No explanation,
Question 117,An event employees participation in skills practice sessions known as,training and development,performance appraisal,recruiting and placement,career planning workshops,D,No explanation,
Question 118,Gender discrimination lower appraisal rating is an example of,lenient/strict tendency,bias,central tendency,different tendencies,B,No explanation,
Question 119,Position Analysis Questionnaire (PAQ) for job analysis is,quantitative technique,qualitative technique,both A and B,none of above,A,No explanation,
Question 120,Opening retail stores way 'Apple' has opened  a classic example of,vertical integration,horizontal integration,consolidation,geographic expansion,A,No explanation,
Question 121,Assisting managers in HR functions of management known as,line manager,First line supervisor,staff manager,all of above,C,No explanation,
Question 122,A technique including formal methods for testing effectiveness of training program considered as,design of evaluation,controlled experimentation,in-house development,consolidation of gains,B,No explanation,
Question 123,Situation subordinates collude to rate high with each other known as,logrolling,dialog rolling,up rating,lenient/strict tendency,A,No explanation,
Question 124,'Silk Road Technologies' talent management system includes,applicant tracking,on boarding,performance management,all of above,D,No explanation,
Question 125,In big five models 'agreeableness' is tendency to be,sociable,trusting,compliant,both b and c,D,No explanation,
Question 126,A stage leaders create task forces to diagnose problem while carrying shared understanding regarded as,unfreezing stage,moving stage,refreezing stage,nonmoving stage,A,No explanation,
Question 127,A strategy employees seeking flexibility in workforce workplace within same company regarded as,promotions,transfers,reality shock,formal training,B,No explanation,
Question 128,Engineer occupation classified as,realistic,investigative,artistic,social,A,No explanation,
Question 129,A method executive's strengths and weaknesses are being questioned by external consultant known as,behavior modeling,role playing,in-house development center,executive coach,D,No explanation,
Question 130,Low cost foreign competition classified as,potential opportunities,potential threats,potential strengths,potential weaknesses,B,No explanation,
Question 131,A managerial approach focusing on improving work methods situation analysis and observation known as,linking performance and pay,scientific management movement,performance based system,low-performance work system,B,No explanation,
Question 132,Advantage of 'BARS' system is,simple to use,avoids central tendency and biases,ends up with predetermined rating figures,providing behavioral anchors,D,No explanation,
Question 133,A category testing learned skills and principles known as,measuring reaction,measuring learning,measuring behavior,measuring results,B,No explanation,
Question 134,Pay is rewarded according to strict proportionality between rewards and production results known as,straight piecework,proportional piecework,dis-proportional piecework,variable piecework,A,No explanation,
Question 135,Credit managers tend to be classified as personality oriented of,non-conventional,conventional,non artistic,realistic,B,No explanation,
Question 136,A plan accommodate employees preferences of planning for benefit classified as,cafeteria benefit plans,fixed benefit plans,flexible benefit plans,both a and c,C,No explanation,
Question 137,Basic approach in employee's performance compares with their current performance to,set standards,performance in previous years,performance in last job,none of above,A,No explanation,
Question 138,First step in validating a test is to,analyze the job,choose the tests,administer the tests,Relate test scores,A,No explanation,
Question 139,An aim of 'performance appraisal' is to,fire the employee,motivate the employee,counsel the employee,hire the employee,B,No explanation,
Question 140,Notion that woman and men should collect equal pay for comparable skills considered as,comparable worth,incomparable worth,definable worth,indefinable worth,A,No explanation,
Question 141,Focus on long-term issue that are hard-to-reverse are part of,coaching,mentoring,informal training,formal training,B,No explanation,
Question 142,In career development providing assistance programs for academic learning is an art of,individual role,manager role,employer role,line manager,C,No explanation,
Question 143,An availability of information systems to integrate succession planning with recruitment is part of,phased retirement,preretirement counseling,talent management,modifying selection procedure,C,No explanation,
Question 144,Which factor does not involve in communication to employees,interviewing,disciplining,counseling,compensating,D,No explanation,
Question 145,Unstructured interview is also called,non directive interview,directive interview,both A and B,none of above,B,No explanation,
Question 146,Health insurance of employees is included in,basic pay,short-term benefits,executive perks,job ranking,C,No explanation,
Question 147,Reinforcement of new culture by organization's manager can be concluded in,unfreezing stage,moving stage,refreezing stage,nonmoving stage,C,No explanation,
Question 148,Second step in ranking method of job evaluation is to,combine ratings,rank jobs,selecting compensable factors,grouping jobs,D,No explanation,
