Question Name,Question,Option A,Option B,Option C,Option D,Answer,Explanation
Question 136,Sum of values of data is divided by total number of values is used to calculate,arithmetic mean ,weighted average mean,geometric mean ,harmonic mean ,A,No Explanation
Question 137,Considering moments in standard units fourth alpha with power 1 is equivalent to,beta three,beta four ,beta one ,beta two ,D,No Explanation
Question 138,Class of variable which can accept any value within upper and lower limit is classified as,posterior random variable,interior random variable,discrete random variable,continuous random variable,D,No Explanation
Question 139,Type of cumulative frequency distribution in which class intervals are added in bottom to top order is classified as,more than type distribution ,marginal distribution ,variation distribution ,less than type distribution ,A,No Explanation
Question 140,Listing of elements in population with identifiable number is classified as,regularity experimental frame,indirect experiment frame,direct experimental frame,frame for experiment,D,No Explanation
Question 141,Probability without any conditions of occurrence of an event is considered as,conditional probability ,marginal probability ,non conditional probability ,occurrence probability ,B,No Explanation
Question 142,'less than type distribution' and 'more than type distribution' are types of,class distribution ,cumulative class distribution ,cumulative frequency distribution ,upper limit distribution ,C,No Explanation
Question 143,Difference of mode and mean is equal to,3(mean-median),2(mean-median),3(mean-mode),2(mode mean),A,No Explanation
Question 144,If mean is 11 and median is 13 then value of mode is,15,13,11,17,D,No Explanation
Question 145,Categories of measures of dispersion are classified as,uniform measures ,relative measures ,absolute measures ,both b and c ,D,No Explanation
Question 146,If central tendency is found by using whole population as input data then this is classified as,sample statistic ,population statistic,population tendency ,population parameters ,D,No Explanation
Question 147,Criteria of inferential statistics which considers sum of squared deviations is classified as,central squares criterion ,outliers square criterion ,multiple squares criterion ,least squares criterion,D,No Explanation
Question 148,For Karl Pearson's skewness coefficient value of skewness must be in limits,Â±3,Â±5,Â±4,Â±2,A,No Explanation
Question 149,If standard deviation of population 1 is 3 with sample size is 8 and population 2 standard deviation is 5 with sample size is 7 then standard deviation of sampling distribution is,4.044,3.044,1.044,2.044,C,No Explanation
Question 150,Considering sample statistic if mean of sampling distribution is equal to population mean then sample statistic is classified as,unbiased estimator,biased estimator,interval estimator,hypothesis estimator,A,No Explanation
Question 151,Data which is generated within company such as routine business activities is classified as,external primary data sources ,internal primary data sources ,external secondary data sources ,internal secondary data sources ,D,No Explanation
Question 152,Exclusive method and inclusive method are ways of classifying data on basis of,manifold classes ,rational intervals ,class width ,class intervals ,D,No Explanation
Question 153,Histograms pie charts and frequency polygons are all types of,one dimension diagrams ,two dimension diagrams,cumulative diagrams,dispersion diagrams ,A,No Explanation
Question 154,In statistical analysis sample size is considered large if,n &gt; or = 30,n &lt; or = 30,n &gt; or = 50,n &lt; or = 50,A,No Explanation
Question 155,If value of x for normal distribution is 35 mean of normal distribution is 65 and standard deviation is 25 then standardized random variable is,âˆ’1.5,âˆ’1.2,âˆ’1.7,âˆ’4,B,No Explanation
Question 156,In a negative skewed distribution order of mean median and mode is as,mean&lt;median&gt;mode,mean&gt;median&gt;mode,mean&lt;median&lt;mode,mean&gt;median&lt;mode,C,No Explanation
Question 157,Measure which describes detailed characteristic of whole data set is classified as,average or central value ,positive skewed value ,negative skewed value ,positive extended value ,A,No Explanation
Question 158,Population variance is also called,sigma squared ,negative sigma,square root ,cubic root ,A,No Explanation
Question 159,Lesser uniformity of 50% observations around median value is indicated with help of,larger value of range deviation ,smaller value of range deviation ,larger value of quartile deviation ,smaller value of quartile deviation ,C,No Explanation
Question 160,Question which have different answers for its subparts is considered as,double barreled questions ,single barreled questions ,multiple barreled questions ,dichotomous questions ,A,No Explanation
Question 161,If standard deviation of population is known then Î_ must be equal to,absolute value of estimator,error free mean,expected value of mean,inferential value of mean,C,No Explanation
Question 162,Formula of calculating mean for hyper geometric probability distribution is,n (m âÅ„ n),m (n âÅ„ n),n (n âÅ„ m),n (m âÅ„ n),D,No Explanation
Question 163,Formula in which binomial distribution approaches normal probability distribution with help of normal variable is written as,x - qn divided by square root of pq,x - np divided by square root of npq,x + np divided by square root of np,x - pq divided by square root of npq,B,No Explanation
Question 164,Term used to describe frequency curve is,symmetrical distribution ,symmetry and kurtosis,kurtosis of distribution ,relative frequency curve ,B,No Explanation
Question 165,Extent to which values are dispersed around central observation is considered as,trailing ,variation ,extension ,centralized valuation ,B,No Explanation
Question 166,Analytical study of relationship between output commodity and its price is classified as,demand analysis ,supply analysis ,imports analysis ,export analysis,A,No Explanation
Question 167,If large number of values lies in central part of data table then spread of values is measured by,percentile range ,inter quartile range ,quartile range ,deciles range ,B,No Explanation
Question 168,If value of m in beta distribution is 35 and value of n in beta distribution is 50 then expected value of random variable x in beta distribution is,0.411,0.311,0.511,0.211,A,No Explanation
Question 169,Formula which considers relationship between set of observations standard deviation and mean is classified as,empirical value ,three way rule,normal rule,both a and c,D,No Explanation
Question 170,Methods in statistics that uses sample statistics to estimate parameters of population are considered as,inferential statistics ,absolute statistics,coverage statistics,random sample statistics,A,No Explanation
Question 171,Third step in constructing frequency distribution is to,select appropriate class intervals ,determine class intervals ,determine class limits ,determine midpoints of classes ,C,No Explanation
Question 172,If calculated value of total sum of squares in sample variance is larger than variation in data set is considered as,smaller ,greater ,zero ,negative ,B,No Explanation
Question 173,Distribution is considered leptokurtic if,beta three is less than three,beta two is greater than two,beta three is greater than three,beta two is greater than three,D,No Explanation
Question 174,Manner in which geometric mean harmonic mean and arithmetic mean are related is as,A.M&gt;G.M&gt;H.M ,A.M&gt;G.M&lt;H.M ,A.M&lt;G.M&lt;H.M ,A.M&lt;G.M&gt;H.M ,A,No Explanation
Question 175,In systematic sampling population is 200 and selected sample size is 50 then sampling interval is,250,0.25,4,40,C,No Explanation
Question 176,In a negative binomial distribution of probability random variable is also classified as,discrete random variable,continuous waiting time random variable,discrete waiting time random variable,discrete negative binomial variable,C,No Explanation
Question 177,Process of converting inputs into outputs in presence of repeatedly same conditions is classified as,sampler ,parameters,process,mixer ,C,No Explanation
Question 178,Statistical measures such as deciles percentiles median and quartiles are classified as part of,percentile system ,quartile system ,deciles system ,moment system ,A,No Explanation
Question 179,Demand of products per day for three days are 21 19 22 units and their respective probabilities are 0.29 0.40 0.35. profit per unit is $0.50 then expected profits for three days are,21 19 22,21.5 19.5 22.5,0.29 0.40 0.35,3.045 3.8 3.85,D,No Explanation
Question 180,For ungrouped data in calculation of moments from mean formula to calculate this measure is,1âÅ„n Î£(x-mean)<sup>r</sup>,2âÅ„n Î£(x-mean)<sup>r</sup>,2âÅ„n Î£(x+mean)<sup>r</sup>,2âÅ„n Î£(x+mean)<sup>x</sup>,A,No Explanation
Question 181,Joint probability of two statistical dependent events Y and Z can be written as P(Y and Z) =,P(Z + Y) * P(Y|Z),P(Y) * P(Z|Y),P(Y) * P(Z|Y) + P(Z),P(Y) * P(Z|Y) - P(Z + Y),B,No Explanation
Question 182,In a Venn diagram used to represent probabilities sample space of events is represented by,square,triangle ,circle,rectangle ,D,No Explanation
Question 183,Formula of mean of uniform or rectangular distribution is as,mean = 4(b + a) âÅ„ 2b,mean = (b + a) âÅ„ 2,mean = (b - 2a) âÅ„ 4,mean = (2a + 2b) âÅ„ 2a,B,No Explanation
Question 184,Distribution which shows cumulative figure of all observations placed below upper limit of classes in distribution is considered as,cumulative frequency distribution ,upper limit distribution ,class distribution ,cumulative class distribution ,A,No Explanation
Question 185,Standard deviation of data is 12 and mean is 72 then coefficient of variation is,14.67%,16.67%,12.67%,13.67%,B,No Explanation
Question 186,Mode is best measure of tendency if analysis is,descriptive ,exploratory ,experimental ,set of deciles ,A,No Explanation
Question 187,Marginal probability of independent events and dependent events must be,same ,different ,one ,two ,A,No Explanation
Question 188,Data classification which is based on variables such as production cost height and weight is considered as,qualitative classification ,quantitative classification ,open end classification ,time series classification ,B,No Explanation
Question 189,In deciles central tendency median to be measured must lie in,fourth deciles,seventh deciles,sixth deciles ,fifth deciles,D,No Explanation
Question 190,Value of third quartile is 61 and inter quartile range of set of observation is 48 then value of first quartile is,24,34,64,13,D,No Explanation
Question 191,Type of central tendency measures which divides data set into ten equal parts is classified as,percentiles ,multiple pile of data ,quartiles ,deciles ,D,No Explanation
Question 192,Normal distribution is also classified as,Gaussian distribution,Poisson distribution,Bernoulli's distribution,weighted average distribution,A,No Explanation
Question 193,In cluster sampling elements of selected clusters are classified as,elementary units,primary units,secondary units,proportional units,A,No Explanation
Question 194,In statistics out of 100 marks of 21 students in final exams are as 90 95 95 94 90 85 84 83 85 81 92 93 82 78 79 81 80 82 85 76 85 then mode of data is,85,95,90,81,A,No Explanation
Question 195,Three dimensional diagrams are named as so because they considers both,length and breadth ,breadth and depth ,depth length and breadth ,depth and length,C,No Explanation
Question 196,Type of classification in which class is subdivided into subclasses and subclasses are divided into more classes is considered as,simple classification ,manifold classification ,rational classification ,reflected classification ,B,No Explanation
Question 197,Method of sampling in which population is divided in to mutual exclusive groups that have useful context in statistical research is classified as,stratified sampling,regular group sampling,irregular group sampling,direct group sampling,A,No Explanation
Question 198,Data table which is presented in tabular form on basis of two or more simultaneous characteristics is classified as,percentage table ,interval table ,simple table,complex table ,D,No Explanation
Question 199,If in a formula mean absolute deviation is numerator and arithmetic mean is denominator then resultant value is classified as,coefficient of mean deviation ,coefficient of absolute quartile deviation ,coefficient of quartile range deviation ,coefficient of mean absolute deviation ,D,No Explanation
Question 200,Probability which explains x is equal to or less than particular value is classified as,discrete probability,cumulative probability ,marginal probability ,continuous probability ,B,No Explanation
Question 201,Branch of statistics which deals with development of particular statistical methods is classified as,industry statistics ,economic statistics ,applied statistics ,mathematical statistics ,D,No Explanation
Question 202,Consider an event B non-occurrence of event B is represented by,union of A,complement of A,intersection of A,A is equal to zero,B,No Explanation
Question 203,If sample size is 6 and population is 50 from which it is drawn without replacement and elements for success are 22 then variance of hyper geometric probability distribution is,1.388,2.388,3.388,4.388,A,No Explanation
Question 204,Types of probability distributions by taking their functions of considerations must include,posterior probability distribution,discrete probability distribution,continuous probability distribution,both b and c ,D,No Explanation
Question 205,Technique which implies in statistical process to measure variation in data is called,measures of dispersion ,measures of statistics ,measures of process ,none of above ,D,No Explanation
Question 206,Consider probability distribution as standard normal if value of Î_ is 75 value of x is 120 with unknown standard deviation of distribution then value of z-statistic,will be one,will be zero,will be negative,will be positive,D,No Explanation
Question 207,Data table which is presented in tabular form on basis of single characteristics is classified as,simple table,complex table ,percentage table ,interval table ,A,No Explanation
Question 208,Method of counting outcomes in which number of outcomes are determined while considering ordering is classified as,intersection combinations ,union combinations ,listed combination ,permutations,D,No Explanation
Question 209,Area diagrams and surface diagrams are other names of,single dimension diagrams ,two dimensional diagrams ,three dimensional diagrams ,four dimension diagrams,B,No Explanation
Question 210,If standard deviation is 5 then quartile deviation is,5,0.334,0.234,0.134,D,No Explanation
Question 211,If mean of population is 25 then mean of sampling distribution is,25,5,30,35,A,No Explanation
Question 212,Frequency distribution which is result of cross classification is called,bivariate frequency distribution ,univariate frequency distribution ,multi-variables distribution ,close ended distribution ,A,No Explanation
Question 213,Types of histograms includes,deviation bar charts ,paired bar charts ,grouped charts ,all of above ,D,No Explanation
Question 214,Method of counting outcomes in which number of outcomes are determined without taking care of arrangement order is classified as,listed combinations ,union combinations ,intersection combination ,unlisted combinations,C,No Explanation
Question 215,Coefficient of skewness method in which basis of measuring is deciles and percentiles is classified as,Gary's coefficient of skewness,Sharma's coefficient of skewness,Kelly's coefficient of skewness,Jack Karl's coefficient of skewness,C,No Explanation
Question 216,If value of p is 0.60 and value of n is 3 whereas random variable x is equal to 4 then value of z-score of distribution is,1.59,2.59,2.68,0.59,B,No Explanation
Question 217,Value of third quartile is 72 second quartile is 52 and first quartile is 45 then quartile deviation is,13.5,14,16.5,18.5,A,No Explanation
Question 218,Undesirable consequences which causes estimated population variance to appear less as compared to real results are classified as,undesired error ,bias ,non-calculate error ,non-zero error,B,No Explanation
Question 219,Type of variable which can take any numerical figure for calculation is classified as,continuous variable ,measuring variable ,flowchart variable ,discrete variable,A,No Explanation
Question 220,If population parameter Î_ and unbiased estimate of population is xâ€_ then sampling error is as,|pâ€_ - Î_|,|xâ€_ - Î_|,|xâ€_ + Î_|,|xâ€_ * Î_|,B,No Explanation
Question 221,Outcome of experiment which can be broken into more convenient list of outcomes is called,alpha event ,gamma event ,simple event ,random event ,C,No Explanation
Question 222,Classification of data on geographical basis is also called,reflected classification ,populated classification ,sampling classification ,spatial classification ,D,No Explanation
Question 223,Theorem which states that as sample size increases sampling distribution must approach normal distribution is classified as,limited approximation theorem,secondary limit theorem,primary limit theorem,central limit theorem,D,No Explanation
Question 224,For grouped data in calculation of moments from mean formula to calculate this measure is,2âÅ„n Î£n(x+mean)<sup>r</sup>,2âÅ„n Î£n(x+mean)<sup>x</sup>,1âÅ„n Î£f(x-mean)<sup>r</sup>,2âÅ„n Î£f(x-mean)<sup>r</sup>,C,No Explanation
Question 225,Measure of central tendency which is calculated by considering most frequent occurring value as central value is classified as,central mode,mode ,frequent value ,percent value ,B,No Explanation
Question 226,Tools such decision making by nominal groups brain storming and term buildings are all considered as,serial tools ,behavioral tools,statistical tools ,parallel tools,B,No Explanation
Question 227,For a rectangular or uniform distribution value of interval a is 7 and value of interval b is 8 then value of mean for distribution is,1.33,3.33,2.33,4.33,D,No Explanation
Question 228,Conditions such as large sample size to represent population and samples must be drawn randomly are included in,principle of statistical regularity,principle of statistical irregularity,principle of sampling error,principle of inertia,A,No Explanation
Question 229,One of category of statistical method is,managerial statistics ,decision science ,inferential statistics ,industry statistics ,C,No Explanation
Question 230,Condition for negative exponential distribution considering mean (Î_) is that,Î_ must be less than zero,Î_ must be greater than one,Î_ must be greater than zero,Î_ must be smaller than twp,C,No Explanation
Question 231,Number of observations are 11 and value of arithmetic mean is 19 then sum of all values is,209,30,8,173,A,No Explanation
Question 232,Set of raw data arranged in ascending or descending order is called,ordered array ,nominal array ,ordinal array ,interval array ,A,No Explanation
Question 233,If mean of binomial probability distribution is 25 then mean of Poisson probability distribution is,70,50,25,50,C,No Explanation
Question 234,If value of x is less than Î_ of standard normal probability distribution then the,z-statistic is negative,z-statistic is positive,f(x) will be even number,f(x) will be prime number,A,No Explanation
Question 235,Branch of statistics in which data is collected according to ordinal scale or nominal scale is classified as,distribution statistics ,sampling statistics ,parametric statistics ,non-parametric statistics ,D,No Explanation
Question 236,2600 applications for home mortgage are received by a bank and probability of approval is 0.78 then standard deviation of binomial probability distribution is,2028,546.16,446.16,646.16,C,No Explanation
Question 237,Halfway point between lower class limits and upper class limits is classified as,nominal mid-point ,class mid-point ,interval mid-point ,ordinal mid-point ,B,No Explanation
Question 238,Measures in sampling that are results of sample analyses are called,absolute statistics parameter,coverage estimators,population statistics,sample statistic,D,No Explanation
Question 239,Time frame to complete a transaction in bank is classified as,parameters,process,mixer ,sampler ,B,No Explanation
Question 240,Important rules in computation of experimental outcomes includes,multiple experiments,permutations,combinations,all of above,D,No Explanation
Question 241,Type of rating scale which represents response of respondents by marking at appropriate point is classified as,graphic rating scale ,responsive scale ,pointed scale ,marking scale,A,No Explanation
Question 242,Classification on basis of time order is called as,disclosed classification ,chronological classification ,external classification,internal classification ,B,No Explanation
Question 243,For two events probability of occurrence of both events at same time or occurrence in series is classified as,joint probability ,dependent probability ,series probability ,conditional probability ,A,No Explanation
Question 244,Branches of statistics includes,applied statistics ,mathematical statistics ,industry statistics ,both a and b ,D,No Explanation
Question 245,All values in sample distribution that can freely varies in selected random sample from population are indicated as,degree of freedom,degree of error,degree of statistic,degree of possibility,A,No Explanation
Question 246,Unifying method to summarize statistical measure of descriptive nature is called,unifying momentum ,momentum summary ,moments ,momentum ,C,No Explanation
Question 247,IF population standard deviation is not known then formula used to calculate standard error is as,n - 1 âÅ„ sample size square root,s âÅ„ sample size square root,n + 1 âÅ„ square root of s,n * 2 âÅ„ sample size square root,B,No Explanation
Question 248,Type of continuous distribution in which probability is constant is classified as,rectangular distribution,square distribution,open frequency distribution,class frequency distribution,A,No Explanation
Question 249,Considering combination rule of counting outcome value of 5! Is,5,120,24,20,B,No Explanation
Question 250,Scale which is used to determine ratios equality is considered as,satisfactory scale ,ratio scale ,goodness scale ,exponential scale ,B,No Explanation
Question 251,Measuring theorem which helps in determining proportion of observations for specific interval of mean and standard deviation is classified as,Pearson Theorem ,Chebyshev's Theorem,sampling theorem ,population theorem ,B,No Explanation
Question 252,If for a distribution difference of first quartile and median is less than difference of median and third quartile then distribution is classified as,negatively skewed ,not skewed at all,absolute open ended,positively skewed,A,No Explanation
Question 253,Considering individual values of data set actual mean must always be,1,âˆ’1,0,2,C,No Explanation
Question 254,If value of interval a is 4 and value of interval b is 5 then variance of uniform distribution is,6.75,4.75,5.75,0.75,A,No Explanation
Question 255,Considering set of observations percentage of values that lies within population mean plus two standard deviations is,60%,55%,75%,85%,C,No Explanation
Question 256,In probability theory events are denoted by,Greek letters ,capital letters,small letters ,Latin letters,B,No Explanation
Question 257,Examples of variables in statistical phenomenon consists,job satisfaction ,consumer behaviors ,leadership ability ,all of above ,D,No Explanation
Question 258,Formula such as mn âÅ„ (m + n)Â_ (m + n + 1) is used to calculate,variance in exponential distribution,variance in alpha distribution,variance in gamma distribution,variance in beta distribution,D,No Explanation
Question 259,Measure of variation which is useful for highly skewed distribution is,inter quartile deviation ,quartile deviation ,inter quartile range ,quartile range ,B,No Explanation
Question 260,Graphs which represents data on maps are considered as,cartograms ,picto-graph,pictograms ,symmetry graph,A,No Explanation
Question 261,Class frequency is divided by number of observations in frequency distribution to convert it into,relative margin distribution,relative variable distribution ,relative frequency distribution ,relative width distribution ,C,No Explanation
Question 262,If value of x-bar is 70 and Î_ of sampling distribution is 15 with standard deviation is 20 then standard normal variable is,2.75,3.75,4.75,5.75,A,No Explanation
Question 263,Uncertainty of elements can be reduced with estimation of,under coverage error,coverage error,sampling error,random sample error,C,No Explanation
Question 264,Histograms and pie charts are classified as one dimensional diagrams because only,length is considered ,width is considered ,length plus width is considered ,breadth is considered ,A,No Explanation
Question 265,Procedures of descriptive statistics and control charts which are used to improve process are classified as,statistical tools ,parallel tools,serial tools ,behavioral tools,A,No Explanation
Question 266,Procedure of selecting desired portion from population which describes characteristics of whole population is,sampling,extracting,deviation of sample,variability of sample,A,No Explanation
Question 267,In stem and leaf display diagrams used in exploratory analysis leaves are considered as,leading digits ,dispersed digits,central digits ,trailing digits ,D,No Explanation
Question 268,Sum of highest and lowest value is 80 and coefficient of range is 0.625 then difference between highest and lowest value is,70,100,150,50,D,No Explanation
