Question Name,Question,Option A,Option B,Option C,Option D,Answer,Explanation
Question 1,If quartile range is 24 then quartile deviation is,48,12,24,72,B,No Explanation
Question 2,If mean absolute deviation of set of observations is 8.5 then value of quartile deviation is,7.08,9.08,10.2,11.2,A,No Explanation
Question 3,Sum of all squared deviations is divided by total number of observations to calculate,population deviation ,population variance ,sample deviation ,sample variance ,B,No Explanation
Question 4,If for a distribution difference of first quartile and median is greater than difference of median and third quartile then distribution is classified as,absolute open ended,positively skewed,negatively skewed ,not skewed at all,B,No Explanation
Question 5,For recorded observation ratios measured by absolute variation are considered as,non-relative measures ,relative measures ,high uniform measures ,low uniform measures ,B,No Explanation
Question 6,If arithmetic mean is multiplied to coefficient of variation then resulting value is classified as,coefficient of deviation ,coefficient of mean ,standard deviation ,variance,C,No Explanation
Question 7,Way of getting information from measuring observation whose outcomes occurrence is on chance is called,beta experiment ,random experiment ,alpha experiment ,gamma experiment ,B,No Explanation
Question 8,Probability of second event in situation if first event has been occurred is classified as,series probability ,conditional probability ,joint probability ,dependent probability ,B,No Explanation
Question 9,If vertical lines are drawn at every point of straight line in frequency polygon then by this way frequency polygon is transformed into,width diagram ,length diagram ,histogram ,dimensional bar charts ,C,No Explanation
Question 10,Analysis of labor turnover rates performance appraisal training programs and planning of incentives are examples of role of,statistics in personnel management ,statistics in finance ,statistics in marketing ,statistics in production ,A,No Explanation
Question 11,If standard deviation of population is 35 and sample size is 9 then standard deviation of sampling distribution is,12.67,11.67,13.67,14.67,B,No Explanation
Question 12,If arithmetic mean is considered as average of deviations then resultant measure is considered as,close end deviation,mean absolute deviation ,mean deviation ,variance deviation ,B,No Explanation
Question 13,If positive square root is taken of population variance then calculated measure is transformed into,standard root ,standard deviation ,standard variance ,sample variance ,B,No Explanation
Question 14,Focus groups individual respondents and panels of respondents are classified as,pointed data sources ,itemized data sources ,secondary data sources ,primary data sources ,D,No Explanation
Question 15,Variables whose measurement is done in terms such as weight height and length are classified as,continuous variables,measuring variables,flowchart variables ,discrete variables,A,No Explanation
Question 16,Diagrams such as cubes and cylinders are classified as,one dimension diagrams ,two dimension diagram ,three dimensional diagrams ,dispersion diagrams ,C,No Explanation
Question 17,In binomial probability distribution dependents of standard deviations must includes,probability of q,probability of p ,trials,all of above,D,No Explanation
Question 18,At a manufacturing plant unit of quantity manufactured in 8 days are 250 320 240 210 260 330 310 260,210,260,240,250,B,No Explanation
Question 19,Examples of applications of range in real world includes,weather forecasts,quality control ,fluctuation in share prices ,all of above ,D,No Explanation
Question 20,Formula of coefficient of range is,L+LâÅ„H+H,H+HâÅ„L+L,H-LâÅ„H+L,H+lâÅ„H-L,C,No Explanation
Question 21,Discrete variables and continuous variables are two types of,open end classification ,time series classification ,qualitative classification ,quantitative classification ,D,No Explanation
Question 22,In a set of observations amount of variation can be shown in form of figures with help of,absolute measures ,uniform measures ,non-uniform measures ,exploratory measures ,A,No Explanation
Question 23,Technique used to analyze unemployment rate inflation rate anticipation and capacity utilization to manufacture goods is classified as,data supplying technique,forecasting technique ,data importing technique,data exporting technique ,B,No Explanation
Question 24,Probability which is based on self-beliefs of persons involved in experiment is classified as,subjective approach,objective approach,intuitive approach,sample approach,A,No Explanation
Question 25,Numerical methods and graphical methods are specialized procedures used in,social statistics ,business statistics ,descriptive statistics ,education statistics ,C,No Explanation
Question 26,If first quartile and third quartile are as 32 and 35 respectively with median of 20 then distribution is skewed to,lower tail ,upper tail ,close end tail ,open end tail ,A,No Explanation
Question 27,If beta one is 9 beta two is 11 then coefficient of skewness is,0.589,0.689,0.489,0.889,B,No Explanation
Question 28,If value of first quartile is 49 and value of third quartile is 60 then value of inter quartile range is,21,31,11,41,C,No Explanation
Question 29,Formula to calculate standardized normal random variable is,x - Î_ âÅ„ Ïƒ,x + Î_ âÅ„ Ïƒ,x - Ïƒ âÅ„ Î_,x + Ïƒ âÅ„ Î_,A,No Explanation
Question 30,In probability theories events which can never occur together are classified as,collectively exclusive events ,mutually exhaustive events ,mutually exclusive events,collectively exhaustive events ,C,No Explanation
Question 31,If total sum of square is 20 and sample variance is 5 then total number of observations are,15,25,4,35,C,No Explanation
Question 32,If set of observations is 11 13 15 12 16 18 19 14 20 17 and absolute mean deviation is 12 then percentage of coefficient of mean absolute deviation is,47.41%,57.41%,67.41%,77.41%,D,No Explanation
Question 33,Median mode deciles and percentiles are all considered as measures of,mathematical averages ,population averages ,sample averages ,averages of position ,D,No Explanation
Question 34,In random experiment observations of random variable are classified as,events,composition,trials,functions ,C,No Explanation
Question 35,In systematic sampling value of k is classified as,sampling interval,sub stage interval,secondary stage interval,multistage interval,A,No Explanation
Question 36,Measure of how well is a technique concept or process is considered as,continuity of variables ,goodness of variables ,validity ,reliability,C,No Explanation
Question 37,In stem and leaf display diagrams used in exploratory analysis stems are considered as,central digits ,trailing digits ,leading digits ,dispersed digits,C,No Explanation
Question 38,Joint probability of independent events J and K is equal to,P(J) * P(K),P(J) + P(K),P(J) * P(K) + P(J-K),P(J) * P(K) - P(J * K),A,No Explanation
Question 39,In binomial distribution formula of calculating standard deviation is,square root of p,square root of pq,square root of npq,square root of np,C,No Explanation
Question 40,Variability which is defined as difference between third and first quartile is considered as,quartile range ,deciles range ,percentile range ,inter quartile range ,D,No Explanation
Question 41,Measurement techniques used to measure extent of skewness in data set values are called,measure of distribution width ,measure of median tail ,measure of tail distribution ,measure of skewness ,D,No Explanation
Question 42,Variance of random variable x of gamma distribution can be calculated as,Var(x) = n + 2 âÅ„ Î_sup2;,Var(x) = n âÅ„ Î_sup2;,Var (x) = n * 2 âÅ„ Î_sup2;,Var(x) = n - 2 âÅ„ Î_sup3;,B,No Explanation
Question 43,Branch of statistics which considers ratio scale and interval scale is considered as,parametric statistics ,non-parametric statistics ,distribution statistics ,sampling statistics ,A,No Explanation
Question 44,In two units of company employees in unit one are 650 and monthly salary is $2750 employees in unit two are 700 and monthly salary is $2500 then combined arithmetic mean is,$2620 ,$2520 ,$2420 ,$2320 ,A,No Explanation
Question 45,Mean of squared deviations which is calculated from arithmetic mean is called,mean square average ,standard square average,population average ,sample square average ,A,No Explanation
Question 46,Reports on quality control production and financial accounts issued by companies are considered as,external secondary data sources ,internal secondary data sources ,external primary data sources ,internal primary data sources ,B,No Explanation
Question 47,Statistical measures such as average deviation standard deviation and mean are classified as part of,deciles system ,moment system ,percentile system ,quartile system ,B,No Explanation
Question 48,Classification method in which upper limit of interval is same as of lower limit class interval is called,exclusive method ,inclusive method ,mid-point method ,ratio method ,A,No Explanation
Question 49,Method of calculating skewness which is based on positions of quartiles and median in a distribution is called,Gary's coefficient of skewness,Sharma's coefficient of skewness,Bowley's coefficient of skewness,Jack Karl's coefficient of skewness,C,No Explanation
Question 50,Formula in which Poisson probability distribution approaches normal probability distribution with help of normal variable is written as,x + Î» âÅ„ square root of Î»,x * Î» âÅ„ square root of x*Î»,x - Î» âÅ„ square root of Î»,x + Î» âÅ„ square root of pqÎ»,C,No Explanation
Question 51,Measure of distance which is greatly influenced by extreme values in data is considered as,range ,average ,positive uniformity ,negative uniformity ,A,No Explanation
Question 52,Distribution whose function is calculated by considering Bernoulli trials that are infinite In number is classified as,negative Poisson distribution,bimodal cumulative distribution,common probability distribution,negative binomial probability distribution,D,No Explanation
Question 53,In every phenomenon process of thought that focus on identifying controlling and reduction of variations in data is classified as,parallel thinking ,serial thinking ,statistical thinking ,managerial thinking ,C,No Explanation
Question 54,Type of cumulative frequency distribution in which class intervals are added in top to bottom order is classified as,variation distribution ,less than type distribution ,more than type distribution ,marginal distribution ,B,No Explanation
Question 55,Type of stratified proportion sampling in which information is gathered on convenience basis from different groups of population is classified as,purposive sampling,judgment sampling,quota sampling,convenience sampling,C,No Explanation
Question 56,Median of a moderately skewed distribution is 8 third quartile is 12 first quartile is 8 and inter-quartile range is 4 then relative coefficient of skewness is,Â±8,Â±1,Â±9,Â±11,B,No Explanation
Question 57,If most repeated observations recorded are outliers of data then mode is considered as,intended measure ,percentage measure ,best measure ,poor measure ,D,No Explanation
Question 58,Data based on workers salary is as 2500 2700 2600 2800 2200 2100 2000 2900 3000 2800 2200 2500 2700 2800 2600 and number of classes desired is 10 then width of class interval is,400,300,100,200,C,No Explanation
Question 59,Number of observations are 30 and value of arithmetic mean is 15 then sum of all values is,15,450,200,45,B,No Explanation
Question 60,Value of Î£fx is 180 A= 22 and width of class interval is 5 arithmetic mean is 120 then observations are,59,30,39.5,49.5,B,No Explanation
Question 61,Mean absolute deviation is 5 and arithmetic mean is 110 then coefficient of mean absolute deviation is,1.054,0.045,0.054,0.064,B,No Explanation
Question 62,In Poisson probability distribution if value of Î» is integer then distribution will be,bimodal,unimodal,positive modal,negative modal,A,No Explanation
Question 63,Moment about population mean which is expressed in standard units is denoted by,Latin letter beta,Greek letter gamma ,Greek letter alpha,Greek letter beta,C,No Explanation
Question 64,Mean of binomial probability distribution is 857.6 and probability is 64% then number of values of binomial distribution,1040,1340,1240,1140,B,No Explanation
Question 65,Convenient summarizing method which is used to describe population characteristics rather than explaining samples of that population is classified as,unstable moments,stable moments ,lower moments,higher moments ,D,No Explanation
Question 66,Tail or head one or zero and girl and boy are examples of,non-functional events,complementary events,non complementary events,functional events,B,No Explanation
Question 67,Scale which categorize events in collectively exhaustive manner and mutually exclusive manner is classified as,discrete scale,continuous scale ,valid scale ,nominal scale ,D,No Explanation
Question 68,Consider two events X and Y X-bar and Y-bar represents,occurrence of Y,occurrence of X,non-occurrence of X and Y,occurrence of X and Y,C,No Explanation
Question 69,Value of Î£fx is 300 A= 35 number of observations are 15 and width of class interval is 5 then arithmetic mean is,135,145,150,235,A,No Explanation
Question 70,In measuring probability of any certain event zero represents,impossible events,possible events,certain event,sample event,A,No Explanation
Question 71,Largest value is 60 and smallest value is 40 and number of classes desired is 5 then class interval is,20,4,25,15,B,No Explanation
Question 72,If value of p is smaller or lesser than 0.5 then binomial distribution is classified as,skewed to right ,skewed to left ,skewed to infinity ,skewed to integers ,A,No Explanation
Question 73,Number of patients who visited cardiologists are as 63 57 51 65 in four days then absolute mean deviation (approximately) is,8 patents ,4 patients ,10 patients ,15 patients ,B,No Explanation
Question 74,Number of individuals arriving at boarding counter on an airport is an example of,numerical outcome ,non numerical outcome ,random outcome ,simple outcome ,A,No Explanation
Question 75,In terms of dispersion difference measurement of dispersion for available data is classified as,average measures ,distance measures ,average deviation measures ,availability measures ,B,No Explanation
Question 76,Parameters of population are denoted by the,roman letters,lower case Greek letter,upper case Greek letter,associated roman alphabets,B,No Explanation
Question 77,Variation in which outcomes of experiments are effected by uncontrolled factors is considered as,random variation ,mesokurtic variation ,platykurtic variation ,mesokurtic variation ,A,No Explanation
Question 78,If Î_ is equal to 8 then standard deviation of exponential probability distribution is,0.425,0.125,0.225,0.325,B,No Explanation
Question 79,For set of values percentage of values that lies within population mean plus four standard deviations of population is,83.75%,93.75%,95%,98.75%,B,No Explanation
Question 80,In binomial distribution formula of calculating mean is,Î_ = p + q,Î_ = np,Î_ = pq,Î_ = qn,B,No Explanation
Question 81,Considering sales coefficient of variation for product X is 9.3% and coefficient of variation for product Y is 8.9% then sales fluctuation of,product X is higher ,product Y is higher ,product X is lower ,product X and Y is lower,A,No Explanation
Question 82,If two events X and Y are considered as partially overlapping events then rule of addition can be written as,P(X or Y) = P(X) - P(Y) + P(X and Y),P(X or Y) = P(X) + P(Y) * P(X - Y),P(X or Y) = P(X) * P(Y) + P(X - Y),P(X or Y) = P(X) + P(Y) - P(X and Y),D,No Explanation
Question 83,Type of rating scale which allows respondents to choose most relevant option out of other stated options is classified as,marking rating scale ,graphical rating scale,itemized rating scale ,pointed rating scale ,C,No Explanation
Question 84,Considering standard deviation mean absolute deviation is equal to,5âÅ„4Ïƒ,5âÅ„8Ïƒ,4âÅ„5Ïƒ,7âÅ„8Ïƒ,C,No Explanation
Question 85,Moment about mean which is indication whether distribution is symmetrical or asymmetrical is considered as,first moment ,third moment ,second moment ,fourth moment ,B,No Explanation
Question 86,If a person buys a lottery chance of winning a Toyota car is 60% chance of winning Hyundai car is 70% and chance of winning both is 40% then chance of winning Toyota or Hyundai is,0.6,0.9,0.8,0.5,B,No Explanation
Question 87,Kurtosis defines peakness of curve in region which is,around the mode ,around the mean ,around the median ,around the variance ,A,No Explanation
Question 88,Summary and presentation of data in tabular form with several non-overlapping classes is referred as,nominal distribution ,ordinal distribution ,chronological distribution ,frequency distribution ,D,No Explanation
Question 89,Mistakes or biases which are considered as causes of non-sampling errors must includes,incorrect enumeration of population,non random sample selection,incomplete questionnaire,all of above,D,No Explanation
Question 90,Regardless to difference in distribution of sample and population mean of sampling distribution must be equal to,degree of freedom,statistic error,population mean,standard error,C,No Explanation
Question 91,Mean absolute deviation is divided by coefficient of mean absolute deviation to calculate,variance ,median ,arithmetic mean ,coefficient of variation ,C,No Explanation
Question 92,Difference between highest and lowest observation is 20 and coefficient of range is 0.077 then sum of highest and lowest value is,210,220,260,240,C,No Explanation
Question 93,Quartiles median percentiles and deciles are measures of central tendency classified as,paired average ,deviation averages ,positioned averages ,central averages ,C,No Explanation
Question 94,Government and non-government publications are considered as,external secondary data sources ,internal secondary data sources ,external primary data sources ,internal primary data sources ,A,No Explanation
Question 95,In manufacturing company number of employees in unit A is 40 mean is USD $6400 and number of employees in unit B is 30 with mean of Rs. 5500 then combined arithmetic mean is,9500,8000,7014.29,6014.29,D,No Explanation
Question 96,If quartile deviation of given set of data of 20 observations is 12 then value of standard deviation is,1.667,18,8,32,B,No Explanation
Question 97,According to combination rule if total number of outcomes are 'r' and distinct outcome collection is 'n' then combinations are calculated as,n! âÅ„ r!(n - r)!,n! âÅ„ r!(n + r)!,r! âÅ„ n!(n - r)!,r! âÅ„ n!(n + r)!,A,No Explanation
Question 98,Cluster sampling stratified sampling and systematic sampling are types of,direct sampling,indirect sampling,random sampling,non random sampling,C,No Explanation
Question 99,Considering probability distribution if mode is greater than median then distribution is classified as,variable model ,right skewed ,left skewed ,constant model ,B,No Explanation
Question 100,Types of descriptive measures includes,measures of skewness ,measures of dispersion ,measures of central tendency ,all of above ,D,No Explanation
Question 101,Value which is obtained by multiplying possible values of random variable with probability of occurrence and is equal to weighted average is called,discrete value,weighted value ,expected value,cumulative value ,C,No Explanation
Question 102,Bias occurred in collection of sample because of confusing questions in questionnaire is classified as,non-responsive bias,non distribution bias,non wording bias,wording bias,D,No Explanation
Question 103,High uniformity of 50% observations around median value is indicated with help of,larger value of quartile deviation ,smaller value of quartile deviation ,larger value of range deviation ,smaller value of range deviation ,B,No Explanation
Question 104,According to percentiles median to be measured must lie in,80<sup>th</sup>,40<sup>th</sup>,50<sup>th</sup>,100<sup>th</sup>,C,No Explanation
Question 105,Outcomes of an experiment are classified as,logged events ,exponential results,results ,events ,D,No Explanation
Question 106,Range or set of values which have chances to contain value of population parameter with particular confidence level is considered as,secondary interval estimation,confidence interval estimate,population interval estimate,sample interval estimate,B,No Explanation
Question 107,Bias in which few respondents responds to offered questionnaire is classified as,responsive bias,non-responsive bias,distributed error,concerning error,A,No Explanation
Question 108,Frequency distribution is considered as negatively skewed if all values of distribution moves to,lower tail ,median tail ,variance tail ,upper tail ,A,No Explanation
Question 109,Upper and lower boundaries of interval of confidence are classified as,error biased limits,marginal limits,estimate limits,confidence limits,D,No Explanation
Question 110,In kurtosis beta is greater than three and quartile range is preferred for,mesokurtic distribution ,mega curve distribution ,leptokurtic distribution ,platykurtic distribution ,D,No Explanation
Question 111,Classification method in which upper and lower limits of interval is also in class interval itself is called,exclusive method ,inclusive method ,mid-point method ,ratio method ,B,No Explanation
Question 112,Principle which states that larger sample size larger accuracy and stability is part of,principle of sampling error,principle of inertia,principle of statistical regularity,principle of statistical irregularity,B,No Explanation
Question 113,Relative measures in measures of dispersion are also considered as,coefficient of deviation ,coefficient of average,coefficient of variation ,coefficient of uniformity ,C,No Explanation
Question 114,Number of products manufactured in a factory in a day are 3500 and probability that some pieces are defected is 0.55 then mean of binomial probability distribution is,1925,6364,63.64,3500,A,No Explanation
Question 115,For a parameter whose value is unknown belief or claim for that parameter is classified as,parameter claim testing,expected belief testing,hypothesis testing,primary limit testing,C,No Explanation
Question 116,Standard deviation is divided by coefficient of variation to calculate,arithmetic mean ,coefficient of arithmetic ,coefficient of variance ,multiplier of deviation ,A,No Explanation
Question 117,Frequency distribution whose most values are dispersed to left or right of mode is classified as,skewed ,explored ,bimodal ,unimodal ,A,No Explanation
Question 118,If value of interval a is 2.5 and value of interval b is 3.5 then value of mean for uniform distribution is,0.5,3,2.5,3.5,B,No Explanation
Question 119,Harmonic mean arithmetic mean and geometric mean are all considered as,mathematical averages ,population averages ,sample averages ,extended measures ,A,No Explanation
Question 120,If standard deviation is 7 then mean absolute deviation is,9.75,5.6,7,8.75,B,No Explanation
Question 121,Value of Î£fd is 250 A= 25 number of observations are 12 and width of class interval is 6 then arithmetic mean is,25,250,150,275,C,No Explanation
Question 122,In measures of skewness absolute skewness is equal to,mean+mode ,mean-mode ,mean+median ,mean-median ,B,No Explanation
Question 123,Diagrams used to represent grouped and ungrouped data is classified as,breadth diagrams,bar diagrams,width diagrams ,length diagrams ,B,No Explanation
Question 124,According to empirical rule standard deviation and mean interval that covers approximately 99.75% of data from a frequency distribution is,4Î_Â±4Ïƒ,3Î_Â±3Ïƒ,Î_Â±3Ïƒ,2Î_Â±2Ïƒ,C,No Explanation
Question 125,If arithmetic mean is 25 and harmonic mean is 15 then geometric mean is,17.36,16.36,15.36,19.36,D,No Explanation
Question 126,General tables of data used to show data in orderly manner is called as,single characteristics tables ,repository tables,manifold tables,double characteristic table ,B,No Explanation
Question 127,Frequencies of all specific values of x and y variables with total calculated frequencies are classified as,variate frequencies ,unconditional frequencies ,conditional frequencies ,marginal frequencies ,D,No Explanation
Question 128,Theorem which states least percentage of values that fall within z-standard deviations is classified as,Chebyshev's Theorem,sampling theorem ,Pearson Theorem ,population theorem ,A,No Explanation
Question 129,Type of variable which can take fixed integer values is classified as,flowchart variable ,discrete variable,continuous variable ,measuring variables ,B,No Explanation
Question 130,In binomial probability distribution success and failure generated by trial is respectively denoted by,p and q,a and b,p + q,p - q,A,No Explanation
Question 131,For a random experiment all possible outcomes are called,numerical space,event space ,sample space ,both b and c ,D,No Explanation
Question 132,Unknown or exact value that represents whole population is classified as,parameters,estimators,absolute statistics,coverage estimator,A,No Explanation
Question 133,Types of probabilities for independent events must includes,joint events,marginal events,conditional events,all of above,D,No Explanation
Question 134,Considering types of diagrams squares circles and rectangles are classified as,cumulative diagram ,dispersion diagrams ,one dimension diagrams ,two dimension diagram ,D,No Explanation
Question 135,If value of success in binomial probability distribution is 0.40 and failure is 0.60 and number of values in distribution are 5 then moment coefficient of skewness is,0.467,0.167,0.267,0.367,B,No Explanation
