Question Name,Question,Option A,Option B,Option C,Option D,Answer,Explanation
Question 71,The population of village is 100000. The rate of increase is 10% per annum. Find the population at the start of the third year?,133100,121000,118800,120000,B, 100000==10%‰ Ô(1st year)==>110000==10%‰ Ô(2nd year)==>121000Population at starting of 3rd year = 121000.[By using net percentage change method we have saved our self from cumber some formulas on population which is based on compound interest].
Question 72,Vicky's salary is 75% more than Ashu's. Vicky got a raise of 40% on his salary while Ashu got a raise of 25% on his salary. By what percent is Vicky's salary more than Ashu's?,96%,51.10%,90%,52.10%,A, Let Ashu's salary = 100; Ashu's salary after rise = 125.Then Vicky's salary = 175.Vicky's salary after rise of 40% = 245.[As 10% of Vicky's salary is 17.5 then 40% = 17.5*4 = 70] .Difference between Vicky's salary and Ashu's salary = 245-125 = 120; .% more Vicky's salary than Ashu's = 120*100/125 = 96%.
Question 73,An ore contains 25% of an alloy that has 90% iron. Other than this in the remaining 75% of the ore there is no iron. How many kilograms of the ore are needed to obtain 60 kg of pure iron?,250 kg,275 kg,300 kg,266.66 kg,D, Let there is 100 kg of ore.25% ore contains 90% off Iron that means 25 kg contains;25*90/100 = 22.5 kg Iron.22.5 kg Iron contains 100 kg of ore.Then 1 kg of iron contains = 25/100 kg ore;Hence 60 kg iron contains = 100*60/22.5 = 266.66 kg ore.
Question 74,In the recent climate conference in New York out of 700 men 500 women 800 children present inside the building premises 20% of the men 40% of the women and 10% of the children were Indians. Find the percentage of people who were not Indian?,77%,73%,79%,83%,C, Number of Indians men present there = 700*20/100 = 140Indian women = 500*40/100 = 200Indian children = 800*10/100 = 80.Total member present in climate conference = 700+500+800 = 2000Total Indian = 200+140+80 = 420Hence % of Indian present there = 420*100/2000 = 21%% of people who were not Indian = 100-42 = 79%.
Question 75,Out of the total production of iron from hematite an ore of Iron 20% of the ore gets wasted and out of the remaining iron only 25% is pure iron. If the pure iron obtained in a year from a mine of hematite was 80000 kg then the quantity of hematite mined from that mine in the year is,500000 kg,400000 kg,450000 kg,None of these,B, Let 100 kg of hematite be obtained then 20% of it get wasted that means 80 kg of ore remains.Pure iron = 25% of remaining ore = 80*25/100 = 20 kg.20 kg pure Iron is obtained from 100 of hematite.1 kg pure Iron is obtained from = 100/20 hematite;Then 80000 kg pure Iron is obtained from = (100/20)*80000 = 400000 kg hematite.
Question 76,A man buys a truck for Rs. 250000. The annual repair cost comes to 2% of the price of purchase. Besides he has to pay an annual tax of Rs. 2000. At what monthly rent must he rent out the truck to get a return of 15% on his net invests of the first year?,Rs. 3359,Rs. 2500,Rs. 4000,Rs. 3212.5,D, The total cost for the year = 250000+2% of 2500000+2000 = Rs. 257000.For getting return of 15% he must earn = 257000*15/100 = Rs. 38550 per year.Then monthly rent = 38550/12 = Rs. 3212.5.
Question 77,Ram spends 30% of his salary on house rent 30% of the rest he spends on his children's education and 24% of the total salary he spends on clothes. After his expenditure he is left with Rs. 2500. What is Ram's salary?,Rs. 11494.25,Rs. 20000,Rs. 10000,Rs. 15000,C, Let Ram's salary be x.He spends on rent = 30% of x = 30x/100.He spends on education = 30% from rest of the salary= (30*70x)/(100*100) = 21x/100.He Spends on clothes = 24% of total salary = 24x/100.Saving = 2500.Salary of ram = x.(30x/100) + (21x/100) + (24x/100) + 2500 = x.(75x/100) = x-2500.75x = 100x-250000.Or 100x-77x = 250000.Or x = 250000/25.Or x = 10000.Ram's salary = Rs. 10000.
Question 78,A report consists of 20 sheets each of 55 lines and each such line consist of 65 characters. This report is reduced onto sheets each of 65 lines such that each line consists of 70 characters. The percentage reduction in number of sheets is closer to,20%,5%,30%,35%,A, Let x be the page required when report is retyped.Now we can use work equivalence method;20*55*65 = 70*65*x;Or x = (20*55*65)/(70*65);Or x = 15.70 = 16 pages.Hence % reduction in pages = (20-16)*100/20 = 20%.
Question 79,The price of Maruti car rises by 30 percent while the sales of the car come down by 20%. What is the percentage change in the total revenue?,-4%,-2%,4%,2%,C, Let initial price of Maruti Car be Rs. 100.As price increases 30% price of car will become (100 +30% of 100) = Rs. 130.Due to increase in price sales is down by 20%. It means it is going make 20% less revenue as expected after increment of price.So New revenue = (130 - 20% of 130) = Rs. 104.The initial revenue was Rs. 100 which becomes Rs. 104 at the end. It means there is 4% increment in the total revenue.Mind Calculation Method:100==30%‰ Ô(price effect)==>130==20%‰ Ò(sales effects)==>104.Hence 4% rises.
Question 80,In an institute 60% of the students are boys and the rest are girls. Further 15% of the boys and 7.5% of the girls are getting a fee waiver. If the number of those getting a fee waiver is 90 find the total number of students getting 50% concessions if it is given that 50% of those not getting a fee waiver are eligible to get half fee concession?,360,280,320,330,D, Let us assume there are 100 students in the institute.Then number of boys = 60And number of girls = 40Further 15% of boys get fee waiver = 9 boys7.5 % of girls get fee waiver = 3 girlsTotal = 12 students who gets fee waiverBut here given 90 students are getting fee waiver. So we compare12 = 90So 1 = 90/12 = 7.5Now number of students who are not getting fee waiver = 51 boys and 37 girls.50% concession = 25.5 boys and 18.5 girls (i.e. total 44).Hence required students = 44*7.5 = 330.
Question 81,After three successive equal percentage rise in the salary the sum of 100 rupees turned into 140 rupees and 49 paise. Find the percentage rise in the salary.,12%,22%,66%,82%,A,We solve it through options. Choosing options for trial depends on mental thought.100 ==12% up ==>112 ==12% up ==>125.44 ==12% Up ==> 140.49So answer is 12%.
Question 82,A student took five papers in an examination where the full marks were the same for each paper. His marks in these papers were in the proportion of 6:7:8:9:10. In all papers together the candidate obtained 60% of the total marks then the number of papers in which he got more than 50% marks is,1,3,4,5,C, Let the marks obtained in five subjects be 6x 7x 8x 9x and 10x.Total marks obtained= 40xMax. Marks of the five subjects = 40x/0.6 [40x is 60% of total marks]Max. Marks in each subject = 40x/0.6*5 = 13.33xHence % of each subject = 6x*100/13.33 = 45.01%Or 7x*100/13.33 = 52.51In same way other percentage are 60.01% 67.52% 75.01%.Hence number of subjects in which he gets more than 50% marks = 4.
Question 83,The length breadth and height of a room are in ratio 3:2:1. If breadth and height are halved while the length is doubled then the total area of the four walls of the room will,remain the same,decrease by 13.64%,decrease by 15%,decrease by 30%,D, Let length breadth and height of the room be 3 2 1 unit respectively.Area of walls = 2(l+b)*h = 2(3+2)*1 = 10 sq. unit.Now length breadth and height of room will become 6 1 and 1/2 respectively.Now area of walls = 2(6+1)*1/2 = 7 sq. unit.% decrease in the area of walls = (10-7)*100/10 = 30%.
Question 84,One bacterium splits into eight bacteria of the next generation. But due to environment only 50% of one generation can produced the next generation. If the seventh generation number is 4096 million what is the number in first generation?,1 million,2 million,4 million,8 million,A, Let the number of bacteria in the 1st generation be x then number of bacteria in 2nd 3rd 4th . . . . . Generation would be8(x/2) 8(4x/2) 8(16x/2) . . . . And so on.As x 4x 16x 64x . . . . . it is in GP with common ratio 4.Hence 7th term of GPx(4)6 = 4096Or x = 1 or 1 million.
Question 85,The rate of increase of the price of sugar is observed to be two percent more than the inflation rate expressed in percentage. The price of sugar on January 1 1994 is Rs. 20 per kg. The inflation rates of the years 1994 and 1995 are expected to be 8% each. The expected price of sugar on January 1 1996 would be,Rs. 23.60,Rs. 24,Rs. 24.20,Rs. 24.60,C, Increase in the price of sugar = (8+2) = 10%Hence price of sugar on Jan. 1 1996= (20*110*110)/(100*100) = Rs. 24.20.
Question 86,In an examination questions were asked in five sections. Out of the total students 5% candidates cleared the cut-off in all the sections and 5% cleared none. Of the rest 25% cleared only one section and 20% cleared four sections. If 24.5% of the entire candidates cleared two sections and 300 candidates cleared three sections. Find out how many candidates appeared at the examination?,1000,1200,1500,2000,B, Passed in none = 5%Passed in all = 5%Passed in four = 20% 0f 90% = 18%Passed in three = 24.5%Passed in three =(100-5-5-22.5-24.5-18) = 25%.But given 300 students passed in three.Hence 25% = 300.So 100% = 1200.1200 students must have appeared.
Question 87,A clock is set right at 12 noon on Monday. It losses 1/2% on the correct time in the first week but gains 1/4 on the true time during the second week. The time shown on Monday after two weeks will be,12:25:12,11:34:48,12:50:24,12:24:16,A, Time lost over two weeks = 25% a week time(given that 1/2% clock loses in first week and in the second week it gains 1/4% on true time)A week = 168 hoursHence clock lost = 0.42 hours = 25.2 minutes or 25 minute 12 seconds.Thus correct time = 12:25:12.
Question 88,If a 36 inches long strip cloth shrinks to 33 inches after being washed how many inches long will the same strip remain after washing if it were 48 inches long?,47 inches,44 inches,45 inches,46 inches,B, Shrinking of cloth= [(36-33)/36]*100.= 100/12%Second time the strip shrinks= (48*100)/1200 = 4 incheshence  the cloth remains = 48-4 = 44.
Question 89,(X% of Y) +(Y% of X) is equal to:,X% of Y,20% of XY,2% of XY,2% of 100 XY,C, According to question(XY /100) + (YX /100)= 2XY /100= 2% of XY.
Question 90,A fraction in reduced form is such that when it is squared and then its numerator is reduced by 33(1/3)% and denominator is reduced to 20% its result is twice the original fraction. The sum of numerator and denominator is:,8,13,17,15,A, Let the fraction be x/y.When fraction is squared its numerator is reduced by 33(1/3) and denominator is reduced by 20%.According to question(x/y)2 * 33(1/3)%/20% = 2(x/y).Or (x/y)2 * (2/3)/(1/5) = 2(x/y).Or x/y = 3/5. Sum of numerator and denominator is(x+y) = 3+5= 8.
Question 91,A student appeared in the Mock CAT. The test paper contained 3 sections namely QA DI and VA. The percentage marks in all VA was equal to the average of percentage marks in all the 3 sections. Coincidentally if we reverse the digit of the percentage marks of QA we get the percentage marks of DI. The percentage marks in VA scored by student could be:,81,48,66,69,C, Let the percentage marks in QA =(10a +b)%Let the percentage marks in DI = (10b +a)%Let the percentage marks in VA = x%.Now according to the question we have[(10a+b) + x + (10b+a)] /3 = x‰ Õ11a + 11b + x = 3x.or x = 11(a +b) /2.Clearly we can see that the percentage of the VA section will be a multiple of 11.So required answer will be 66.
Question 92,A shopkeeper first raises the price of Jewellery by x% then he decreases the new price by x%. After such up down cycle the price of a Jewellery decreased by Rs. 21025. After a second up down cycle the Jewellery was sold for Rs. 484416. What was the original price of the jewellery.2,Rs. 526000,Rs. 600625,Rs. 525625,Rs. 500000,C, Let the initial price = Rs. 10000Pprice after first increment = 10000P + 100xP.price after first decrement = 10000P + 100xP - (100Px+Px2) = 10000P - Px2.Now total decrementPx2 = 21025 .............. (1)price after second increment10000P - Px2 + 100xP - Px3/100price after second increment10000P - P2 + 100xP - P3/100 - 100xP + Px3/100 - Px2 + Px4/10000= 10000P -2Px2+Px2/10000 = 484416 ............... (2)on solving equation equn (1) and (2) We getx = 20.substituting back we getP = 52.5625Therefore
Question 93,A company has 12 machines of equal efficiency in its factory. The annual manufacturing expenses are Rs. 24 000 and the establishment charges are Rs. 10 000. The annual output of the company is Rs. 48 000. The annual output and manufacturing costs are directly proportional to the no. of machines while the share holders get the 10% profit which is directly proportional to the annual output of the company. If 8.33% machines remained close throughout the year. Then the percentage decrease in the amount of share holders is :,14.28%,11.11%,16.66%,8.33%,A,No. of Machines Output Manuf. cost Est. cost Total cost Profit12 48 000 24 000 10 000 34 000 14 00011 44 000 22 000 10 000 32 000 12 000Profit= Output - total cost= 44000 - 32000= Rs. 12000Initial value of share holders= 14000 * (10/100)= Rs. 1400New value of share holders= 12000 *(10/100)= R
Question 94,Every month a man consumes 25 kg rice and 9 kg wheat. The price of rice is 20% of the price of wheat and thus he spends total Rs. 350 on the rice and wheat per month. If the price of wheat is increased by 20% then what is the percentage reduction of rice consumption for the same expenditure of Rs. 350? Given that the price of rice and consumption of wheat is constant :,40%,25%,36%,24%,C, Let the price of wheat is x per kg. Then price of wheat will be 5x per kg.Expenditure on rice = 25*x = 25x.Expenditure of wheat = 9*5x = 45x.Total cost25x + 45x = 350.70x = 350.x = 5.Hence price of Rice = Rs. 5 per kg.Price of wheat = 25 per kg.Now price of wheat = 25 ---- 20% ‰ Ô----> Rs. 30 per kg.Let the new amount of rice is N kg thenN*5 + 9*30 = 350.N = 16 kg.%decrease in the amount of rice = [(25-16)*100]/25 = 36%.
Question 95,The price of raw materials has gone up by 15% labour cost has also increased from 25% of the cost of raw material to 30% of the cost of raw material. By how much percentage should there be reduction in the usage of raw materials so as to keep the cost same?,28%,17%,27%,24%,B, Let the initial cost of raw material be 100. So initial labour cost was 25 and net cost was 125.Now15% increment in raw materials cost and labour cost has gone up to 30% from 25 %.Raw material cost = 115. AndLabour cost = (115 *30) = 34.5So New net cost= 115 + 34.5 = 149.5%reduction = 24.5/149.5 = 17%(approx.)
Question 96,A sales executive gets 20% bonus of the total sales value and 10% commission besides the bonus on the net profit after charging such commission. If the total sales value be Rs. 10 lakh per annum and the total profit of the company be Rs. 1.32 lakh then his total earning per annum will be given that he is not entitled to receive any fixed salary from the company :,2.3 lakh,2.32 lakh,2.12 lakh,3.2 lakh,C, His bonus= (20 *1000000) /100 = 2lakhTotal profit = net profit + (10 *net profit) /1001.32lakh = net profit *[1 + (10/100)]Net profit = 132000 /1.1 = 120000.Commission= (total profit - net profit)= 132000 - 120000= 12000.Hence his total earnings = 2lakh + 12000 = Rs. 212000.
Question 97,A shepherd had n goats in the year 2000. In 2001 the no. of goats increased by 40%. In 2002 the no. of goats declined to 70%. In 2003 the no. of goats grew up 30%. In 2004 he sold 10% goats and then he had only 34398 goats. The percentage increase of the no. of goats in this duration was :,16.66%,14.66%,11.33%,20%,B, There is no need of the number of goats given i.e. 34398.Initially let there be 100 goats. Then100 == 40% ‰ Ô==> 140 ==30%‰ Ò(declined to 70%)==> 98 ==30%‰ Ô ==> 127.4 ==10%‰ Ò(sold)==> 114.66Hence % increase = 14.66% [As 100 becomes 114.66].
Question 98,In an office in Singapore there are 60% female employees. 50 % of all the male employees are computer literate. If there are total 62% employees computer literate out of total 1600 employees then the no. of female employees who are computer literate ?,690,674,672,960,C, Total employees= 1600Female employees 60% of 1600.= (60 *1600) /100 = 960.Then male employees= 64050 % of male are computer literate= 320 male computer literate.62 % of total employees are computer literate= (62 *1600) /100 = 992 computer literate.Thus Female computer literate = 992 - 320= 672.Alternatively :Let 60% employees are female and 40% are male.Then 20% of male are computer literate and 42% are female computer literate.Female computer literate = (1600 *42) /100= 672.
Question 99,The price of a car depreciates in the first year by 25% in the second year by 20% in third year by 15% and so on. The final price of the car after 3 years if the present cost of the car is Rs. 1000000 :,780000,170000,690000,510000,D, Price after third depreciation100 ==25%‰ Ò ==> 75 == 20%‰ Ò==>60 == 15% ‰ Ò ==> 51.The price will be= Rs. 5 10 000.Alternatively :1000000*0.75*0.80*0.85 = Rs. 5 10 000.
Question 100,The actual area of a rectangle is 60 Cm2 but while measuring its length a student decreases it by 20% and the breadth increases by 25%. The percentage error in area calculated by the student is :,5%,15%,20%,No change,D, 100 ---- 25% ‰ Ô ---> 125 ----- 20% ‰ Ò -----> 100.So there is no change in the area of rectangle.Alternatively :Let area be 1.Area of rectangle= l *b= 0.8 *1.25= 1.
Question 101,The cost of packaging of the mangoes is 40% the cost of fresh mangoes themselves. The cost of mangoes increased by 30% but the cost of packaging decreased by 50% then the percentage change of the cost of packed mangoes if the cost of packed mangoes is equal to the sum of the cost of fresh mangoes and cost of packaging :,14.17%,7.14%,8.87%,6.66%,B, Cost of fresh mangoes + Cost of packaging = Total cost.Let initial Cost of fresh mangoes = 100.Then packaging cost = 40.Thus Initial total cost = 100 + 40 = 140After increasing in cost of fresh mangoes 30%Cost of fresh mangoes = 130And cost of packing go down by 50 % soCost of packing = 20.Now Total cost = 130 + 20 = 150.Increased cost = 150 - 140 = 10.% increased = (10*100) /140 = 7.14%.
Question 102,220% of a number X is 44. What is 44% of X.,8.8,8.9,6.6,7.7,A, Given220% of X = 44Or X = 20.Thus44% of 20= (44 *20) /100= 8.8
Question 103,The shopkeeper increased the price of a product by 25% so that customer finds difficult to purchase the required amount. But Somehow the customer managed to purchase only 70% of the required amount. What is the net difference in the expenditure on that product ?,55 more,10% more,12.5% less,17.5% less,C, Let initially the quantity and rate be 100 each.Quantity*rate = Expenditure100*100 = 10000Now Increase in price is 25% and new quantity is 70% of original.Quantity*rate = Expenditure70*125 = 8750Decreased expenditure= 10000-8750 = 1250% decrease= (1250*100)/10000= 12.5%.
Question 104,A customer asks for the production of x number of goods. The company produces y number of goods daily. Out of which z% are units for sale. The order will be completed in :,[ x /{100y *(1 -z)}] days,[(100yz) /x] days,[100x /{y(100 -z)}] days,100 / {y*(z -1)} days,C, Daily supply= (100-z)% of y= {(100-z)y}/100Thus required number of days= [(100x)/(100-z)y].
Question 105,In the Science City Kolkata the rate of the ticket is increased by 50% to increased the revenue but simultaneously 20% of the visitor decreased. What is percentage change in the revenue. if it is known that the Science city collects one revenue only from the visitors and it has no other financial supports:,20%,-25%,305,-30%,A, Let the initial revenue be 100.100 ----- 50% ‰ Ô (Ticket up)-----> 150 ----- 20% ‰ Ò (Visitors down) -----> 120.There is 20% increase in the revenue.
Question 106,600 students took the test on Physics and chemistry. 35% students failed in Physics and 45% students failed in chemistry and 40% of those who passed in chemistry also passed in Physics then how many students failed in both :,16,15,13,12,D,Result Physics ChemistryFailed 35% 45%Passed 65% 55%Now 55% of 600 passed in Chemistry = (55 X 600) / 100 = 330 From question 40% of those who passed in Chemistry(330 Students) also passed in physics => (40 X 330) / 100 = 132 so 132 students passed in bothTherefore % who passed in both = (132 X 100 ) / 600 = 22%Passed in both subject = 22% of total students% of students who passed in either Physics or Chemistry or both= (65 +55) -22 = 98%Thus percentage of students who failed in both subjects= 2%Number of students who failed = 2% of 600 = 12.
Question 107,An alloy contains the copper and aluminum in the ratio of 7:4. While making the weapons from this alloy 12% of the alloy got destroyed. If there is 12 kg of aluminum in the weapon then weight of the alloy required is :,14.4 kg,37.5 kg,40 kg,48 kg,B, Copper : Aluminum = 7 : 4.Let Copper and Aluminum in the weapon be 7x and 4x respectively.GivenAluminum in weapon = 12 kgSo‰ Õ 4x = 12.‰ Õ x = 3Copper = 7x = 7 * 3 = 21 Kg.Total alloy in the weapon = 12 + 21 = 33 kgBut 12% alloy get destroyed in making the weapon i.e. 88% alloy is used in the weapon so‰ Õ 88 % alloy = 33 kg‰ Õ 100 % alloy = 37.5 kg.
Question 108,80% of a smaller number is 4 less than 40% of a larger number. The larger number is 85 greater than the smaller one. The sum of these two number is,325,425,235,500,C, Let the smaller number be x and larger number be y.According to the question80% of x + 4 = 40% of y4y - 8x = 40y - 2x = 10 --------- (1)y - x = 85 ----------- (2)By using (1) and (2) we getx = 75y = 160x + y = 235.
Question 109,A number x is mistakenly divided by 10 instead of being multiplied by 10. what is the percentage error in the result?,-99%,-100%,99%,100%,A, Actual result = 10xBy mistake it has been divided by 10 = x /10% change = [10x -(10 /x) /10x] *100 = 99= - 99%.Since actual value is greater than the wrong value.AlternativelyLet x = 10Actual result = 10 * 10 = 100wrong result = 10 /10 = 1.Change = (1 -100) = -99% change = -99%.
Question 110,A college has raised 75% of the amount it needs for a new building by receiving an average donation of Rs. 600 from the people already solicited. The people already solicited represent 60% of the people the college will ask for donations. If the college is to raise exactly the amount needed for the new building what should be the average donation from the remaining people be solicited?,300,250,400,500,A, Let the number of people be x who has been asked for the donations.People already solicited = 60% of x = 0.6xRemaining people = 40% of x = 0.4xAmount collected from the people solicited= 600 *0.6x = 360x360x = 75% of the amount collected.Remaining amount = 25% = 120xThusAverage donations from remaining people= 120x /0.4x = 300.
Question 111,In the Bombay Stock Exchange there are 45% female employees and thus the number of male employees is exceeded by 72. Hence the total no. of employees in the BSE is:,540,720,800,550,B, Female employees = 45%Male employees = 55%Difference = 55 - 45 = 10%‰ Õ 10% = 72‰ Õ 1% = 72 /10‰ Õ 100 = 7.2 * 100 = 720.
Question 112,The average weight of a class of students is 67.5 kg. The weight of the class teacher is 25% more than the average weight of the class. The average weight of the class is less than the class teacher by x%. The value of x is:,33.335,25%,20%,22%,B, 100 ==25% ‰ Ô ==> 125 ==x%‰ Ò ==> 100.x% = (25 *100) /100 = 20%.We don't need the actual value to calculate the answer.
Question 113,Every day a mango seller sells half his stock 10% of the stock overnight gets spoiled. If 1983 mangoes rotted over 3 nights then how many did hi start with on the first day ?,25000,24000,30000,32000,B,Day 1 2 3Initial mangoes x (let) 0.45x 0.2025xSles 0.5x 0.225x 0.10125xOver night remaining 0.5x 0.225x 0.10125xRotten 0.05x 0.0225x 0.010125xNext day stock 0.45x 0.2025xthus Total mangoes rotten amount is=> 0.05x + 0.0225x + 0.010125x = 0.082625x= 1983x = 24 000.
Question 114,In a factory there are three types of machine M1 M2 and M3 which produces 25% 35% and 40% of the total products respectively. M1 M2 and M3 produces 2% 4% and 5% defective products respectively. what is the percentage of non-defective products ?,89%,97.10%,96.10%,86.10%,C, Non-defective products M1 = 25 X 0.98 = 24.5%Non-defective products M2 = 35 X 0.96 = 33.6%Non-defective products M3= 40 X 0.95 = 38%Percentage of non-defective products = 24.5 + 33.6 + 38 = 96.1%
Question 115,The square of a positive number is 2000% greater than the number itself then the square of that number is :,1762,1635,441,139,C, Let the positive number be X.According to the questionX * X = X + (X*2000)/100X2 = X + 20XX2 - 21X = 0X *(X - 21) = 0EitherX = 0 ORX = 2121 is the possible value. Then square of 21 is 441.
Question 116,The cost of a car is 400% greater than the cost of a bike. If there is an increase in the cost of the car is 15% and that of bike 20%. Then the total increase in the cost of the 5 cars and 10 bikes is:,17.50%,16(3/7)%,18.50%,18.25%,B, Let the bike's initial cost be X and then car's initial cost be 5X.After the increaseBike price = 1.2XCar price = 5.75XInitial total cost of 5 cars and 10 bikes= 25X+10X = 35XNew cost= 28.75X+12x = 40.75XChange in cost = (40.75X-35X) = 5.75X% change = (5.75X*100)/35 = 16(3/7)%.
