Question Name,Question,Option A,Option B,Option C,Option D,Answer,Explanation
Question 117,Connie has a number of gold bars all of different weights. She gives the 24 lightest bars which weigh 45% of the total weight to Brennan. She gives the 13 heaviest bars which weigh 26% of the total weight to Maya. She gives the rest of the bars to Blair. How many bars did Blair receive?,14,15,16,17,B, The average weight of the bars given to Brennan (light) < the average weight of the bars given to Blair < the average weight of the bars given to Maya (heavy).Let the total weight of all the bars be X.The weight of the bars given to Brennan= 45% of X = 0.45XThe weight of the bars given to Maya= 26 % of X = 0.26XThe weight of the bars given to Claire = rest = 29% of X = 0.29XThe average weight of the bars given to Brennan= Weight / number of bars = 0.45X/24The average weight of the bars given to Maya = Weight / number of bars = 0.26X/13Similarly if the number of bars given to Blair = Bthen the average weight of the bars given to Blair = 0.29X/BAs the average weight of the bars given to Brennan (light) < the average weight of the bars given to Blair < the average weight of the bars given to Maya
Question 118,At the beginning of a year the owner of a jewel shop raised the price of all the jewels in his shop by x% and lowered them by x%. The price of one jewel after this up and down cycle reduced by Rs.100.The owner carried out the same procedure after a month.After this second up-down cyclethe price of that jewel was Rs.2304.Find the original price of that jewel(in Rs.),2500,2550,2600,2650,A, Let the original price = yAfter first change It becomesy * (1+(x/100))After second change It becomesy *(1+(x/100))(1-(x/100)) = y(1-(x/100)^2 )Thusx2*y = 106 ------- (1)x2 = 106/yNowy(1-(106/10000y))2 = 2304(similar to above)y(1-100/y)2 = 2304y = 2500.
Question 119,From 2000 onwards till 2003 the price of computers increased every year by 10%. After that due to government subsidy the price of computers decreases every year by 10%. The price of a computer in 2006 will be approx. how much per cent less than the price in 2000 if the same pattern of price is continued :,2,3,4,5,B,Year Value2000 100 (Let)2001 1102002 1212003 133.12004 119.792005 107.8112006 97.0299Now[(100-97.0299)*100]/100 ‰äö 3
Question 120,In how many ways can 8 Indians and 4 American and 4 Englishmen can be seated in a row so that all person of the same nationality sit together?,3! 4! 8! 4!,3! 8!,4! 4!,8! 4! 4!,A, Taking all person of same nationality as one person then we will have only three people.These three person can be arranged themselves in 3! Ways.8 Indians can be arranged themselves in 8! Way.4 American can be arranged themselves in 4! Ways.4 Englishman can be arranged themselves in 4! Ways.Hence required number of ways = 3!*8!*4!*4! Ways.
Question 121,How many Permutations of the letters of the word APPLE are there?,600,120,240,60,D, APPLE = 5 letters.But two letters PP is of same kind.Thus required permutations= 5!/2!= 120/2= 60.
Question 122,In how many ways can 10 examination papers be arranged so that the best and the worst papers never come together?,8*9!,8*8!,7*9!,9*8!,A, No. of ways in which 10 paper can arranged is 10! Ways.When the best and the worst papers come together regarding the two as one paper we have only 9 papers.These 9 papers can be arranged in 9! Ways.And two papers can be arranged themselves in 2! Ways.No. of arrangement when best and worst paper do not come together= 10!- 9!.2! = 9!(10-2) = 8.9!.
Question 123,In how many ways 4 boys and 3 girls can be seated in a row so that they are alternate.,144,288,12,256,A, Let the Arrangement beB G B G B G B4 boys can be seated in 4! Ways.Girl can be seated in 3! Ways.Required number of ways= 4!*3! = 144.
Question 124,A two member committee comprising of one male and one female member is to be constitute out of five males and three females. Amongst the females. Ms. A refuses to be a member of the committee in which Mr. B is taken as the member. In how many different ways can the committee be constituted ?,11,12,13,14,D, 5C1 * 3C1 -1= 15-1= 14
Question 125,In how many ways 2 students can be chosen from the class of 20 students?,190,180,240,390,A, Number of ways = 20C2 = 20!/(2! 18!)= 20*19/2= 190.
Question 126,Three gentlemen and three ladies are candidates for two vacancies. A voter has to vote for two candidates. In how many ways can one cast his vote?,9,30,36,15,D, There are 6 candidates and a voter has to vote for any two of them.So the required number of ways is= 6C2 = 6!/2!*4!= 15.
Question 127,A question paper has two parts A and B each containing 10 questions. If a student has to choose 8 from part A and 5 from part B in how many ways can he choose the questions?,11340,12750,40,320,A, There 10 questions in part A out of which 8 question can be chosen as = 10C8.Similarly 5 questions can be chosen from 10 questions of Part B as = 10C5.Hence total number of ways=10C8*10C5=[10!/(2!8!)]*[10!/(5!*5)]= {10*9/2}*{10*9*8*7*6/(5*4*3*2*1)}= 11340.
Question 128,Find the number of triangles which can be formed by joining the angular points of a polygon of 8 sides as vertices.,56,24,16,8,A, A triangle needs 3 points.And polygon of 8 sides has 8 angular points.Hence number of triangle formed= 8C3 = (8*7*6)/(1*2*3)= 56.
Question 129,There are 10 points in a plane out of which 4 are collinear. Find the number of triangles formed by the points as vertices.,120,116,140,20,B, The number of triangle can be formed by 10 points = 10C3.Similarly the number of triangle can be formed by 4 points when no one is collinear=4C3.In the question given 4 points are collinear Thus required number of triangle can be formed= 10C3-4C3 = 120-4 = 116.
Question 130,In a party every person shakes hands with every other person. If there are 105 hands shakes find the number of person in the party.,15,14,21,25,A, Let n be the number of persons in the party. Number of hands shake = 105; Total number of hands shake is given by nC2.Now according to the questionnC2 = 105;Or n!/[2!*(n-2)!] = 105;Or n*(n-1)/2 = 105;Or n2-n = 210;Or n2-n-210 = 0;Or n = 15 -14;But we cannot take negative value of n.So n = 15 i.e. number of persons in the party = 15.
Question 131,The number of positive integers which can be formed by using any number of digits from 012345 without repetition.,1200,1500,1600,1630,D, One digit positive numbers = 5.Two digit positive numbers = 25.Three digit positive numbers = 100.4 digit positive numbers = 300.5 digit positive numbers = 600.Six digit positive numbers = 600.Total positive numbers= 5+25+100+300+600+600= 1630.
Question 132,In the next World cup of cricket there will be 12 teams divided equally in two groups. Teams of each group will play a match against each other. From each group 3 top teams will qualify for the next round. In this round each team will play against each others once. Four top teams of this round will qualify for the semifinal round where they play the best of three matches. The Minimum number of matches in the next World cup will be:,54,53,38,43,B, The number of matches in first round= 6C2 +6C2;Number of matches in next round= 6C2;Number of matches in semifinals= 4C2;Total number of matches= 6C2 +6C2+6C2+4C2+2.= 53.
Question 133,There are 10 person among whom two are brother. The total number of ways in which these persons can be seated around a round table so that exactly one person sit between the brothers  is equal to:,2!*7!,2!*8!,3!*7!,3!*8!,A, Total number of ways = 7!*2!.
Question 134,If letters of the work KUBER are written in all possible orders and arranged as in a dictionary then the rank of the word KUBER will be:,67,68,65,69,A, Total words starting with B = 4! = 24Total words starting with E = 4! = 24Total words starting with KB = 3!=6Total words starting with KE = 3! = 6Total words starting with KR = 3! = 6If Starting word will be KUBER then rank of KUBER= 24+24+18+1 = 67.
Question 135,A letter lock consists of 4 rings each ring contains 9 non-zero digits. This lock can be opened by setting four digit code with the proper combination of each of the 4 rings. Maximum how many codes can be formed to open the lock ?,49,94,9P4,None of these,B, There are 9 non-zero digits to arrange themselves at 4 different position. Each letter can be arrange at different position in 9 different ways.So required number of ways= 9 *9 *9 *9= 94.
Question 136,10 students are to be seated in two rows equally for the Mock test in a room. There are two sets of papers Code A and Code B. each of two rows can have only one set of paper but different that from other row. In how many ways these students can be arranged ?,2775600,125600,7257600,1200560,C, 5 students can be seated out of 10 students in 10C5 ways .Remaining 5 will be seated in= 5C5 ways .Students of each row can be arranged as= 5! *5! ways.Two sets of paper can be arranged themselves in= 2! ways.Thus Total arrangement= 10C5 * 5! *5! *2= 7257600.
Question 137,How many ways can 4 prizes be given away to 3 boys if each boy is eligible for all the prizes?,256,24,12,None of these,B, Let the 3 boys be B1 B2 B3 and 4 prizes be P1 P2 P3 and P4.Now B1 is eligible to receive any of the 4 available prizes (so 4 ways).B2 will receive prize from rest 3 available prizes(so 3 ways).B3 will receive his prize from the rest 2 prizes available(so 2 ways).So total ways would be: 4*3*2*1=24 Ways.Hence the 4 prizes can be distributed in 24 ways.
Question 138,Find the number of ways in which 8064 can be resolved as the product of two factors?,22,24,21,20,B, Total number of ways in which 8064 can be resolved as the product of two factors is 24 as below:(18064) (24032) (32688) (42016) (61344) (71152)(81008) (9896) (12672) (14576) (16504) (18448) (21884) (24336) (28288) (32252) (36224) (42192) (48168) (56144) (63128) (68126) (72112) (8496).
Question 139,The letter of the word LABOUR are permuted in all possible ways and the words thus formed are arranged as in a dictionary. What is the rank of the word LABOUR?,242,240,251,275,A, The order of each letter in the dictionary is ABLORU.Now with A in the beginning the remaining letters can be permuted in 5! ways.Similarly with B in the beginning the remaining letters can be permuted in 5! ways.With L in the beginning the first word will be LABORU the second will be LABOUR.Hence the rank of the word LABOUR is5!+5!+2 = 120 +120 +2 =242.Note: 5! = 5*4*3*2*1 = 120.
Question 140,A class photograph has to be taken. The front row consists of 6 girls who are sitting. 20 boys are standing behind. The two corner positions are reserved for the 2 tallest boys. In how many ways can the students be arranged?,6! ÌÑ 1440,18! ÌÑ 1440,18! ÌÑ2! ÌÑ 1440,None of these,B, Two tallest boys can be arranged in 2! ways rest 18 can be arranged in 18! ways.Girls can be arranged in 6! ways.Total number of ways in which all the students can be arranged=2!ÌÑ18!ÌÑ6!= 18! ÌÑ1440.Note:N! = N * (N-1)*(N-2)* . . . * 1.So18! = 18*17*16*15* ........ *1.
Question 141,If 5* nP3 = 4* (n+1)P3 find n?,10,11,12,14,D, nP3 = n*(n‰ÛÒ1)*(n‰ÛÒ2).(n+1)P3 =(n+1)*n*(n‰ÛÒ1).Now5*n*(n‰ÛÒ1)*(n‰ÛÒ2) = 4* (n+1)*n*(n‰ÛÒ1).Or 5(n‰öÕ2) = 4(n+1).Or 5n‰öÕ10 = 4n+4.Or 5n‰öÕ4n = 4+10.Hence n = 14.Note: nPr = [n! /(n -r)!].
Question 142,Ten different letters of alphabet are given words with 5 letters are formed from these given letters. Then the number of words which have at least one letter repeated is:,69760,30240,99748,42386,A, Number of words which have at least one letter replaced= Total number of words - total number of words in which no letter is repeated.=> 105 ‰ÛÒ 16P5.=> 100000 ‰öÕ 30240 = 69760.
Question 143,12 chairs are arranged in a row and are numbered 1 to 12. 4 men have to be seated in these chairs so that the chairs numbered 1 to 8 should be occupied and no two men occupy adjacent chairs. Find the number of ways the task can be done.,360,384,432,470,B, Given there are 12 numbered chairs such that chairs numbered 1 to 8 should be occupied.1 2 3 4 5 6 7 8 9 10 11 12.The various combinations of chairs that ensure that no two men are sitting together are listed.(1 3 5__) The fourth chair can be 561011 or 12 hence 5 ways.(1 4 8 __) The fourth chair can be 61011 or 12 hence 4 ways.(1 5 8 __) the fourth chair can be 1011 or 12 hence 3 ways.(1 6 8__) the fourth chair can be 1011 or 12 hence 3 ways.(181012) is also one of the combinations.Hence 16 such combinations exist.In case of each these combinations we can make the four men inter arrange in 4! ways.Hence the required result =16ÌÑ4!= 384.
Question 144,How many words can be formed by re-arranging the letters of the word ASCENT such that A and T occupy the first and last position respectively?,6! *2!,6! 2!,4!,5!,C, As A and T should occupy the first and last position the first and last position can be filled in only one following way.A _ _ _ _ T.The remaining 4 positions can be filled in 4! Ways by the remaining words (SCENT).Hence by rearranging the letters of the word ASCENT we can form1x4!= 4! Words.
Question 145,If 6Pr = 360 and If 6Cr = 15 find r ?,5,6,4,3,C, nPr = nCrÌÑr!6Pr = 15 *r!360 =15 *r!r! =360 /15 =24r! = 4*3*2*1=> r! =4!Therefore r = 4.
Question 146,In how many ways can six different rings be worn on four fingers of one hand?,10,12,15,16,C, Required number of ways= 6C4= (6 *5) /2 = 15 ways.
Question 147,There are 7 non-collinear points. How many triangles can be drawn by joining these points?,35,10,8,7,A, A triangle is formed by joining any three non-collinear points in pairs.There are 7 non-collinear points.The number of triangles formed= 7C3= [{7 *(7‰öÕ1) *(7‰öÕ2)} /3! ]=(7 *6 *5)/(3 *2 *1) = 7 *5 = 35.
Question 148,From 6 men and 4 ladies a committee of 5 is to be formed. In how many ways can this be done if the committee is to include at least one lady?,246,340,290,315,A, To committee can be formed in the following ways(1 lady + 4 gents) or (2 ladies + 3 gents) or (3 ladies + 2 gents) or (4 ladies + 1 gents) or (5 ladies + 0 gents).Total number of possible arrangements(4C1 * 6C4)+(4C2 * 6C3)+(4C3 *6C2)+(4C4 *6C1).=> 60 +120 +60 +6 = 246.
Question 149,A question paper consists of three sections 45 and 6 questions respectively. Attempting one question from each section is compulsory but a candidate need not attempt all the questions. In how many ways can a candidate attempt the questions?,209,(4!-1)*(5!-1)*(6!-1),119,29295,D,At least 1 question from each section is compulsory so from the 1st section the candidate can attempt 1 or 2 or 3 or 4 questions.In each section each question can be dealt with in 2 ways i.e. either he attempts it or leaves it.So far 4 question there are 2 *2 *2 *2 ways to attempt. As he has to attempt at least 1 question the total number of ways in which he can attempt questions from 1st section is 24‰öÕ1.Similarly for the 2nd section there are 25‰öÕ1 ways in which he can attempt and for the 3rd section there are 26‰öÕ1 ways.The ways in which the attempts one or more questions in any section is independent of the number of ways in which he attempts one or more questions from the other sections.Thus total number of ways
Question 150,In how many ways a President VP and Water-boy can be selected from a group of 10 people.,10C3,10P3,240,360,B, We are selecting three different posts here so order matters.Thus total ways of selecting a President VP and Water-boy from a group of 10 people would be 10P3.
Question 151,In a hockey championship there are 153 matches played. Every two team played one match with each other. The number of teams participating in the championship is:,18,19,17,16,A, Let there were x teams participating in the games then total number of matches= nC2 =153.On solving we get n = ‰öÕ17 and n =18.It cannot be negative so n = 18.
Question 152,A box contains 10 balls out of which 3 are red and rest are blue. In how many ways can a random sample of 6 balls be drawn from the bag so that at the most 2 red balls are included in the sample and no sample has all the 6 balls of the same colour?,105,168,189,120,B, Six balls can be selected in the following waysOne red ball and 5 blue ballsOr Two red balls and 4 blue balls.Total number of ways=(3C1 *7C5)+(3C2 *4C7)= 63 +105 = 168.
Question 153,Out of eight crew members three particular members can sit only on the left side. Another two particular members can sit only on the right side. Find the number of ways in which the crew can be arranged so that four men can sit on each side.,864,863,865,1728,D, Required number of ways = 3C2 *4! *4! = 1728.
Question 154,A man positioned at the origin of the coordinate system. the man can take steps of unit measure in the direction North East West or South. Find the number of ways of he can reach the point (56) covering the shortest possible distance.,252,432,462,504,C, In order to reach (56) covering the shortest distance at the same time the man has to make 5 horizontal and 6 vertical steps.The number of ways in which these steps can be taken is given by[11! /(5! *6!)] = 462.
Question 155,There are 6 equally spaced points ABCDE and F marked on a circle with radius R. How many convex pentagons of distinctly different areas can be drawn using these points as vertices?,6P5,1,5,None of these,D, Since all the points are equally spaced; hence the area of all the convex pentagons will be same.
Question 156,In an examination paper there are two groups each containing 4 questions. A candidate is required to attempt 5 questions but not more than 3 questions from any group. In how many ways can 5 questions be selected?,24,48,96,64,B, 5 questions can be selected in the following ways2 question from first group and 3 question from second group Or 3 question from first group and 2 question from second group.(4C2 * 4C3) +(3C4 *2C4)= 24 +24 = 48
Question 157,After every get-together every person present shakes the hand of every other person. If there were 105 handshakes in all how many persons were present in the party?,16,15,13,14,B, Let total number of persons present in the party be xThen[{x *(x‰öÕ1)}/2] = 105.x = 15.
Question 158,How many diagonals can be drawn in a pentagon?,5,10,8,7,A, A pentagon has 5 sides. We obtain the diagonals by joining the vertices in pairs.Total number of sides and diagonals= 5C2= (5 *4) /(2 *1)= 5ÌÑ2 =10This includes its 5 sides also.=> Diagonals =10‰ÛÒ5 =5Hence the number of diagonals=10‰ÛÒ5= 5
Question 159,There are five women and six men in a group. From this group a committee of 4 is to be chosen. How many different ways can a committee be formed that contain three women and one man?,55,60,25,192,B, Since no order to the committee is mentioned a combination instead of a permutation is used.Let's sort out what we have and what we want.Have: 5 women 6 men.Want: 3 women AND 1 man.The word AND means multiply.Woman and MenhaveCwant *haveCwant=> 5C3 *6C1= 60.
Question 160,Find the total number of distinct vehicle numbers that can be formed using two letters followed by two numbers. Letters need to be distinct.,60000,65000,70000,75000,B, Out of 26 alphabets two distinct letters can be chosen in 26P2 ways.Coming to numbers part there are 10 ways (any number from 0 to 9 can be chosen) to choose the first digit and similarly another 10 ways to choose the second digit.Hence there are totally 10 *10 = 100 ways.Combined with letters there are26P2 *100 = 65000 ways to choose vehicle numbers.
Question 161,In a railway compartment there are 2 rows of seats facing each other with accommodation for 5 in each 4 wish to sit facing forward and 3 facing towards the rear while 3 others are indifferent. In how many ways can the 10 passengers be seated?,172000,12600,45920,43200,D,The four person who wish to sit facing forward can be seated in: 5P4 ways and 3 who wish to sit facing towards the rear can be seated in: 5P3 ways and the remaining 3 can be seated in the remaining 3 seats in 3P3 ways. Total number of ways =5P4 *5P3 *3P3 = 43200.
Question 162,There are three prizes to be distributed among five students. If no students gets more than one prize then this can be done in:,10 ways,30 ways,60 ways,80 ways,A, 3 prize among 5 students can be distributed in5C3 ways = 10 ways.
Question 163,A teacher of 6 students takes 2 of his students at a time to a zoo as often as he can without taking the same pair of children together more than once. How many times does the teacher go to the zoo?,10,12,15,20,C, Two students can be selected from 6 in 6C2 =15 ways.Therefore the teacher goes to the zoo 15 times.
Question 164,A family consist of a grandfather 5 sons and daughter and 8 grandchildren. They are to be seated in a row for dinner. The grandchildren wish to occupy the 4 seats at each end and the grandfather refuses to have a grandchild on either side of him. The number of ways in which the family can be made to sit is:,21530,8! * 360,8! * 480,8! * 240,C, Total no. of seats= 1 grandfather+ 5 sons and daughters + 8 grandchildren= 14.The grandchildren can occupy the 4 seats on either side of the table in 4! = 24 ways.The grandfather can occupy a seat in (5-1)= 4 ways (4 gaps between 5 sons and daughter).And the remaining seats can be occupied in 5!= 120 ways (5 seat for sons and daughter).Hence total number of required ways= 8! ÌÑ 480
Question 165,If the letters of the word CHASM are rearranged to form 5 letter words such that none of the word repeat and the results arranged in ascending order as in a dictionary what is the rank of the word CHASM?,24,31,32,30,C, The 5 letter word can be rearranged in 5! =120 Ways without any of the letters repeating.The first 24 of these words will start with A.Then the 25th word will start will CA _ _ _.The remaining 3 letters can be rearranged in 3! =6 Ways.i.e. 6 words exist that start with CA.The next word starts with CH and then A i.e. CHA _ _.The first of the words will be CHAMS. The next word will be CHASM.Therefore the rank of CHASM will be 24 +6 +2= 32.
Question 166,In how many ways can 5 different toys be packed in 3 identical boxes such that no box is empty if any of the boxes may hold all of the toys?,20,30,25,600,C, The toys are different; The boxes are identical.If none of the boxes is to remain empty then we can pack the toys in one of the following ways:Case i. 2 2 1Case ii. 3 1 1Case i:Number of ways of achieving the first option 2 2 1.Two toys out of the 5 can be selected in 5C2 ways. Another 2 out of the remaining 3 can be selected in 3C2 ways and the last toy can be selected in 1C1 way.However as the boxes are identical the two different ways of selecting which box holds the first two toys and which one holds the second set of two toys will look the same. Hence we need to divide the result by 2.Therefore total number of ways of achieving the 2 2 1 option is:(
Question 167,where n! means n factorial or n(n-1)(n-2) ............1.,n *(n‰öÕ1) *(n‰öÕ1)!,[(n+1)!/{n*(n‰öÕ1)}],(n+1)! ‰öÕn!,(n+1)! ‰öÕ1!,D, 1*1! =(2-1)81! =2 *1! -1*1!= 2!-1!2*2!=(3-1)*2!=3*2!-2!=3!-2!3*3!=(4-1)*3! =4*3!-3! = 4!-3!......n*n!=(n+1-1)*n! =(n+1)(n!)-n!=(n+1)!-n!Summing up all these terms we get (n+1)! - 1!
Question 168,When six fair coins are tossed simultaneously in how many of the outcomes will at most three of the coins turn up as heads?,25,41,22,42,D, The question requires you to find number of the outcomes in which at most 3 coins turn up as heads.i.e. 0 coins turn heads or 1 coin turns head or 2 coins turn heads or 3 coins turn heads.The number of outcomes in which 0 coins turn heads is6C0 = 1 outcome.The number of outcomes in which 1 coin turns head is6C1 = 6 outcomes.The number of outcomes in which 2 coins turn heads is6C2 = 15 outcomes.The number of outcomes in which 3 coins turn heads is6C3 = 20 outcomes.Therefore total number of outcomes =1+6+15+20= 42 outcomes.
Question 169,A college has 10 basketball players. A 5 member's team and a captain will be selected out of these 10 players. How many different selections can be made?,1260,210,10C6 *6!,10C5 *6,C, A team of 6 members has to be selected from the 10 players. This can be done in 10C6 or 210 ways.Now the captain can be selected from these 6 players in 6 ways.Therefore total ways the selection can be made is 210 *6= 1260.Alternatively we can select the 5 member team out of the 10 in 10C5 ways = 252 ways.The captain can be selected from amongst the remaining 5 players in 5 ways.Therefore total ways the selection of 5 players and a captain can be made=252 *5= 1260
Question 170,How many four letter distinct initials can be formed using the alphabets of English language such that the last of the four words is always a consonant?,263 *21,26*25*24*21,25*24*23*21,None of these,A, The last of the four letter words should be a consonant. Therefore there are 21 options.The first three letters can be either consonants or vowels. So each of them have 26 options. Note that the question asks you to find out the number of distinct initials and not initials where the letters are distinct.Hence required answer =26ÌÑ26ÌÑ26ÌÑ21 = 263 *21.
Question 171,What is the total number of ways in which Dishu can distribute 9 distinct gifts among his 8 distinct girlfriends such that each of them gets at least one gift?,72 * 8!,144 * 8!,36 * 8!,9!,C, One among 8 gfs will get 2 gifts and remaining 7 will get one. So total of 9 gifts will be distributed among 8 gfs. i.e; 11111112.Gf who will get 2 gifts can be find out in 8C1 ways=8 ways.now now 2 gifts can be given to selected gf in 9C2 ways. And remaining 7 gifts can be given to remaining 7 gf in 7! ways.So total no of ways= 8*9C2*7!=8*(9*8)/2*7!=36*8*7!=36*8!
